,Unnamed: 0,Name,Specialization,Experience (in years),Education,Fee at clinic,Online Fee,Clinic Name,Area,Recently Consulted for,Available From,Available Till,City,Unnamed: 0.1
1400,250,Dr. Manjiri Kawde,Gynaecologist,32,"MBBS, DGO",₹ 500,,Pristyn Care Clinic,Mumbai,,5:00 PM,8:00 PM,Mumbai,
1401,251,Dr. Amit Agrawal,Gynaecologist,13,"MBBS, DNB - Obstetrics & Gynecology",₹ 500,,Pristyn Care,Sector 15 Vashi,,5:00 PM,8:00 PM,Mumbai,
1402,252,Dr. Jagdip Shah,Gynaecologist,43,"MD - Obstetrics & Gynaecology, DGO, MBBS, MCPS",,₹ 500,Parakh Hospital,Ghatkopar East,"Sex Education, No Periods, Trying to ConceiveNext ",1:00 PM,2:30 PM,Mumbai,
1403,253,Dr. Veena G Shinde,Gynaecologist,36,"MBBS, MD - Obstetrics & Gynaecology, DGO",,₹ 300,Cloudnine Hospital,Malad West,"No Periods, Sex Education, Irregular PeriodsNext ",11:00 AM,3:00 PM,Mumbai,
1404,254,Dr. Jayanti Kamat,Gynaecologist,31,"MBBS, MD - Obstetrics & Gynaecology, Advanced Infertility",₹ 800,₹ 500,Shrishti Fertility Care Center & Women's clinic,Jogeshwari East,"No Periods, Irregular Periods, Pregnancy QueryNext ",5:00 PM,7:00 PM,Mumbai,
1405,255,Dr. Shiwani Agarwal,Gynaecologist,23,"DNB (Obstetrics and Gynecology), MBBS",₹ 700,₹ 500,SpringDale Gynaecare,Kandivali East,"Pregnancy, Sex Education, Pregnant Women CounselingNext ",7:30 PM,9:30 PM,Mumbai,
1406,256,Dr. Bhavini Shah Balakrishnan,Gynaecologist,17,"DNB (Obstetrics and Gynecology), DGO, MBBS Bachelor of Medicine and Bachelor of Surgery",,₹ 500,Mummas Clinic,Mumbai,"Womens Health, Pregnancy, Fertile PeriodNext ",6:00 PM,8:00 PM,Mumbai,
1407,257,Dr. Neelima Mantri,Gynaecologist,20,"MBBS, MS - Obstetrics and Gynaecology, Fellowship in Gynaecology & Laprascopy",,₹ 350,Bombay Hospital & Medical Research Centre,Marine Lines,"Polycystic Ovary Syndrome Treatment, Family Planning, Polycystic Ovary SyndromeNext ",10:00 AM,5:00 PM,Mumbai,
1408,258,Dr. Niraj Mahajan,Gynaecologist,21,MD - Obstetrtics & Gynaecology,,₹ 500,Apollo Spectra Hospital,Tardeo,"Abortion, Delivery, Ovarian Cysts",6:00 PM,9:00 PM,Mumbai,
1409,259,Dr. Vandana Walvekar,Gynaecologist,55,MD,,₹ 500,Thakur Clinic,Mumbai,"No Periods, Sex Education, PregnancyNext ",10:30 AM,12:00 PM,Mumbai,
1410,260,Dr. Dimpy Irani,Gynaecologist,27,"MD - Obstetrics & Gynaecology, MBBS, DGO, DNB",,,,,,4:00 PM,8:00 PM,Mumbai,
1411,261,Dr. Vrunda Karanjgaokar,Gynaecologist,26,"FRCOG (LONDON) (Fellow of Royal College of Obstetricians and Gynaecologists), CCT (Lon), D...read more",,₹ 550,Lifecare Hospital,Prabhadevi,Polycystic Ovary SyndromeNext ,7:00 PM,9:00 PM,Mumbai,
1412,262,Dr. Kazi Trupti,Gynaecologist,29,"MRCOGI, DGO, MBBS",,,,,,7:00 PM,8:00 PM,Mumbai,
1413,263,Dr. Sudha Mukul Marwah,Gynaecologist,44,"MS - Ophthalmology, MBBS",,,,,Womens HealthNext ,2:00 PM,7:00 PM,Mumbai,
1414,264,Dr. Hemlata Hardasani,Gynaecologist,28,"MBBS, DGO",,₹ 400,Mothers Care Clinic,Veera Desai Road,"Trying to Conceive, Polycystic Ovary Syndrome, PregnancyNext ",10:00 AM,1:30 PM,Mumbai,
1415,265,Dr. Shilpa Bansal Agrawal,Gynaecologist,19,"MBBS, MD - Obstetrtics & Gynaecology, DNB, Fellowship In Infertility",,₹ 700,Harleys Cosmetic & Women Clinic,Andheri West,"Sex Education, Polycystic Ovary Syndrome, Pregnancy QueryNext ",12:00 PM,3:00 PM,Mumbai,
1416,266,Dr. Poonam Nautiyal,Gynaecologist,24,"DNB - Obstetrics & Gynecology, DGO, MBBS, Royal College of Obstetricians and Gynaecologist...read more",,,,,"Breast Examination, Abortion, Gynae ProblemsNext ",10:00 AM,12:00 PM,Mumbai,
1417,267,Dr. Raju Manmohan,Gynaecologist,32,"MBBS, DGO, MD - Family Medicine",,₹ 750,Fortune Surgical Clinic,Mumbai,,1:00 PM,2:00 PM,Mumbai,
1418,268,Dr. Sonali Tawde,Gynaecologist,21,"MBBS, MS - Obstetrics & Gynaecology & Fellowship In Fertility ( IVf Specialist ), Dnb - Ob...read more",₹ 700,,Aveta Fertility Clinic,Mulund West,DeliveryNext ,2:00 PM,7:30 PM,Mumbai,
1419,269,Dr. Nutan Hegde,Gynaecologist,17,"MBBS, DGO, MRCOG",₹ 800,₹ 600,Sapale's Polyclinic,Mumbai,"Trying to Conceive, Irregular Periods, No PeriodsNext ",6:00 PM,8:30 PM,Mumbai,
1420,270,Dr. Ameya S Kanakiya,Gynaecologist,18,"MBBS, DNB, DGO, CCGDM",,,,,,5:00 PM,7:00 PM,Mumbai,
1421,271,Dr. Anita Mathew,Gynaecologist,33,"MBBS, MD, DGO",₹ 600,,Meera Hospital - Kalyan West,Kalyan West,,10:00 AM,5:00 PM,Mumbai,
1422,272,Dr. Sunita Jonwal,Gynaecologist,18,"MD - Ayurveda , MD-GYNEC",₹ 800,₹ 400,Dr. Jonwal's NapAyurVeda Panchkarm & Wellness,MHADA Colony,DeliveryNext ,10:30 AM,8:00 PM,Mumbai,
1423,273,Dr. Priti Nandanwar,Gynaecologist,32,"MBBS, DGO, DFP, MCCG",₹ 800,₹ 800,Women's Health Care Clinic,Kurla East,,11:00 AM,2:00 PM,Mumbai,
1424,274,Dr. Nanavati Murari Suresh,Gynaecologist,45,"MD - Obstetrics & Gynaecology , DNB (Obstetrics and Gynecology), F.C.P.S.(Mid. & Gynae), D...read more",,,,,,9:00 AM,11:00 AM,Mumbai,
1425,275,Dr. Mridula Sarda,Gynaecologist,16,"DGO, Dnb, MRCOG(UK)",₹ 500,₹ 500,Sarda clinic,Vile Parle East,,5:00 PM,9:00 PM,Mumbai,
1426,276,Dr. Kishori Dinendra Kadam,Gynaecologist,42,"MBBS, DGO, MD - Obstetrics & Gynaecology",,₹ 350,Ashirwad Maternity & Nursing Home,Mulund West,,6:30 PM,8:00 PM,Mumbai,
1427,277,Dr. Girish Dani,Gynaecologist,52,"MD - Obstetrtics & Gynaecology, FCPS, DGO, Diploma of the Faculty of Family Planning (DFFP)",,₹ 400,Aastha Hospital,Mumbai,"Infertility Treatment, Infertility, FertilityNext ",11:00 AM,1:00 PM,Mumbai,
1428,278,Dr. Tejaswi Kamble,Gynaecologist,15,"MS - Obstetrics and Gynaecology, MBBS",,,,,,1:00 PM,5:00 PM,Mumbai,
1429,279,Dr. Archana Rajesh Patil,Gynaecologist,30,"MBBS, MD - Obstetrics & Gynaecology",₹ 600,₹ 500,New Manak Healthcare Hospital,Nerul West,,,,Mumbai,
1430,280,Dr. Pooja Sharma Dimri,Gynaecologist,25,"Minimal invasive surgery in gynaecology, MD - Obstetrtics & Gynaecology, DNB, MBBS",₹ 700,₹ 300,Siddhi Polyclinic (on call),Mumbai,"Ovarian Cysts, Pregnancy, Irregular PeriodsNext ",5:00 PM,7:00 PM,Mumbai,
1431,281,Dr. Shabnam Singh,Gynaecologist,21,"MBBS, M.S. Obstetrics & Gynecology",,₹ 300,Dr Shabnam Singh,Mumbai,,4:00 PM,8:00 PM,Mumbai,
1432,282,Dr. Nanda Kumar,Gynaecologist,20,"MBBS, DGO",,₹ 500,Dr.Nanda Kumar Clinic,Chembur East,"No Periods, Irregular Periods, Polycystic Ovary SyndromeNext ",5:30 PM,9:00 PM,Mumbai,
1433,283,Dr. Komal Chavan,Gynaecologist,7,"FICOG, Diploma in IVF and Reproductive  Medicine, Diploma in IVF and Reproductive  Medicin...read more",,₹ 500,CHAVAN MATERNITY NURSING HOME,Andheri West,PregnancyNext ,4:00 PM,9:00 PM,Mumbai,
1434,284,Dr. Sangeeta Raodeo,Gynaecologist,18,"DGO, FCPS - Mid. & Gynae",,₹ 350,Fortis Hospital,Mulund West,,1:00 PM,3:00 PM,Mumbai,
1435,285,Dr. Swati Chitnis,Gynaecologist,13,"MS - Obstetrics and Gynaecology, MBBS, DNB (Obstetrics and Gynecology), Fellowship in Lapa...read more",,₹ 800,Dr. Swati Chitnis,Santacruz West,,10:00 AM,12:00 PM,Mumbai,
1436,286,Dr. Shubhada Sanjiv Khandeparkar,Gynaecologist,46,"MBBS, MD - Obstetrics & Gynaecology, FICS, FICOG",,₹ 350,Dr. Khandeparkar's  Infertility and IVF Centre,Mumbai,,6:30 PM,8:00 PM,Mumbai,
1437,287,Dr. Prof. & Hod Ganesh Shinde,Gynaecologist,42,"MD - Obstetrtics & Gynaecology, MBBS",₹ 800,₹ 300,Shinde Medicare Hospital Pvt Ltd (On Call),Andheri West,"Sex Education, No Periods, Pregnancy QueryNext ",10:00 AM,5:00 PM,Mumbai,
1438,288,Dr. Puja Dewan,Gynaecologist,27,"DNB, (MRCOG) Royal College of Obstetricians and Gynaecologists, DGO, MBBS",,,,,,10:00 AM,5:00 PM,Mumbai,
1439,289,Dr. Archana Prabhu,Gynaecologist,30,"MBBS, DGO,  MD - Obstetrics & Gynaecology",,,,,"No Periods, Painful Periods, PregnancyNext ",7:30 PM,9:00 PM,Mumbai,
1440,290,Dr. Riddhi Doshi,Gynaecologist,13,"MBBS, DNB (Obstetrics and Gynecology), Fellowship in Assisted Reproduction, Fellowship in ...read more",,₹ 500,M M Medical Centre & Diagnostics (Bavishi Fertility Clinic),Borivali West,,10:00 AM,1:00 PM,Mumbai,
1441,291,Dr. Archana Prabhu,Gynaecologist,30,"MBBS, DGO,  MD - Obstetrics & Gynaecology",,,,,"No Periods, Painful Periods, PregnancyNext ",7:30 PM,9:00 PM,Mumbai,
1442,292,Dr. Kaushal Samir Kadam,Gynaecologist,25,"MD - Obstetrtics & Gynaecology, DGO",,,,,"Trying to Conceive, No Periods, FertilityNext ",9:00 AM,7:00 PM,Mumbai,
1443,293,Dr. Jyotsna Patel,Gynaecologist,30,"MD - Obstetrics & Gynaecology, MBBS",,,,,"No Periods, Trying to Conceive, PregnancyNext ",1:00 PM,2:00 PM,Mumbai,
1444,294,Dr. Ankesh Sahetya,Gynaecologist,17,"MBBS, DNB - Obstetrics & Gynecology, DGO, MNAMS - Obstetrics & Gynaecology",,₹ 250,Pushpaa Hospital,Andheri West,,6:00 PM,8:00 PM,Mumbai,
1445,295,Dr. Saloni Suchak,Gynaecologist,19,"MS - Obstetrics and Gynaecology , MBBS",,,,,Hormonal ImbalanceNext ,9:30 AM,12:30 PM,Mumbai,
1446,296,Dr. Parag Patil,Gynaecologist,33,"MD - Obstetrtics & Gynaecology, MBBS",₹ 500,,SHUBHAMKAR HOSPITAL,Navi Mumbai,"Infertility, Infertility Treatment, FertilityNext ",10:00 AM,7:00 PM,Mumbai,
1447,297,Dr. Nishita,Gynaecologist,16,"DNB (Obstetrics and Gynecology), MBBS",,₹ 500,A Remedy Ssquare,Colaba,"Pregnancy, Trying to Conceive, Irregular PeriodsNext ",12:30 PM,2:00 PM,Mumbai,
1448,298,Dr. Aneesh Sabnis,Gynaecologist,33,"M.D. Gyn. & Obstetrics, MBBS, Diploma in Advanced Gynaec Laparoscopic Surgery, D.N.B., F.C...read more",,₹ 400,Sneh Nursing Home,Mumbai,InfertilityNext ,7:00 PM,9:00 PM,Mumbai,
1449,299,Dr. Meera Agarwal,Gynaecologist,52,MD,,,,,,10:00 AM,2:30 PM,Mumbai,
1450,300,Dr. Yogesh,Homeopathy,,,₹ 200,,Sweet Pills Homeopathy Clinics,Kandivali West,,5:00 PM,9:00 PM,Mumbai,
1451,301,Dr. Nirali Parekh,Homeopathy,9,"BHMS, PGDEMS, Diploma in Naturopathy & Yogic Science (DNYS)",₹ 750,,₹ 1,500 onlineGujarati Seva Mandal,,9:00 AM,1:00 PM,Mumbai,
1452,302,Dr. Jitendra Vala,Homeopathy,18,"Diploma in Diet and Nutrition, BHMS",₹ 900,₹ 900,Dr Jitendras Clinic,Kandivali East,Weight Management,9:30 AM,2:00 PM,Mumbai,
1453,303,Dr. Gopinath Menon,Homeopathy,33,BHMS,,₹ 500,Homeo Works Clinic,Andheri East,"Typhoid, Stomach Pain, Digestive DisordersNext ",11:00 AM,2:00 PM,Mumbai,
1454,304,Dr. Jagat Shah,Homeopathy,17,"MD - Homeopathy, Masters Degree of Homoeopathy",₹ 800,,₹ 1,200 onlineTotal Health Care,"Sex Education, Weight Loss, Small Penis Size",10:00 AM,1:00 PM,Mumbai,
1455,305,Dr. Professor Bhavesh Acharya,Homeopathy,33,"MD, BHMS",,₹ 350,Global Homoeopathy & Esthetiques Clinic,Andheri East,"Stomach Pain, Joint Dislocation Treatment, Increase heightNext ",11:00 AM,2:00 PM,Mumbai,
1456,306,Dr. Shilpa Pandey,Homeopathy,15,MD - Homeopathy,₹ 800,₹ 500,Homoeo Healing Centre,Mankhurd,"Wrinkles, Weight Loss, Pimples TreatmentNext ",6:00 PM,8:30 PM,Mumbai,
1457,307,Dr. Pallavi Mehta,Homeopathy,13,"PG Hom, London, BHMS",₹ 400,₹ 300,Neelam Nagar Medical Centre,Mulund East,"Mole Removal, Wart RemovalNext ",12:00 PM,2:00 PM,Mumbai,
1458,308,Dr. Heena Quraishi,Homeopathy,25,"MD - Alternative Therapies, BHMS",₹ 550,₹ 400,Crresshhha Polyclinic,Andheri East,"Increase height, Difficulty Sleeping, Stomach PainNext ",2:00 PM,8:00 PM,Mumbai,
1459,309,Dr. H. Prathamesh,Homeopathy,,,₹ 250,₹ 300,Shree Clinic & Homeopathic Consulting Centre,Kalyan,"Small Penis Size, Dandruff, Hair FallNext ",9:00 AM,9:00 PM,Mumbai,
1460,310,Dr. Ritu Singh,Homeopathy,21,BHMS,₹ 750,₹ 300,Dr. Singh's Advanced Homeopathic Clinic (On Call),Mumbai,"Female Hair Loss, Heel Pain, SugarNext ",10:00 AM,10:00 PM,Mumbai,
1461,311,Dr. Amit Vora,Homeopathy,20,"BHMS, PG Hom London, M.D Homoeopathy",,₹ 300,Dr Amit Vora Homeopathic clinic,Mumbai,"Diabetes, Back Pain, AcidityNext ",10:00 AM,2:00 PM,Mumbai,
1462,312,Dr. Pravin Jain,Homeopathy,18,MD - Homeopathy,,₹ 300,HomoeoCARE,Dadar East,,11:00 AM,8:00 PM,Mumbai,
1463,313,Dr. Sangita Daithankar,Homeopathy,27,"Diploma in Diet and Nutrition, PG HOM (London), CCH, CGO, BHMS",₹ 600,₹ 300,Dr Sangita Daithankar's Clinic,Worli,"Body Weakness, Irregular Periods, Sex EducationNext ",10:00 AM,12:00 PM,Mumbai,
1464,314,Dr. Nikita Suresh Kothari,Homeopathy,17,"BHMS, C.G.O., PG Diploma in I.A.C.H",₹ 700,₹ 350,Hardik Homeopathy Clinic,Malad West,"Hair Treatment, PRP Hair Transplant TreatmentNext ",6:00 PM,9:00 PM,Mumbai,
1465,315,Dr. Suruchi Bapat,Homeopathy,17,"BHMS, MD - Homeopathy, Post Graduation Diploma In Psychological Counselling, Certificate C...read more",₹ 500,₹ 300,Homoeopathy Helps Heals,Borivali West,"Stomach Pain, Weight Loss, Body WeaknessNext ",7:00 PM,10:00 PM,Mumbai,
1466,316,Dr. Roopesh Singh,Homeopathy,24,"DHMS (Diploma in Homeopathic Medicine and Surgery), BHMS",₹ 500,₹ 300,Dr. Singh's Advanced Homeopathic Clinic,Mira Road,"Black Spots on Skin, Sugar, Female Hair LossNext ",11:00 AM,3:00 PM,Mumbai,
1467,317,Dr. Shivchand Yadav,Homeopathy,13,"CCH, CGO, CVD, BHMS",₹ 150,₹ 100,Sai Balaji Clinic,Kurla,,6:00 PM,11:00 PM,Mumbai,
1468,318,Dr. Rajiv   P. Bhanej,Homeopathy,23,"MD - Homeopathy, BHMS",₹ 500,₹ 300,Shree Laxmi Homoeopathic Clinic,Malad West,,9:00 AM,2:00 PM,Mumbai,
1469,319,Dr. Prabha Acharya,Homeopathy,34,"PGDM In Cosmetology, Trichology & Weight Managmen, MD, BHMS",,₹ 350,Global Homoeopathy & Esthetiques Clinic,Andheri East,"Back Pain, Irregular Periods, Stomach PainNext ",12:00 PM,2:00 PM,Mumbai,
1470,320,Dr. Ruchita Shah,Homeopathy,13,"BHMS, PG Diploma In Clinical Cosmetology",,₹ 350,Dr. Ruchita Shah's Clinic,Grant Road,,10:30 AM,5:30 PM,Mumbai,
1471,321,Dr. Josy Joy A,Homeopathy,26,BHMS,₹ 200,₹ 200,,,"Skin Care, Hair RestorationNext ",10:45 AM,7:30 PM,Mumbai,
1472,322,Dr. Mangesh J. Jadhav,Homeopathy,26,"DHMS, MD - Homeopathy",,₹ 350,Shree Siddhi Vinayak The Possibility Clinic,Mulund East,,7:30 AM,10:00 PM,Mumbai,
1473,323,Dr. Aditi Gangrade,Homeopathy,14,"PG Hom (Lon), BHMS, M.Sc - Applied Psychology",₹ 600,₹ 200,,,,12:00 PM,4:00 PM,Mumbai,
1474,324,Dr. Seema Poddar,Homeopathy,35,BHMS,₹ 800,₹ 300,Dr. Seema Poddar Homeopathy Doctor  (Asha Polyclinic),Matunga West,,5:00 PM,7:00 PM,Mumbai,
1475,325,Homoeocare Clinics,Homeopathy,,,,₹ 300,,,,10:00 AM,8:00 PM,Mumbai,
1476,326,Dr. Santosh Joshi,Homeopathy,24,BHMS,,₹ 200,Happy livin Clinic,Mulund,,4:00 PM,8:00 PM,Mumbai,
1477,327,Dr. Yatri H. Thacker,Homeopathy,23,"Certification in Child Birth Educator, PG(Diploma) - Psychology and Counselling, BHMS",,₹ 500,Homeopathic Healing Centre,Wadala West,"Stomach Pain, Buttock Pain, DepressionNext ",10:00 AM,1:00 PM,Mumbai,
1478,328,Life Force Homeopathy,Homeopathy,39,BHMS,,₹ 500,Life Force Homeopathy - Chembur,Chembur,,9:00 AM,8:00 PM,Mumbai,
1479,329,Dr. Sourabh R Welling,Homeopathy,19,MD - Homeopathy,₹ 500,₹ 250,Welling Homeopathy Clinics - Andheri East,Andheri East,,12:00 PM,9:00 PM,Mumbai,
1480,330,Dr. Kukreja A(kalani),Homeopathy,,,₹ 500,₹ 500,Kent Homeopathy Clinic,Powai,,11:00 AM,1:30 PM,Mumbai,
1481,331,Dr. Deepika Patel,Homeopathy,11,"BHMS, MD - Homeopathy",₹ 700,₹ 350,The Bombay Polyclinic,Fort,,10:30 AM,5:00 PM,Mumbai,
1482,332,Dr. Fatema Ebrahim,Homeopathy,11,BHMS,₹ 500,,₹ 1,000 onlineDr Fatema Ebrahim OPD,"Sex Education, Sexual Dysfunction, Thyroid DisordersNext ",10:00 AM,12:00 PM,Mumbai,
1483,333,Dr. D.V. Adhye,Homeopathy,41,BHMS,,₹ 400,Dr.Adhye Homeopathy Clinic,Chembur,,6:00 PM,9:00 PM,Mumbai,
1484,334,Dr. Nikhil R Chheda,Homeopathy,6,BHMS,,₹ 100,Get Well Soon,Sewri,,5:00 PM,5:30 PM,Mumbai,
1485,335,Dr. Kruti Bhuskute,Homeopathy,22,"BHMS, MD - Homeopathy",,,,,"Hair Loss, Skin Care, SugarNext ",7:00 PM,9:00 PM,Mumbai,
1486,336,Dr. Kinjal Kanani Shah,Homeopathy,13,"MD, BHMS",₹ 500,₹ 200,Devasya polyclinic,Kandivali West,,6:30 PM,8:30 PM,Mumbai,
1487,337,Dr. Neha Khodke,Homeopathy,14,"Doctor of Homeopathic Medicine (M.D.), Bachelor of Homeopathic Medicine & Surgery (BHMS), ...read more",,₹ 200,Eka Wellness Homoeopathy & Nutrition,Goregaon West,,5:00 PM,8:00 PM,Mumbai,
1488,338,Dr. Kamlesh Mehta,Homeopathy,44,"MD - Homeopathy, L.C.E.H.",,,,,,10:30 AM,1:00 PM,Mumbai,
1489,339,Dr. Ashwini Pawar,Homeopathy,16,"MD - Homeopathy, BHMS",₹ 300,₹ 300,,,,9:00 AM,9:00 PM,Mumbai,
1490,340,Dr. Vidyasagar Umalkar,Homeopathy,41,DHMS,,₹ 300,Chaitanya Homoeo Heartcare Clinic & Research,Dadar,"Prevention of Blockage Post Angioplasty Stent Surgery, Slimming, Painful PeriodsNext ",12:00 PM,2:30 PM,Mumbai,
1491,341,Batra'S Healthcare,Homeopathy,10,"India, Dubai, London",₹ 200,₹ 200,Dr Batra's Healthcare - Chowpatty,Chowpatty,"Acne Treatment, Hair Treatment, BaldnessNext ",10:00 AM,10:00 AM,Mumbai,
1492,342,Dr. Kanan Khatau Chikhal,Homeopathy,27,BHMS,,₹ 400,Life Cures Wellness Clinic,Lokhandwala,"Stomach Pain, Weight Loss, Knee PainNext ",11:00 AM,8:00 PM,Mumbai,
1493,343,Dr. Sneha,Homeopathy,13,BHMS,₹ 500,₹ 200,Agarwal Children Hospital,Bandra East,"Erection Problems, Cancer, Breast CancerNext ",11:00 AM,1:00 PM,Mumbai,
1494,344,Dr. Devendra Singh,Homeopathy,51,BHMS,₹ 500,,,,"Neck Pain, Diabetes, Diabetes ManagementNext ",12:00 PM,5:30 PM,Mumbai,
1495,345,Dr. Arvind Yadav,Homeopathy,14,"C.C.A.H, BHMS",₹ 500,,,,,9:00 AM,2:00 PM,Mumbai,
1496,346,Dr. Ishan Thakkar,Homeopathy,13,BHMS,₹ 500,₹ 500,Harmony Health,Borivali West,,5:30 PM,9:30 PM,Mumbai,
1497,347,Dr. Medha Durge,Homeopathy,35,"MD Homeopathy, BHMS",₹ 300,₹ 300,Homeopathy4All - Homeopathic Clinic,Mumbai,,10:00 AM,9:00 PM,Mumbai,
1498,348,Dr. Surbhi Jhunjhunwala,Homeopathy,18,BHMS,,₹ 350,KASTURBA HEALTH SOCIETY MEDICAL RESEARCH CENTER,Vile Parle,,4:00 PM,6:00 PM,Mumbai,
1499,349,Dr. Sudhiir L. Gesota,Homeopathy,45,"Pg Diploma in sports and Nutritions, CCH, A.R.S.H., DHMS (Diploma in Homeopathic Medicine ...read more",₹ 500,₹ 300,Life Solutions Now 24x7,Mulund West,,7:00 AM,12:00 PM,Mumbai,
1500,350,Mrs. Chhaya Jain,Psychologist,14,"M.Sc - Applied Psychology, Advanced Diploma In Counselling Psychology",,₹ 500,Kasturmahal Poly Clinic,Sion,"Psychotherapy, Anxiety Attacks, AnxietyNext ",11:00 AM,4:00 PM,Mumbai,
1501,351,Ms. Dipal Mehta,Psychologist,23,"MA - Clinical Psychology, P.G. Diploma in Guidance and Counseling, BA In Psychology",,,,,"Depression, Anxiety, Stress TreatmentNext ",11:00 AM,6:00 PM,Mumbai,
1502,352,Dr. Keerti Sachdeva,Psychologist,41,"Ph.D - Social Psychology -, M.Phil. Educational Psychology, MSc. Child Psychology , B.Sc",,,,,"Depression, Mood Disorder Treatment, Anxiety",11:00 AM,3:00 PM,Mumbai,
1503,353,Mrs. Simoni Shah,Psychologist,8,"M A Clinical Psychology, Pg diploma in counselling",,,,,,12:00 PM,10:00 PM,Mumbai,
1504,354,Dr. Bhairavi Thakkar,Psychologist,19,"Master of Arts in Counseling Psychology, BA(Hons.) Applied Psychology, Dip.Counseling Psyc...read more",,,,,"Counselling and Stress Management, Adult CounsellingNext ",9:00 AM,6:00 PM,Mumbai,
1505,355,Ms. Rashi Anand Laskari,Psychologist,15,"B.A., MA - Counselling Psychology",,,,,,9:00 AM,11:00 AM,Mumbai,
1506,356,Dr. Aman Bhonsle,Psychologist,6,"PhD - Psychotherapy, PGDTA - Transactional Analysis, BMM, MBA- Communication Management",,,,,,10:00 AM,9:00 PM,Mumbai,
1507,357,Ms. Richika Gupta,Psychologist,5,"Masters in Counselling Psychology, Masters in Counselling Psychology",,,,,,2:00 PM,7:00 PM,Mumbai,
1508,358,Ms. Sheetal Bidkar,Psychologist,15,International Certified Addiction Professional,,,,,Premature EjaculationNext ,9:30 AM,5:00 PM,Mumbai,
1509,359,Dr. Jaini Savla,Psychologist,12,"BA Psychology & Sociology, MS - Psychology",,,,,,10:00 AM,8:00 PM,Mumbai,
1510,360,Ithrive Counselling Centre,Psychologist,,,,,,,,11:30 AM,7:00 PM,Mumbai,
1511,361,Mindsight Clinic,Psychologist,,,,₹ 300,Mind Sight Clinic,Malad West,,9:00 AM,6:00 PM,Mumbai,
1512,362,Ms. Saachi Arora,Psychologist,4,MPhil in Clinical Psychology,,,,,,9:00 AM,8:00 PM,Mumbai,
1513,363,Dr. Merul Gandhi,Psychologist,8,MA - Psychology,,,,,,2:00 PM,5:00 PM,Mumbai,
1514,364,Ms. Fakhera Merchant,Psychologist,16,"Advance Course in Neuro linguistic Programming, Diploma In Dyslexic Studies, Masters In Ps...read more",,,,,,11:00 AM,1:00 PM,Mumbai,
1515,365,Dr. Sheba Singh,Psychologist,32,"PhD - Psychology, Masters in Psychology, BA - Psychology, Post Graduate Diploma in Rehabil...read more",,,,,,5:00 PM,8:00 PM,Mumbai,
1516,366,Ms. Siddhi Maru,Psychologist,2,MS Psychology,₹ 800,₹ 250,Dr. Mandot's Polyclinic,Mulund West,,4:00 PM,6:00 PM,Mumbai,
1517,367,Dr. Priti Khatu,Psychologist,22,"MSc in Applied Psychology, MSc Health Psychology, PGCTC, PGC (Family Therapy)",,₹ 350,Vivanta Hospital-  Malad (on call),Malad West,,2:00 PM,4:00 PM,Mumbai,
1518,368,Ms. Rachna Kothari,Psychologist,21,MA - Psychology,,,,,"Depression, Smoking, Anxiety and Depression",9:00 AM,7:30 PM,Mumbai,
1519,369,Dr. Khushboo Jain,Psychologist,11,"B.A. Psychology, M.A Psychology",,₹ 300,Ageless Medica Health Management,Powai,,3:00 PM,6:00 PM,Mumbai,
1520,370,Ms. Taral Parekh,Psychologist,15,"CE in Cognitive Behavior Therapy, Masters of Counselling Psychology, Post Graduate Diploma...read more",,,,,Stress Treatment,8:00 AM,10:00 PM,Mumbai,
1521,371,Mr. Shreemant Yadav,Psychologist,11,"Masters in counseling psychology, Counseling psychologist, Rational Emotive Behavioral The...read more",,,,,"Behaviour and Thought Problems, Stress TreatmentNext ",8:00 AM,4:00 PM,Mumbai,
1522,372,Dr. Neerja Thergaonkar,Psychologist,26,"PhD - Psychology, MA - Psychology, Arts Based Therapist",,,,,,10:00 AM,1:00 PM,Mumbai,
1523,373,Dr. Rahul Dutta,Psychologist,23,"MBBS, Diploma in Traditional Chinese Medicine (DTCM), Diploma of Clinical Hypnotherapy",,,,,"Psychotherapy, Marriage CounsellingNext ",10:00 AM,12:00 PM,Mumbai,
1524,374,Dr. Pooja Anand,Psychologist,2,MA - Psychology,,,,,,8:30 AM,11:30 AM,Mumbai,
1525,375,Ms. Vijal Sejpal,Psychologist,15,"Post Graduate Diploma In School Counselling (PGDSC), Certificate In Guidance & Counselling (CGC)",,₹ 300,i Thrive Counselling & Holistic Development Centre,Andheri West,,11:00 AM,7:00 PM,Mumbai,
1526,376,Ms. Psychological Counselor Pushpa Sinha,Psychologist,24,"POST GRADUATE DIPLOMA IN CLINICAL PSYCHOLOGY, Masters in clinical psychology",,₹ 900,Online,Oshiwara,Abnormal Behavior,,,Mumbai,
1527,377,Ms. Ruhi Vakil,Psychologist,8,"MA - Psychology, BA in Clinical Psychology, Advanced diploma in counselling psychology",,,,,,10:30 AM,5:30 PM,Mumbai,
1528,378,Dr. Firdos Qureshi,Psychologist,15,"Master in clinical psychology, B.A. Psychology",,₹ 800,SEABIRD MEDICARE,Andheri East,,1:00 PM,3:00 PM,Mumbai,
1529,379,Ms. Prachi Tripathi,Psychologist,12,,,,,,,12:00 PM,8:30 PM,Mumbai,
1530,380,Ms. Prachi Tripathi,Psychologist,12,,,,,,,12:00 PM,8:30 PM,Mumbai,
1531,381,Mr. Guruprasad Shivakamat,Psychologist,20,"Masters In Psychology , CBT - Cognitive Behavioral Therapy , REBT Rational Emotive Behavio...read more",,,,,Stress Treatment,,,Mumbai,
1532,382,Ms. Priti Thakkar,Psychologist,,,,,,,,11:00 AM,6:30 PM,Mumbai,
1533,383,Ms. Jenita Nandu,Psychologist,5,MA Clinical Psychology,,,,,,2:00 PM,10:30 PM,Mumbai,
1534,384,Dr. Brenda Fernandes,Psychologist,42,PhD - Psychology,,,,,,9:00 AM,11:00 PM,Mumbai,
1535,385,Dr. Aanchal Narang,Psychologist,12,,,₹ 800,Another Light Counselling,Andheri West,,7:00 AM,10:00 PM,Mumbai,
1536,386,Ms. Bhakti Joshi,Psychologist,12,,,,,,,10:00 AM,7:00 PM,Mumbai,
1537,387,Ms. Shraddha  Singh,Psychologist,4,MA Applied Psychology (clinical psychology),,₹ 300,Seabird Medicare,Andheri East,,9:00 AM,5:00 PM,Mumbai,
1538,388,Dr. Iti Shukla,Psychologist,9,MA clinical psychology,₹ 500,₹ 500,Mind-space,Goregaon West,,12:00 PM,3:00 PM,Mumbai,
1539,389,Ms. Vidisha Gadre,Psychologist,7,M.A.,₹ 800,₹ 300,Healing & Feeling,Mulund,,8:00 AM,11:00 PM,Mumbai,
1540,390,Ms. Urveez Kakalia,Psychologist,7,"MA Counselling Psychology, BA (Psychology)",₹ 800,,₹ 1,000 onlineImPerfect,,,,Mumbai,
1541,391,Ms. Vidisha Gadre,Psychologist,7,M.A.,₹ 800,₹ 300,Healing & Feeling,Mulund,,8:00 AM,11:00 PM,Mumbai,
1542,392,Dr. Iti Shukla,Psychologist,9,MA clinical psychology,₹ 500,₹ 500,Mind-space,Goregaon West,,12:00 PM,3:00 PM,Mumbai,
1543,393,Mr. Anshul Khosla,Psychologist,4,"M.Phil - Psychology, M.Sc -  Clinical Psychology",,,,,,2:00 PM,5:00 PM,Mumbai,
1544,394,Dr. Harsh Pandya,Psychologist,,,₹ 800,,Mentoring Minds,Malad West,,8:00 AM,11:00 PM,Mumbai,
1545,395,Mrs. Anu  Kulkarni,Psychologist,22,"Hypnotherapist, Reconnective Healing Practioner",₹ 1,,₹ 4,000 onlineakatalyst,,11:00 AM,7:00 PM,Mumbai,
1546,396,Ms. Ishita Pateria,Psychologist,12,"MSc Counselling Psychology, MSc Mental Health",,,,,,11:00 AM,8:00 PM,Mumbai,
1547,397,Ms. Anushree Lokhande,Psychologist,10,Masters in Counselling Psychology,,,,,,11:00 AM,8:00 PM,Mumbai,
1548,398,Dr. Sjm Sjm,Psychologist,9,M.Sc - Psychology,,,,,,10:30 AM,6:30 PM,Mumbai,
1549,399,Ms. Nitu Rai,Psychologist,13,Clinical Psychologist,,,,,,11:00 AM,5:00 PM,Mumbai,
1550,400,Dr. Sanjay Erande,Ayurveda,20,"Fellowship In Sexology, M-CSEPI, M.Ayu.D, Dipl.EMS, BAMS, Fellowship In Sexology",,,,,"Male Sexual Problems, Erectile Dysfunction, Small Penis Size",11:00 AM,5:00 PM,Mumbai,
1551,401,Dr. Nitin Kochar,Ayurveda,34,"BAMS, MD - Ayurveda, Diploma In Yoga",₹ 800,,₹ 3,000 onlineGurukrupa Ayurvedic Clinic,,5:30 PM,9:00 PM,Mumbai,
1552,402,Dr. Jiva Ayurveda,Ayurveda,26,BAMS,₹ 299,,,,"Acne Treatment, Hair Loss, Flu",11:00 AM,8:00 PM,Mumbai,
1553,403,Dr. Shekhar Benade,Ayurveda,24,"BAMS, MD - Ayurveda Medicine, Master in Sexual Medicine, Proficiency in Psycosexual Medici...read more",₹ 500,₹ 700,,,"Premature Ejaculation, Sugar, Small Penis Size",,,Mumbai,
1554,404,Dr. Sudhir Bhujbale.,Ayurveda,24,"MD - Ayurveda, Bachelor of Ayurveda, Medicine and Surgery (BAMS)",₹ 500,₹ 100,,,,10:00 AM,7:00 PM,Mumbai,
1555,405,Dr. Jaina Vishal Patwa,Ayurveda,15,"Bachelor of Ayurveda, Medicine and Surgery (BAMS)",,,,,PanchakarmaNext ,10:00 AM,8:00 PM,Mumbai,
1556,406,Dr. Surjeet Kaur Bava,Ayurveda,26,"MD - Ayurveda, Diploma In Trichology, Skin Aesthetics and  Cosmetology, Diploma In skin ae...read more",,₹ 350,Ultra Slim Laser Clinic,Sion,"Hair Health, Hair Growth, Weight LossNext ",11:00 AM,2:00 PM,Mumbai,
1557,407,Dr. Omkar Shahapurkar,Ayurveda,21,"BAMS, MD",₹ 300,,,,"Sex Education, Acidity, Acne/Pimples",12:00 PM,5:00 PM,Mumbai,
