,Unnamed: 0,Name,Specialization,Experience (in years),Education,Fee at clinic,Online Fee,Clinic Name,Area,Recently Consulted for,Available From,Available Till,City,Unnamed: 0.1
2219,169,Dr. Mohammed Faisal,General+Physician,16,"MBBS Bachelor of Medicine and Bachelor of Surgery, MD - Tuberculosis & Respiratory Disease...read more",₹ 800,₹ 350,Trucare Chest Clinic,Vijay Nagar Colony Rd,,6:00 PM,8:00 PM,Hyderabad,
2220,170,Dr. Arun Kumar,General+Physician,11,"DNB (General Medicine), MBBS",₹ 800,,Continental Hospital,Nanakramguda,,9:00 AM,5:00 PM,Hyderabad,
2221,171,Dr. Niveditha Rao,General+Physician,10,MBBS,₹ 600,₹ 350,Star Hospitals,Hyderabad,,9:00 AM,2:30 PM,Hyderabad,
2222,172,Dr. M. V. Rao,General+Physician,40,"MBBS, MD - General Medicine",₹ 900,,Yashoda Hospital - Somajiguda,Somajiguda,,10:00 AM,2:00 PM,Hyderabad,
2223,173,Dr. S D S Raju,General+Physician,20,"MD - General Medicine, MRCP (UK)",₹ 300,₹ 300,TRINITY MULTISPECIALITY HOSPITAL,Dammaiguda,,7:00 AM,9:00 PM,Hyderabad,
2224,174,Dr. Fini Ani Philip,General+Physician,30,"MBBS, Master Of Family Medicine, Diploma In Geriatric Medicine",₹ 500,₹ 500,Dr. Finy's Clinic,KPHB,,5:00 PM,7:00 PM,Hyderabad,
2225,175,Dr. Khalid Mohammad Munir,General+Physician,20,"PGC Diabetology, MBBS",₹ 400,₹ 300,Medlife clinic,Manikonda,,9:00 AM,7:30 PM,Hyderabad,
2226,176,Dr. Chaitanya Challa,General+Physician,24,"MBBS, MD GENERAL MEDICINE, PDCC CRITICAL CARE, FCCS CRITICAL CARE",₹ 300,₹ 300,Challa hospitals,Ameerpet,"Diabetes, Dressings of Wounds",5:00 PM,7:00 PM,Hyderabad,
2227,177,Dr. Mirza Nimmat Baig,General+Physician,19,md general phisician,₹ 200,₹ 200,Dr.Mirza Clinic,Malakpet,Viral Fever Treatment,10:00 AM,10:00 PM,Hyderabad,
2228,178,I N N A T E | The Clinic,General+Physician,,,₹ 300,₹ 350,Innate The Clinic,Kukatpally,,9:00 AM,9:00 PM,Hyderabad,
2229,179,Dr. M  Sudhir,General+Physician,44,"MBBS, DNB -General Medicine, MD - General Medicine, DNB- Gastroenterology",₹ 500,,Pace Hospitals,Begumpet,,11:00 AM,2:00 PM,Hyderabad,
2230,180,Dr. Mohammed Parvez,General+Physician,24,"Advanced Cardiac Life Support ( ACLS ), MBBS, MD - Internal Medicine, ACLS, American Board...read more",₹ 300,₹ 500,True Care Clinic,Musheerabad,,,,Hyderabad,
2231,181,Dr. K.Hari Babu,General+Physician,35,"MBBS, MD - Medicine",₹ 400,,ANITHA NURSING HOME,Chanda Nagar,,10:00 AM,1:00 PM,Hyderabad,
2232,182,Dr. Butchi.Kr.Keerthiman,General+Physician,11,MBBS,₹ 300,₹ 250,Family Docs Clinic,Hyderabad,Cold Cough ,6:30 PM,9:30 PM,Hyderabad,
2233,183,Dr. Naresh Kumar Monigari,General+Physician,13,"MD - General Medicine, MBBS, DNB Cardiology",₹ 600,₹ 200,Aaradhya speciality clinics,Hyderabad,,10:00 AM,2:00 PM,Hyderabad,
2234,184,Dr. Emad Mohammed,General+Physician,9,MBBS,₹ 500,₹ 200,Yash Polyclinics,Gachibowli,,7:00 PM,9:00 PM,Hyderabad,
2235,185,Dr. Perla Soniya Rani,General+Physician,6,"Bachelor of Medicine, Bachelor of Surgery (M.B.B.S.), Medicine",₹ 200,₹ 200,Nikhil Nursing Home,Hyderabad,,7:00 AM,8:00 PM,Hyderabad,
2236,186,Dr. Vamshi Nandan Rao Gunuganti,General+Physician,10,MD - General Medicine,₹ 509,₹ 500,Svasth medi clinic,Hyderabad,,6:30 PM,9:00 PM,Hyderabad,
2237,187,Dr. Subhash Chander Gadde,General+Physician,51,"MF Home, MBBS",₹ 200,₹ 200,New Life Homeocare,Bowenpally,Sexually Transmitted Disease (STD) Treatment ,10:00 AM,8:00 PM,Hyderabad,
2238,188,Dr. Vengala Reddy,General+Physician,50,MBBS,₹ 300,₹ 300,,,,6:00 PM,9:00 PM,Hyderabad,
2239,189,Dr. Sonal Jain Gandhi,General+Physician,9,MD - General Medicine,₹ 600,₹ 300,Dr Sonals Health Care Centre,Mukund Nagar,,6:30 PM,9:30 PM,Hyderabad,
2240,190,Dr. D Venkateshwarlu,General+Physician,37,"MBBS, MD - General Medicine",₹ 150,,Swathi Hospital,Banjara Hills,"Allergy Treatment, Allergy ",8:00 AM,11:00 AM,Hyderabad,
2241,191,Dr. Divya Ranjani,General+Physician,10,"MD - General Medicine, MBBS",₹ 500,₹ 300,Shadan Institute Of Medical Sciences,Hyderabad,,10:00 AM,4:00 PM,Hyderabad,
2242,192,Dr. M.R. Prabhakar Murhy,General+Physician,38,MBBS,₹ 500,,Thyrocare,Padma Rao Nagar,"Detoxification, Allergy Treatment, Allergy",6:30 PM,9:30 PM,Hyderabad,
2243,193,Dr. Gattu Srinivasulu,General+Physician,46,MBBS,₹ 500,₹ 300,Shreesha Health Care hospital,Vanasthalipuram,,9:00 AM,2:00 PM,Hyderabad,
2244,194,Dr. Rajeev Prasad,General+Physician,15,"MBBS, MD - Physician",₹ 500,₹ 200,KVR Diagnostic & Poly Clinic,Karmanghat,,9:00 AM,9:00 PM,Hyderabad,
2245,195,Dr. Surendra Nehru Muddu,General+Physician,32,MD - Internal Medicine,₹ 500,,klavo clinic,Hyderabad,,9:00 AM,10:00 PM,Hyderabad,
2246,196,Dr. Mahesh Marda,General+Physician,47,"MBBS, MD - General Medicine",₹ 650,,Premier Hospital,Toli Chowki,"Diabetes, Stomach Pain ",10:00 AM,1:00 PM,Hyderabad,
2247,197,Dr. Satish Kotla,General+Physician,30,"M.B.B.S, MD - General Medicine, fellowship in Euroasian academy of diabetology, certificat...read more",,,,,,10:30 AM,2:00 PM,Hyderabad,
2248,198,Dr. Sandeep Ghanta,General+Physician,18,"MBBS, MD - General Medicine, Post Graduate Diploma in Diabetology (PGDD)",₹ 0,,Citizens Specialty Hospitals,Lingampally,,10:30 AM,1:30 PM,Hyderabad,
2249,199,Dr. M A Majid,General+Physician,20,MD - Pharmacology,₹ 200,,Amen Unani  Medical Center,Masab Tank,,5:00 PM,7:00 PM,Hyderabad,
2250,200,Dr Venu Madhav Badla,Orthopedist,23,"MBBS, MS",₹ 350,,NH Malla Reddy Narayan Multispeciality Hospital,Jeedimetla,,10:00 AM,4:00 PM,Hyderabad,
2251,201,Dr. L,Orthopedist,,,₹ 500,₹ 200,Jayaprakash,Hyderabad,,7:00 AM,10:30 PM,Hyderabad,
2252,202,Dr. Kiran Kumar Reddy Badam,Orthopedist,18,"MBBS, MS - Orthopaedics, MRCS (UK)",₹ 0,,Pristyn Care Clinic,Hyderabad,,5:00 PM,8:00 PM,Hyderabad,
2253,203,Dr. Repakula Kartheek,Orthopedist,14,"MBBS, MS - Orthopaedics",₹ 0,,Pristyn Care,Trinity Lutheran Church,,10:00 AM,7:00 PM,Hyderabad,
2254,204,Dr. Mir Jawad Zar Khan,Orthopedist,23,"MBBS, MS - Orthopaedics, M.CH - Ortho & Fellowship in Arthoplasty, Fellowship in Arthoplas...read more",₹ 750,,Germanten Hospital,Attapur,"Knee Pain, Back Pain, Lower Back Pain ",10:00 AM,6:00 PM,Hyderabad,
2255,205,Dr Hari Prakash,Orthopedist,14,,,,,,,8:00 AM,11:00 PM,Hyderabad,
2256,206,Dr. P Sharat Kumar,Orthopedist,36,"FFSEM, MFSEM, DIP - SEM GB & I, MS - Orthopaedics, MBBS, MCh Orthopaedics",₹ 800,,₹ 1,000 onlineDr. P Sharat Kumar,"Knee Pain, Shoulder Pain, Nerve And Muscle Disorders ",11:00 AM,3:00 PM,Hyderabad,
2257,207,Dr. M.Kaushik Reddy,Orthopedist,18,"MS - Orthopaedics, MBBS",₹ 500,₹ 400,Apollo Hospitals - Jubilee Hills,Jubilee Hills,"Back Pain, Knee Pain, Shoulder Pain ",8:00 AM,4:00 PM,Hyderabad,
2258,208,Apollo Spectra Hospitals,Orthopedist,,,,,,,,9:00 AM,9:00 PM,Hyderabad,
2259,209,Dr. Nithin Kumar Bejjanki,Orthopedist,23,"Fellowship of the Royal College of Surgeons (FRCS), Membership of the Royal College of Sur...read more",,₹ 500,Dr.Nithin Sport Injury Clinic,Secunderabad,"Back Pain, Bone Fracture, Leg Pain",,,Hyderabad,
2260,210,Dr. G Manjunath Reddy,Orthopedist,30,"MBBS, DNB (Orthopedics), Diploma In Orthopaedics, Mch- Orthopedics",₹ 500,,Universal Clinics,KPHB,,9:00 AM,12:00 PM,Hyderabad,
2261,211,Dr. R Kartheek,Orthopedist,15,"MBBS, MS - Orthopaedics, Fellowship In Joint Replacement",₹ 400,₹ 300,Sunshine Hospitals (On Call),Hyderabad,,9:00 AM,9:00 AM,Hyderabad,
2262,212,Dr. Ashwin Kasturi,Orthopedist,21,"MBBS, MS - Orthopaedics",₹ 600,,Cure Speciality Clinics,Kukatpally,"Leg Pain, Shoulder Pain, Knee Pain ",11:00 AM,1:30 PM,Hyderabad,
2263,213,Dr. A.Mohan Krishna,Orthopedist,21,"M Ch. Ortho, M.S Orthopedics, M.B.B.S",₹ 700,,Apollo Hospitals,Film Nagar,"Ankle Pain Treatment, Knee Pain, Knee Pain Treatment ",10:30 AM,1:30 PM,Hyderabad,
2264,214,Dr. G K Sudhakar Reddy,Orthopedist,27,"MBBS, MS - Orthopaedics, FRCS (Orth) UK, MCh - Ortho, Diploma In Sports Medicine, MRCS Ed",₹ 650,,Revive Clinics,Nallagandla,,6:00 PM,8:00 PM,Hyderabad,
2265,215,Dr. Bharat Sharma,Orthopedist,22,"MBBS, Diploma In Orthopaedics (D. Ortho), DNB (Orthopedics), Fellowship in Knee Surgery, F...read more",₹ 250,₹ 250,MedRites,Hyderabad,"Knee Pain, Ankle Pain Treatment, Knee Pain Treatment ",7:00 PM,8:30 PM,Hyderabad,
2266,216,Dr. Praneeth Reddy C V,Orthopedist,14,"MBBS, MS - Orthopaedics",₹ 600,₹ 450,Apollo Hospitals,Jubilee Hills,,9:00 AM,4:00 PM,Hyderabad,
2267,217,Dr. Kishore B Reddy,Orthopedist,22,"MBBS, MS - Orthopaedics",₹ 700,₹ 300,Amor Hospitals,Kukatpally,,10:00 AM,7:00 PM,Hyderabad,
2268,218,Dr. Somasekhar Reddy N,Orthopedist,40,"MBBS, MS - Orthopaedics, MCh orthopaedics",,,,,,2:00 PM,6:00 PM,Hyderabad,
2269,219,Dr. Jagathpally Alwal Reddy,Orthopedist,24,MS - Orthopaedics,₹ 300,,Sri Ramadevi Orthopaedic Hospital,Vanasthalipuram,,6:30 PM,8:30 PM,Hyderabad,
2270,220,Dr. A Srinivas Goud,Orthopedist,25,"MS - Orthopaedics, MBBS",₹ 500,₹ 500,Akshara Orthopedic Centre,West Marredpally,,6:00 PM,8:30 PM,Hyderabad,
2271,221,Dr. Jagan Mohan Reddy Velpula,Orthopedist,27,"MBBS Bachelor of Medicine and Bachelor of Surgery, DNB (Orthopedics), MRCS-Edinburgh, Dipl...read more",₹ 600,₹ 250,care hospitals -hi tech branch,Gachibowli,,9:30 AM,3:45 PM,Hyderabad,
2272,222,Dr. Madhu Geddam,Orthopedist,15,"MBBS, MS - Orthopaedics, Fellowship In Sports Medicine",₹ 600,₹ 300,Srikara Hospitals,Kavadiguda,,10:00 AM,4:00 PM,Hyderabad,
2273,223,Dr. Vijaybhasker B,Orthopedist,27,MS - Orthopaedics,₹ 200,,ravihelioshospitals,Hyderabad,,5:00 PM,9:00 PM,Hyderabad,
2274,224,Dr. Gurram Sudhakar Reddy,Orthopedist,13,"MBBS, MS - Orthopaedics, Fellow in Spine Surgery, Fellowship in Joint Replacement",₹ 600,₹ 200,Srikara Hospital,L B Nagar,,9:00 AM,5:00 PM,Hyderabad,
2275,225,Dr. G P R K Rohit Reddy,Orthopedist,13,"MBBS, MS - Orthopaedics",₹ 500,₹ 500,Vaidya Poly Clinic,Madhapur,,10:00 AM,1:00 PM,Hyderabad,
2276,226,Dr. K Sudhir Reddy,Orthopedist,31,"MBBS, MS - Orthopaedics, M.Ch - Orthopaedics, FRCS - General Surgery, FRCS - Trauma & Orth...read more",₹ 800,,Landmark Hospitals,Kukatpally,,12:00 PM,3:30 PM,Hyderabad,
2277,227,Dr. Kalyan Kumar Varma Kalidindi,Orthopedist,13,,₹ 600,₹ 300,Sunbliz Spine & Ortho Clinics,KPHB,,6:00 PM,8:00 PM,Hyderabad,
2278,228,Dr. Lokesh Gupta,Orthopedist,10,"MBBS Dnb , Diploma In Orthopaedics (D. Ortho)",₹ 500,₹ 200,Geeta MultiSpeciality Hospital,Dilsukhnagar,,7:00 PM,9:00 PM,Hyderabad,
2279,229,Dr. Santosh Patil,Orthopedist,17,DNB (Orthopedics),₹ 300,,Eureka Superspeciality Clinic,Madinaguda,Joint Pain ,7:30 AM,9:30 AM,Hyderabad,
2280,230,Dr. Sanjib Kumar Behera,Orthopedist,36,"MS - Orthopaedics, MBBS Bachelor of Medicine and Bachelor of Surgery, DNB - Orthopedics & ...read more",₹ 500,₹ 300,Yashoda Hospital,Secunderabad,,9:00 AM,6:00 PM,Hyderabad,
2281,231,Dr. Rakesh Raja,Orthopedist,12,"MBBS, MS - Orthopaedics, Fellowship in Joint Replacement",₹ 300,₹ 200,NETHAJI POLY CLINIC,Kompally,,10:00 AM,12:00 PM,Hyderabad,
2282,232,Dr. Sushanth M V,Orthopedist,25,"MSc in Clinical Orthopaedics, fellowship in Arthroplasty and Arthroscopy, Post Graduation,...read more",₹ 600,,Kasturi Multispeciality Hospital,Hyderabad,Spinal Surgery ,11:00 AM,2:00 PM,Hyderabad,
2283,233,Dr. Purushottam Reddy Padala,Orthopedist,31,"FRCS, FRCS, MS - Orthopaedics, MBBS",₹ 400,,Happy Feet Foot Clinics,Jubilee Hills,,10:00 AM,8:00 PM,Hyderabad,
2284,234,Dr. Srinivas Kumar D,Orthopedist,25,MS - Orthopaedics,₹ 200,,Orthopedic Clinic,Mehdipatnam,,7:30 PM,9:00 PM,Hyderabad,
2285,235,Dr. Sujitkumar Vakati R,Orthopedist,10,"MS - Orthopaedics, M Ch. Ortho, Shoulder and Elbow fellowship, Shoulder and Elbow fellowsh...read more",,₹ 300,Ankura Hospital,Chanda Nagar,Ankle Pain Treatment,,,Hyderabad,
2286,236,Dr. Sadhan Palakuri,Orthopedist,12,"Fellowship in Sports Orthopaedics & Arthroscopy, Fellowship in arthroplasty & reconstructi...read more",,₹ 500,Apollo Hospitals,Hyderabad,,,,Hyderabad,
2287,237,Dr. Shiva Kumar Ale,Orthopedist,11,"MBBS, MS - Orthopaedics",₹ 500,₹ 200,Seasons Hospital,Amberpet,,10:00 AM,2:00 PM,Hyderabad,
2288,238,Dr. Muhammed Tanzeel Munawar,Orthopedist,17,MS - Orthopaedics,₹ 300,₹ 200,MG ORTHO CARE,Hyderabad,,7:00 PM,10:00 PM,Hyderabad,
2289,239,Dr. Vasudev Rao S,Orthopedist,32,MS - Orthopaedics,₹ 250,,Saptagiri Hospital,Dilsukhnagar,,2:00 PM,4:00 PM,Hyderabad,
2290,240,Dr. Madan Mohan,Orthopedist,31,"MBBS, MS - Orthopaedics",₹ 500,,Skorts Multi Specialty Clinics,Ameerpet,,6:00 PM,9:00 PM,Hyderabad,
2291,241,Dr. Rajkumar,Orthopedist,,,₹ 400,₹ 500,Saisurya Fracture Ortho & Diabetes Clinic,Chikkadapally,,10:00 AM,12:00 PM,Hyderabad,
2292,242,Dr. Ramesh Chandra Katragadda,Orthopedist,30,"DNB (Orthopedics), M.S.ORTHO",₹ 600,,Zoi Hospitals,Attapur,,10:30 AM,2:30 PM,Hyderabad,
2293,243,Dr. Somasekhar Reddy. N,Orthopedist,40,"MBBS, MS - Orthopaedics, M.Ch",,,,,,2:00 PM,5:00 PM,Hyderabad,
2294,244,Dr. Sanjay Tapadia,Orthopedist,23,"MBBS, DNB - Orthopedics, Mch Orthopedics",₹ 800,,Zoi Hospitals - Attapur,Attapur,,5:00 PM,8:30 PM,Hyderabad,
2295,245,Dr. Mirza Atif Baig,Orthopedist,20,"MBBS, MS - Orthopaedics, DNB - Orthopedics",₹ 300,,Dr Atif's Orthopaedic Clinic,Mehadipatnam,,6:30 PM,9:00 PM,Hyderabad,
2296,246,Dr. Balaraju Naidu,Orthopedist,14,,₹ 500,,ONUS HOSPITALS,Hyderabad,,10:00 AM,8:00 PM,Hyderabad,
2297,247,Dr. Sunil Apsingi,Orthopedist,28,"MBBS, MS - Orthopaedics",₹ 500,₹ 200,Medicover Hospitals,Hi Tech City,,11:00 AM,3:00 PM,Hyderabad,
2298,248,Dr. Vijay Kumar Loya,Orthopedist,12,"MBBS Bachelor of Medicine and Bachelor of Surgery, MS - Orthopaedics, DNB (Orthopedics), F...read more",₹ 500,₹ 200,Bone Joint and Spine Clinic,Kachiguda,,6:00 PM,9:00 PM,Hyderabad,
2299,249,S.V.L.Narasimha Reddy,Orthopedist,20,"MBBS, DNB (Orthopedics)",₹ 400,₹ 200,Pragnya Ortho Care,Hyderabad,,7:00 PM,8:00 PM,Hyderabad,
2300,250,Dr Samhitha Alukur,Gynaecologist,10,"MBBS, DGO, DNB, MBBS, DGO, DNB",₹ 500,,Pristyn Care Clinic,Banjara Hills,,3:30 PM,8:30 PM,Hyderabad,
2301,251,Dr. Sindhuri Kapu,Gynaecologist,13,"MBBS, DNB - Obstetrics & Gynecology",₹ 800,₹ 500,Ankura Hospital for Women & Children - Banjara Hills,Hyderabad,,10:00 AM,6:00 PM,Hyderabad,
2302,252,Dr. Juhul Arvind Patel,Gynaecologist,8,"DNB, DGO, Dip. Hospital Administration, Diploma Gynaecological Endoscopy, Kiel Germany, PG...read more",₹ 500,₹ 300,Pristyn Care,Hyderabad,,10:00 AM,8:00 PM,Hyderabad,
2303,253,Dr. Paipuru,Gynaecologist,,,₹ 500,,Pristyn Care Clinic,Banjara Hills,,5:00 PM,8:00 PM,Hyderabad,
2304,254,Dr M Swapna Reddy,Gynaecologist,17,"MBBS, DGO",₹ 500,,Pristyn care,Hyderabad,,9:00 AM,6:30 PM,Hyderabad,
2305,255,Dr. Sadhvi Reddy,Gynaecologist,14,"Fellowship  In Minimal Access Surgery, MS - Obstetrics and Gynaecology, MBBS",₹ 500,₹ 500,Vijay Hospital,Dilsukhnagar,"No Periods, Sex Education, Irregular Periods ",11:00 AM,5:00 PM,Hyderabad,
2306,256,Dr. Shaivalini Kamarapu,Gynaecologist,13,"MBBS, MS - Obstetrics and Gynaecology, FMAS.Laparoscopy, Cosmetic Gynaecology",₹ 600,₹ 600,AMVI Hospital,Hyderabad,"No Periods, Pregnancy Query, Irregular Periods",10:00 AM,2:00 PM,Hyderabad,
2307,257,Dr. Radhika Kandula,Gynaecologist,23,"MBBS, DNB (Obstetrics and Gyneacology), FNB Reproductive Medicine",₹ 300,₹ 300,Institute of Women Health and Fertility,Kukatpally,"No Periods, Irregular Periods, Pregnancy ",10:00 AM,1:00 PM,Hyderabad,
2308,258,Dr. Vijaya Sree J,Gynaecologist,15,"MBBS Bachelor of Medicine and Bachelor of Surgery, Diploma in Obstetrics & Gynaecology, MS...read more",₹ 500,₹ 300,VIJAYA SREE CLINIC & DIAGNOSTICS,Habsiguda,,11:00 AM,9:00 PM,Hyderabad,
2309,259,Dr. Vani Cherukuri,Gynaecologist,37,"MBBS, MD - Obstetrics & Gynaecology, DGO",₹ 500,,₹ 1,000 onlineEVA Care Clinic- The Every Woman?s Clinic,,10:00 AM,5:00 PM,Hyderabad,
2310,260,Dr. Padma Gandham Gandham,Gynaecologist,34,"MBBS, Diploma in Advanced Obstetrics and Gynaecological Ultrasound",₹ 300,₹ 300,SVS Clinic,L B Nagar,,5:00 PM,8:30 PM,Hyderabad,
2311,261,Dr. Sumana T,Gynaecologist,22,"MBBS, DGO, Diploma in Anesthesiology",₹ 600,₹ 350,SLG HOSPITALS,Hyderabad,,9:00 AM,2:45 PM,Hyderabad,
2312,262,Dr. Vindhya Gemaraju,Gynaecologist,20,"MBBS, DNB - Obstetrics & Gynecology, DGO",₹ 600,₹ 350,SO Poly Clinic,Hyderabad,,10:30 AM,12:30 PM,Hyderabad,
2313,263,Dr. Usha Rani,Gynaecologist,47,"MD - Obstetrics & Gynaecology, Diploma in Obstetrics & Gynaecology, MBBS",₹ 800,₹ 700,Yashoda Hospitals,Hyderabad,,10:00 AM,2:30 PM,Hyderabad,
2314,264,Dr. Hima Deepthi.V,Gynaecologist,17,"MBBS, MS - Obstetrics and Gynaecology",₹ 500,₹ 300,Nova IVI Fertility,Banjara Hills,,9:00 AM,6:00 PM,Hyderabad,
2315,265,Dr. Radhika  Rani Akkineni,Gynaecologist,22,"MBBS, MS - Obstetrics and Gynaecology, Fellowship in Infertility",₹ 500,₹ 600,Dr. RADHIKA'S FERTILITY CENTER,Hyderabad,,5:00 PM,7:30 PM,Hyderabad,
2316,266,Dr. Bkn Sudha,Gynaecologist,15,DGO,₹ 500,₹ 300,SUDHA HOSPITAL,Hyderabad,Pregnancy ,5:00 PM,8:30 PM,Hyderabad,
2317,267,Dr. Srividya Tadru,Gynaecologist,5,"MS - Obstetrics and Gynaecology, DNB (Obstetrics and Gynecology), Fellowship in Reproducti...read more",₹ 300,₹ 400,Samraksha hospital for women and children,Hastinapuram,,5:00 PM,8:00 PM,Hyderabad,
2318,268,Dr. Madhavi Latha,Gynaecologist,23,"MBBS, DNB - Obstetrics & Gynecology, DGO",₹ 550,,Dr. Madhavi's Gynaecology Clinic,Hyderabad,,11:30 AM,2:00 PM,Hyderabad,
2319,269,Dr. Chandana Galidevara,Gynaecologist,15,"MRCOG(UK), MS - Obstetrics & Gynecology, DNB (Obstetrics and Gynecology), Fellowship in Mi...read more",₹ 600,,Satyasree Clinics & Diagnostics,Kondapur,,6:30 PM,9:30 PM,Hyderabad,
2320,270,Dr. Chandrakanth,Gynaecologist,28,"Diploma in Psychology and Sexology, Diploma in Obstetrics & Gynaecology, Royal College of ...read more",₹ 500,₹ 200,AKSHAYA HOSPITAL,Hyderabad,,11:30 AM,2:30 PM,Hyderabad,
2321,271,Dr. K Nageswari  Rao,Gynaecologist,33,"MD, MBBS",₹ 600,,Sri Swetha Multi Speciality Daycare Surgical Centre,Hyderabad,Pregnancy ,10:00 AM,4:00 PM,Hyderabad,
2322,272,Dr. T Anuradha,Gynaecologist,37,"MBBS, DGO",₹ 800,₹ 600,Anu's Gynaec,Test Tube&Fertility  Centre,,10:00 AM,2:00 PM,Hyderabad,
2323,273,Dr. Nuthalapati Suman Latha,Gynaecologist,22,"MBBS, DGO",₹ 400,₹ 500,Advanced Endocrine & Diabetes Hospital & Research Center,KPHB,,10:00 AM,2:00 PM,Hyderabad,
2324,274,Dr. Anuradha  Koduri,Gynaecologist,51,"MD - Obstetrtics & Gynaecology, MBBS, FACOG",,,,,,2:00 PM,6:00 PM,Hyderabad,
2325,275,Dr. Durga G Rao,Gynaecologist,31,"MRCOG, MBBS Bachelor of Medicine and Bachelor of Surgery, DGO",₹ 600,,Oasis Fertility,Banjara Hills,"Pregnancy, HPV, Abortion ",9:30 AM,5:00 PM,Hyderabad,
2326,276,Dr. Sunitha Ilinani,Gynaecologist,27,"MD - Obstetrics & Gynaecology, MBBS",₹ 700,₹ 300,Apollo Fertility,Banjara Hills,"No Periods, Sex Education, Pregnancy Query ",11:00 AM,2:00 PM,Hyderabad,
2327,277,Dr. Sweta Agarwal,Gynaecologist,30,"MS - Obstetrics and Gynaecology, FRANZCOG (Fellowship of Royal College of Obstric and Gyne...read more",₹ 700,,Southern Gem Hospital,Basheerbagh,,11:00 AM,1:00 PM,Hyderabad,
2328,278,Dr. Nasreen  Ashfaq,Gynaecologist,29,"Diploma in Obstetrics & Gynaecology, MBBS",₹ 650,,Femcity Women's Hospital,Shaikpet,,1:00 PM,4:00 PM,Hyderabad,
2329,279,Dr. Saraschandrika P. V.,Gynaecologist,61,"MBBS Bachelor of Medicine and Bachelor of Surgery, MD - Obstetrics & Gynaecology",₹ 600,,Banjara12 Hospital,Banjara Hills,,11:00 AM,1:00 PM,Hyderabad,
2330,280,Dr. Amishrita Chintawar,Gynaecologist,11,"MS - Obstetrics and Gynaecology, MBBS",₹ 300,₹ 250,Manasa Hospital,Ramanthapur,,10:00 AM,4:00 PM,Hyderabad,
2331,281,Dr. Naaz Fatima,Gynaecologist,9,"MBBS, MS - Obstetrics and Gynaecology",₹ 400,₹ 200,Alladins Clinic,Masab Tank,,5:00 PM,8:00 PM,Hyderabad,
2332,282,Dr. S Hima Bindu,Gynaecologist,25,"MBBS, DGO",₹ 700,₹ 300,Ankura Hospital For Women & Children,Hyderabad,,9:00 AM,3:00 PM,Hyderabad,
2333,283,Dr. B.Padmavathi Sreenivas,Gynaecologist,28,"MBBS, DGO",₹ 600,,Sri Sai Womens Hospital,Kothapet,,5:00 PM,8:30 PM,Hyderabad,
2334,284,Dr. Lakshmi Krishna Leela,Gynaecologist,26,"Doctor of Medicine (Obstetrics & Gynaecology), Royal College of Obstetricians & Gynaecolog...read more",₹ 800,,Elbit Diagnostic Centre,Madhapur,,5:00 PM,6:00 PM,Hyderabad,
2335,285,Dr. Sameera Alluri,Gynaecologist,36,"MBBS, MD - Obstetrics & Gynaecology",₹ 450,,Sri Sri Holistic Hospitals,Nizampet,,11:00 AM,1:00 PM,Hyderabad,
2336,286,Dr. Farzana Tasneem,Gynaecologist,39,Diploma in Obstetrics & Gynaecology,₹ 300,₹ 300,INNU CLINIC,Hyderabad,"Irregular Periods, Delivery ",3:30 PM,6:00 PM,Hyderabad,
2337,287,Dr. Bhavani Reddy A,Gynaecologist,33,"MBBS, MD - Obstetrics & Gynaecology",₹ 500,,Bhavya Multispeciality Hospital,Nagole,,7:00 PM,8:00 PM,Hyderabad,
2338,288,Dr. Sita Reddy,Gynaecologist,32,"MBBS Bachelor of Medicine and Bachelor of Surgery, MD - Obstetrtics & Gynaecology",₹ 500,₹ 500,Kindle Clinics,Gachibowli,,2:00 PM,5:00 PM,Hyderabad,
2339,289,Oasis Fertility,Gynaecologist,,,₹ 700,,Oasis Fertility,Banjara Hills,,9:00 AM,5:00 PM,Hyderabad,
2340,290,Dr. Swetha Shesham,Gynaecologist,12,"MBBS, MS, F.mas,D.mas, Fellowship in Robotic Surgery, Fellowship in Infertility",₹ 400,,Lakshmi Health Care Hospital,Vanasthalipuram,,10:30 AM,2:00 PM,Hyderabad,
2341,291,Dr. Arpitha Reddy,Gynaecologist,26,"MBBS, DGO, MRCOG(UK)",₹ 500,,Mums Fertility Center,Kukatpally,Sugar,9:00 AM,1:00 PM,Hyderabad,
2342,292,Dr. B. Kiranmayee,Gynaecologist,15,"Diploma in Reproductive Medicine (Germany), MS - Obstetrics and Gynaecology, MBBS",₹ 550,,Dr. Kiranmayee  Woman's Clinic,Gachibowli,,10:00 AM,1:00 PM,Hyderabad,
2343,293,Dr. Balamba P,Gynaecologist,58,"MBBS, MD - Obstetrtics & Gynaecology",₹ 400,,Shalini Hospital,Hyderabad,,10:00 AM,1:00 PM,Hyderabad,
2344,294,Dr. Sravana Soujanya,Gynaecologist,15,"MBBS, Diploma in Obstetrics & Gyanecology",₹ 700,,Medics Healthcare,Nanakramguda,,10:15 AM,12:30 PM,Hyderabad,
2345,295,Dr. Madhavi Reddy,Gynaecologist,29,"MBBS, DGO",₹ 500,₹ 200,Lucerne Clinic for Ladies,Alwal,,10:00 AM,1:00 PM,Hyderabad,
2346,296,Dr. G S K Jyothi Reddy,Gynaecologist,19,"MBBS, DGO",₹ 450,,Sai Shourya's Test Tube Baby Centre,KPHB,,7:30 PM,8:00 PM,Hyderabad,
2347,297,Dr. Ayesha Khaliq,Gynaecologist,22,"MBBS, MD - Obstetrtics & Gynaecology",₹ 300,,Health Inn Clinic,Toli Chowki,,5:00 PM,7:00 PM,Hyderabad,
2348,298,Dr. Swathi Reddy,Gynaecologist,14,"MBBS, DGO",₹ 500,,Himagiri Hospitals,Gachibowli,,7:00 PM,9:00 PM,Hyderabad,
2349,299,Dr. Haritha Yalamanchili,Gynaecologist,25,"MBBS, MD - Obstetrics & Gynaecology, MRCOG",₹ 400,,YPR Health Care,Madhapur,,9:30 AM,2:30 PM,Hyderabad,
2350,300,Dr. Chetan Raj,Homeopathy,18,"Diploma in Gastroenterology, Diploma In Pulmonary Medicine , MSCP, BHMS, SVD( Skin & Vener...read more",₹ 11,₹ 51,Dr. Chetan's Homeo Clinic,Begumpet,"Hair Fall, Acne/Pimples, Weight Loss",10:00 AM,5:00 PM,Hyderabad,
2351,301,Dr. Sreepada Kameswara Rao,Homeopathy,37,DHMS (Diploma in Homeopathic Medicine and Surgery),₹ 450,₹ 149,Dr SK.Rao clinic,Sanjeeva Reddy Nagar,"Migraine Treatment, Weight Loss, Weight Management",11:30 AM,12:30 PM,Hyderabad,
2352,302,Dr. Rajashekar Bogadi,Homeopathy,22,"BHMS, F.H.P.C.",₹ 300,₹ 200,Surecare Homeopathy,Hyderabad,"Headaches, Weight Loss, Stomach Pain ",10:00 AM,2:00 PM,Hyderabad,
2353,303,Dr. Shiva Reddy,Homeopathy,22,BHMS,₹ 350,₹ 349,Sree Sai Homoeopathy,Mehdipatnam,"Diabetes, Headaches, Body Weakness",10:00 AM,2:00 PM,Hyderabad,
2354,304,Dr. Anand Dhoot,Homeopathy,18,"BHMS, MD - Homeopathy, Msc - Counselling & Psycotherapy",₹ 200,₹ 200,Dr Anands Homeo clinic,Kachiguda,"Hair Loss, Diabetes, Diet Planning",12:30 PM,2:00 PM,Hyderabad,
2355,305,Dr. Shashank,Homeopathy,13,"BHMS, Ms. Counselling & Psychology",₹ 400,₹ 200,Dr. Shashank's Homeo Stores & clinic,Nallakunta,"Erectile Dysfunction, Neurological Problems, Sexually Transmitted Disease (STD) Treatment",10:00 AM,1:00 PM,Hyderabad,
2356,306,Dr. Prashant K Vaidya,Homeopathy,16,"Diploma In Gastroenterology, Diploma In Dermatology, BHMS",₹ 500,₹ 900,Spiritual Homeopathy,KPHB,"Female Hair Loss, Gaining Weight, Diabetes",5:00 PM,8:00 PM,Hyderabad,
2357,307,Dr. A P Aparna,Homeopathy,27,BHMS,₹ 600,₹ 600,Sree Homeo Care,Gachibowli,"Headaches, Gaining Weight, Increase height ",5:30 PM,7:30 PM,Hyderabad,
2358,308,Dr. Jagadeesh Babu,Homeopathy,26,"BHMS, MHM (NIMS), MD - Homeopathy, PGDCCR (NIMS), MSC Psychology, Professional Diploma In ...read more",,₹ 300,Sreaya Homepathic Stores & Clinic & Counselling Centre,Somajiguda,"Sex Education, Premature Ejaculation, Small Penis Size",9:00 AM,9:00 PM,Hyderabad,
2359,309,Dr. Kuravi Pavan Kumar Vsmk,Homeopathy,19,"BHMS, Masters in Homeopathic Remedies, Post Graduate Diploma In Hospital Administration (PGDHA)",₹ 300,₹ 300,Agastya homoeo clinic,Shaikpet,"Sex Education, Stomach Pain, Back Pain ",7:30 PM,9:30 PM,Hyderabad,
2360,310,Dr. Vv,Homeopathy,7,BHMS,₹ 300,₹ 150,Health Care,Banjara Hills,,8:00 AM,7:00 PM,Hyderabad,
2361,311,Dr. A M Reddy,Homeopathy,26,"BHMS, MD - Homeopathy",,,,,,10:00 AM,6:00 PM,Hyderabad,
2362,312,Dr. T Kirankumar,Homeopathy,28,BHMS,₹ 300,,,,,10:30 AM,8:00 PM,Hyderabad,
2363,313,Dr. Josy Joy A,Homeopathy,26,BHMS,₹ 200,₹ 200,,,"Skin Care, Hair Restoration ",10:30 AM,7:30 PM,Hyderabad,
2364,314,Dr. Mounika Kasam,Homeopathy,9,MD - Homeopathy,₹ 750,₹ 350,Happy Homoeo Life,Kondapur,,5:00 PM,9:00 PM,Hyderabad,
2365,315,Dr. Praveen G V S,Homeopathy,15,BHMS,₹ 200,₹ 500,GVS Clinic,Malkajgiri,"Small Penis Size, Sex Education, Back Pain",9:00 AM,6:00 PM,Hyderabad,
2366,316,Dr. G. Sridhar Kumar,Homeopathy,25,"MD - Homeopathy, BHMS",₹ 500,₹ 250,Venkata Sai Homoeo Clinic,Yousufguda,,9:30 AM,1:30 PM,Hyderabad,
2367,317,Dr. Naveen Kumar Boggarapu,Homeopathy,23,"BHMS, PG - Fellowship In Homeopathic Dermatology",₹ 500,₹ 600,Homeo Health,Hastinapuram,,10:30 AM,2:00 PM,Hyderabad,
