,Unnamed: 0,Name,Specialization,Experience (in years),Education,Fee at clinic,Online Fee,Clinic Name,Area,Recently Consulted for,Available From,Available Till,City,Unnamed: 0.1
646,396,Dr. Jyoti Vishwakarma,Psychologist,10,Post Graduation in Clinicl Psychology,₹ 300,₹ 200,,,,9:00 AM,3:00 PM,Pune,
647,397,Mrs. Gayathri,Psychologist,12,"Masters in Social Work (Specialised in Family and Child Welfare), B.A. Sociology",₹ 500,₹ 300,Park Street,Pimple Saudagar/Wakad/Aundh/Baner/Wakad,,7:00 PM,9:00 PM,Pune,
648,398,Dr. Usha Gokhale,Psychologist,26,"M A Clinical Psychology, , M. S. W.Usha Gokhale Counseling Clinic    , Pun",,,,,,,,Pune,
649,399,Ms. Megha Shah,Psychologist,11,masters in clinical psychology,₹ 500,₹ 100,Megha Shah,Pune,,4:30 PM,6:30 PM,Pune,
650,400,Dr. Sanjay Erande,Ayurveda,20,"Fellowship In Sexology, M-CSEPI, M.Ayu.D, Dipl.EMS, BAMS, Fellowship In Sexology",,,,,"Male Sexual Problems, Erectile Dysfunction, Small Penis SizeNext ",6:00 PM,9:00 PM,Pune,
651,401,Dr. Rahul Waghole,Ayurveda,20,"Bachelor of Ayurveda, Medicine and Surgery (BAMS), Yog Ayurved Padvika, M.A.(Sanskrit)",₹ 300,₹ 250,Waghole Ayurved Clinic,Saswad road,,6:00 PM,8:30 PM,Pune,
652,402,Rejuva Skin,Ayurveda,16,Diploma in Cosmatology,₹ 300,₹ 200,Rejuva Skin Clinic,Pune,"Skin Care, Skin Treatment, Allergy",9:30 AM,1:30 PM,Pune,
653,403,Dr. Jiva Ayurveda,Ayurveda,26,BAMS,₹ 299,,,,"Acne Treatment, Hair Loss, Flu",10:00 AM,7:00 PM,Pune,
654,404,Dr. Adesh Karwa,Ayurveda,21,"BAMS, MD - Ayurveda Medicine",₹ 500,₹ 200,Ayurveda Clinic,DP Road,,10:00 AM,2:00 PM,Pune,
655,405,Dr. Gajanan Manamwar,Ayurveda,14,BAMS,₹ 500,₹ 350,Shree Vishwasanskruti Ayurved Chikitsalaya,Hinjewadi,"Staying Healthy, UTI, Increase height",5:00 PM,9:00 PM,Pune,
656,406,Dr. Lunkad Vaibhav,Ayurveda,34,"MBBS, DIiploma in Yoga and Ayurveda, Diploma In Dermatology And Venerology And Leprosy (DD...read more",₹ 500,₹ 500,Aaiina Clinic,Shukrawar peth,"Sex Education, Male Sexual Problems, Male Sexual Problems TreatmentNext ",5:00 PM,8:30 PM,Pune,
657,407,Dr. Jeevan Sampat Jadhav,Ayurveda,17,BAMS,₹ 200,₹ 300,,,"Gaining Weight, Skin Care, Knee Pain",10:30 AM,5:00 PM,Pune,
658,408,Dr. Omkar Shahapurkar,Ayurveda,21,"BAMS, MD",₹ 300,,₹ 1,000 onlineSiddhi Clinic,"Sex Education, Acidity, Acne/PimplesNext ",5:00 PM,9:00 PM,Pune,
659,409,Dr. Shekhar Benade,Ayurveda,24,"BAMS, MD - Ayurveda Medicine, Master in Sexual Medicine, Proficiency in Psycosexual Medici...read more",₹ 500,₹ 700,Dr Benade's E Sexologist Pune And Male Infertility Treatments,Balewadi,"Premature Ejaculation, Sugar, Small Penis Size",10:00 AM,9:00 PM,Pune,
660,410,Dr. Anupam Dandgavhal,Ayurveda,17,"BAMS, PGFP, M. D. Medicine (ayu)",₹ 200,₹ 300,,,"Body Weakness, Leg Pain, Female Hair LossNext ",2:30 PM,8:30 PM,Pune,
661,411,Dr. Ravindra Borade,Ayurveda,17,"BAMS, Certificate Course In Sex Therapy & Counselling, Yog Ayurved Padvika",₹ 200,₹ 400,Param Ayurved,Kasarwadi,,4:00 PM,8:30 PM,Pune,
662,412,Dr. Syam Bhargavan,Ayurveda,24,"BAMS, MD - Ayurveda",₹ 500,₹ 300,Muppra Kerala Ayurvedic,Baner,,6:00 PM,7:30 PM,Pune,
663,413,Dr. Sunita Chaudhari,Ayurveda,33,"BAMS, PhD - Ayurveda",₹ 300,₹ 350,Ayurmantra Ayurveda Center,Aundh,"Weight Loss, Asthma, Baldness",9:00 AM,1:00 PM,Pune,
664,414,Dr. Lalta  Prasad,Ayurveda,55,"MS, Bachelor of Ayurveda, Medicine and Surgery (BAMS)",₹ 200,,Sushruta Clinic,sangvi,ComaNext ,7:00 PM,8:00 PM,Pune,
665,415,Dr. Kedar  Ghatnekar,Ayurveda,16,"Bachelor of Ayurveda, Medicine and Surgery (BAMS)",₹ 200,₹ 200,Saptarshee Clinics,Shukrawar peth,,4:00 PM,8:00 PM,Pune,
666,416,Dr. Jyoti Shirodkar,Ayurveda,32,"BAMS, MD - Ayurveda Pharmacology, Ph.D - Diabetes Prediction Thesis, BA (Sanskrit), MA (En...read more",₹ 800,₹ 300,Dr. Shirodkar's Health Solutions Pvt. Ltd.,NDA Road,,4:00 PM,7:00 PM,Pune,
667,417,Dr. Shailesh Shamkant Phalle,Ayurveda,16,"Bachelor of Ayurveda, Medicine and Surgery (BAMS), MD - Medicine",₹ 250,₹ 100,Ayusanjivani Speciality Clinic And Panchakarma Center,Kharadi,,9:00 AM,12:00 PM,Pune,
668,418,Dr. Samarth Kotasthane,Ayurveda,17,"Bachelor of Ayurveda, Medicine and Surgery (BAMS), MD - Ayurveda",₹ 500,₹ 300,Shri Vishwagandh Ayurved & Panchkarma Clinic,Bibwewadi,"Weight Loss, Body Weakness, Sex Education",9:30 AM,10:30 AM,Pune,
669,419,Vardhayu Ayurved And Panchakarma,Ayurveda,9,MDS - Oral & Maxillofacial Surgery,₹ 300,₹ 100,,,"Panchakarma, Ayurvedic Massage",7:00 PM,9:00 PM,Pune,
670,420,Dr. Kedar  Ghatnekar,Ayurveda,16,"Bachelor of Ayurveda, Medicine and Surgery (BAMS)",₹ 200,₹ 200,Saptarshee Clinics,Shukrawar peth,,4:00 PM,8:00 PM,Pune,
671,421,Dr. Lalta  Prasad,Ayurveda,55,"MS, Bachelor of Ayurveda, Medicine and Surgery (BAMS)",₹ 200,,Sushruta Clinic,sangvi,ComaNext ,7:00 PM,8:00 PM,Pune,
672,422,Dr. Geetanjali Thokal,Ayurveda,15,"MD, Bachelor of Ayurveda, Medicine & Surgery (BAMS)",₹ 300,₹ 300,Heal & Care Ayurveda Clinic,Pimple Saudagar,,9:30 AM,12:00 PM,Pune,
673,423,Dr. Anand Vikram Kale,Ayurveda,15,"Bachelor of Ayurveda, Medicine and Surgery (BAMS), MD - Ayurveda, D.Y.A",₹ 200,₹ 300,Rasgandha Ayurvedic Clinic & Panchakarma Health Centre,Chinchwad,,9:30 AM,1:00 PM,Pune,
674,424,Dr. Madhura Atul Bhide,Ayurveda,27,"Bachelor of Ayurveda, Medicine and Surgery (BAMS), MD - Ayurveda",₹ 750,₹ 200,Dr Madhura Bhide,Shivaji Nagar,"Gaining Weight, Trying to Conceive, DepressionNext ",10:00 AM,1:00 PM,Pune,
675,425,Dr. Nikhil Pendse,Ayurveda,17,"BAMS, MD- Ayurved, Diploma in Vaidya Visharad",₹ 300,₹ 300,Vivaswan Ayurvedic Wellness Centre,Paud Road,,12:00 PM,2:00 PM,Pune,
676,426,Dr. Avinash Deore,Ayurveda,20,"MD, BAMS",₹ 200,,Shree Sai Ayurvedic Panchakarma Clinic &Infertility Research Clinic,Pimpri,,5:00 PM,9:00 PM,Pune,
677,427,Dr. Hemant Chavan,Ayurveda,17,"BAMS, Diploma In Yoya & Ayurved",₹ 200,₹ 250,Ayuspand Ayurvedic Clinic & Panchakarma Center,Pimple Saudagar,Hair Loss,5:30 PM,9:00 PM,Pune,
678,428,Dr. Mayur Surana,Ayurveda,11,"MD, DYA, PGDCR",₹ 300,,,,"Increase height, Weight Loss, Hair Loss",7:00 PM,9:00 PM,Pune,
679,429,Dr. K D,Ayurveda,15,"Bachelor of Ayurveda, Medicine and Surgery (BAMS), MD - Ayurveda",₹ 300,₹ 200,Maheshwar Clinic,Pune,"Gaining Weight, Hair Loss, Leg Pain",10:00 AM,5:00 PM,Pune,
680,430,Dr. K D,Ayurveda,15,"Bachelor of Ayurveda, Medicine and Surgery (BAMS), MD - Ayurveda",₹ 300,₹ 200,Maheshwar Clinic,Pune,"Gaining Weight, Hair Loss, Leg Pain",10:00 AM,5:00 PM,Pune,
681,431,Dr. Mayur V Shiralkar,Ayurveda,23,"Bachelor of Ayurveda, Medicine and Surgery (BAMS), MS - ENT",₹ 200,₹ 300,SHIRALKAR HOSPITAL,Chinchwad,,6:00 PM,9:30 PM,Pune,
682,432,Dr. Avinash Deore,Ayurveda,20,"MD, BAMS",₹ 200,,Shree Sai Ayurvedic Panchakarma Clinic &Infertility Research Clinic,Pimpri,,5:00 PM,9:00 PM,Pune,
683,433,Dr. Sunil Ugile,Ayurveda,29,"Bachelor of Ayurveda, Medicine and Surgery (BAMS)",₹ 700,,Pune Piles Care,Pimple Saudagar,,11:30 AM,2:00 PM,Pune,
684,434,Dr. Pankaj Nahata,Ayurveda,14,BAMS,₹ 100,₹ 300,Shree Vishwamani Ayurvedic Clinic & Panchakarma Centre,Bibwewadi,"Premature Ejaculation, Weight Loss, Dark Circle",5:00 PM,9:00 PM,Pune,
685,435,Dr. Savita Nemade,Ayurveda,14,"BAMS, MD (Kayachikitsa)",₹ 500,₹ 300,Vedika Multi-speciality Clinic And Panchkarma Ceter,Viman Nagar,,10:00 AM,4:00 PM,Pune,
686,436,Dr. Vikas Chothe,Ayurveda,10,"MD - Ayurveda, FIIM, MD",₹ 200,,Vikas Chothe,Chinchwad,,9:00 AM,9:00 PM,Pune,
687,437,Dr. Shreeram Agashe,Ayurveda,19,"Ph.D. (Scholar) Ayurveda, MD - Ayurveda, BAMS",₹ 200,,Agashe Clinic,Pune,,9:00 AM,1:00 PM,Pune,
688,438,Dr. Niloy Kar,Ayurveda,25,"BAMS, MD - Alternate Medicine",₹ 300,₹ 300,Sanjeevani Ayurvediya Chikitsalaya & Panchkarma Kendra,Kondhwa Khurd,,10:00 AM,1:00 PM,Pune,
689,439,Dr. Dipti Kapare,Ayurveda,19,"BAMS, MSC In Counselling, Certificate of Pranic Psychotherapy Course, Diploma in Counselli...read more",,,,,,6:00 PM,8:30 PM,Pune,
690,440,Dr. Manisha Thakur,Ayurveda,19,"Bachelor of Ayurveda, Medicine and Surgery (BAMS)",₹ 300,₹ 500,Mauli clinic,Kharadi,,9:00 AM,2:00 PM,Pune,
691,441,Dr. Pankaj Ingawale,Ayurveda,19,"Bachelor of Ayurveda, Medicine and Surgery (BAMS)",₹ 300,₹ 200,Shri Vishwasudha Ayurvedic Clinic And Panchakarma Center,Pune,,10:00 AM,1:00 PM,Pune,
692,442,Dr. Pankaj Nahata,Ayurveda,14,BAMS,₹ 100,₹ 300,Shree Vishwamani Ayurvedic Clinic & Panchakarma Centre,Bibwewadi,"Premature Ejaculation, Weight Loss, Dark Circle",5:00 PM,9:00 PM,Pune,
693,443,Dr. Dipti Kapare,Ayurveda,19,"BAMS, MSC In Counselling, Certificate of Pranic Psychotherapy Course, Diploma in Counselli...read more",,,,,,6:00 PM,8:30 PM,Pune,
694,444,Dr. Vikas Chothe,Ayurveda,10,"MD - Ayurveda, FIIM, MD",₹ 200,,Vikas Chothe,Chinchwad,,9:00 AM,9:00 PM,Pune,
695,445,Dr. Vaibhav Savale,Ayurveda,11,"BAMS, PG Diploma In Clinical Cosmetology (PGDCC)",₹ 300,₹ 99,Rejuvenate Hair & Skin Clinic,Aundh,,5:00 PM,9:00 PM,Pune,
696,446,Dr. Atul Kumar Bedre,Ayurveda,33,"Bachelor of Ayurveda, Medicine and Surgery (BAMS)",₹ 300,₹ 300,Dr. Bedre's Panchakarma,Chandan Nagar,,10:00 AM,2:00 PM,Pune,
697,447,Dr. Vrushali  Waghole,Ayurveda,16,"BAMS, MD - Ayurveda",₹ 200,₹ 200,Waghole Ayurved Clinic,Pune,,6:00 PM,8:00 PM,Pune,
698,448,Dr. Priti Mangesh Deshmukh,Ayurveda,19,"BAMS, MD - Ayurveda Medicine",₹ 400,,Pranav Ayurveda Panchakarma Clinic,Pimpri Chinchwad,,7:00 PM,8:00 PM,Pune,
699,449,Dr. Yogita M Chaudhari,Ayurveda,10,MD - Ayurveda Medicine,₹ 300,₹ 200,Bhagirathi Ayurveda Centre,Pune,,10:00 AM,1:00 PM,Pune,
700,0,Dr Vikas Yadav Yadav,Dentist,18,"MBBS, MS - Obstetrics & Gynaecology, DNB - Obstetrics & Gynecology",₹ 100,,MEDIDENT SUPERSPECIALITY DENTAL & POLY CLINIC,Najafgarh,,9:00 AM,1:00 PM,Delhi,0
701,1,Dr. Sandeep Kumar Jangra,Dentist,24,"MDS - Orthodontics, BDS, Certified Implantologist",₹ 500,₹ 300,The White Expert Dental Care,East Of Kailash,,9:30 AM,5:30 PM,Delhi,1
702,2,Dr. Ashok Yadav,Dentist,14,"MDS - Orthodontics, BDS",₹ 200,,Dr. Ashok's Dentistree,Gole Market,,10:00 AM,7:00 PM,Delhi,2
703,3,Dr. (Prof) Rachit Walia,Dentist,20,"MDS , BDS",₹ 500,₹ 500,K.V Dentals,Gulabi Bagh,,5:00 PM,8:00 PM,Delhi,3
704,4,Dr. Kultej Saluja,Dentist,32,"BDS, Certified Implantologist",₹ 300,₹ 500,Dentalservices,Lajpat Nagar,,9:30 AM,6:30 PM,Delhi,4
705,5,Dr. Devaanshu Dewan,Dentist,19,"BDS, BDS (Implantologist)",₹ 200,₹ 300,S.K Dental Care,Uttam Nagar,"Tooth Extraction, Gap ClosingNext ",10:15 AM,8:30 PM,Delhi,5
706,6,Dr. Shipra Rawal,Dentist,29,"BDS, Certified Implantologist",₹ 400,₹ 500,Dr.Rawal Dental Centre,Uttam Nagar,,5:00 PM,8:00 PM,Delhi,6
707,7,Dr. Aashish Pandit,Dentist,14,"BDS, MDS - Periodontics, Post-Graduate Certificate in Oral Implantology (PGCOI)",₹ 300,₹ 200,Dr. Pandit's Dental & Implant Center,Delhi,,9:30 AM,2:00 PM,Delhi,7
708,8,Dr. Avinash Singh,Dentist,21,"BDS, MDS",₹ 300,₹ 300,AMAR DENTAL CLINIC,Delhi,,10:00 AM,9:00 PM,Delhi,8
709,9,Dr. Vineet Kapoor,Dentist,16,"BDS (Implantologist), MDS - Periodontics",₹ 300,₹ 400,Cures 'n' Care Dental Clinic - Vasundhara,Vasundhara,"Gap Closing, Painful Teething, Toothache",10:30 AM,1:30 PM,Delhi,9
710,10,Dr. Amandeep Singh Arora,Dentist,13,MDS - Pedodontics,₹ 500,₹ 500,Dr. Aman's Tooth Town,Vasant Vihar,Teeth Cleaning,10:30 AM,8:00 PM,Delhi,10
711,11,Dr. Shri Krishna Kabra,Dentist,24,"MDS Prosthodontics, BDS",₹ 300,,Smile konnekt Dental Clinic,Delhi,,10:30 AM,1:30 PM,Delhi,11
712,12,Dr. Pankaj Rao,Dentist,18,"B.D.S, M.D.S Endodontist",₹ 500,₹ 500,oraa care smile dental clinic,Dwarka,"Root canal, Root Canal Treatment (RCT), Root Canal Treatment",3:00 PM,9:00 PM,Delhi,12
713,13,Dr. Rajeev Gupta,Dentist,29,BDS,₹ 500,₹ 200,Balaji Multispeciality Dental Centre,Paschim Vihar,"Painful Teething, Gap Closing, Bleeding GumsNext ",5:00 PM,8:00 PM,Delhi,13
714,14,Dr. Deepti Rajput,Dentist,17,"BDS, MDS",₹ 669,₹ 300,Bytes And Braces,Rajouri Garden,"Dental Fillings, Fillings, ImplantsNext ",5:00 PM,8:00 PM,Delhi,14
715,15,Dr. Rajnish K Jain M.D.S.,Dentist,23,MDS,₹ 400,,Dr. Rajnish K. Jain's Super Speciality Dental Clinic & Implant Centre,Pitampura,"Fillings, Root canal, Root Canal TreatmentNext ",6:00 PM,8:30 PM,Delhi,15
716,16,Dr. Sundeep Khurana,Dentist,26,BDS,₹ 400,₹ 150,,,"Stained Teeth, Dental Fillings, Teeth WhiteningNext ",4:30 PM,8:00 PM,Delhi,16
717,17,Dr. Priyank Jayna,Dentist,23,"MDS - Orthodontics, B.D.S.",₹ 750,,Jayna Dental Center,Connaught Place,,2:00 PM,5:30 PM,Delhi,17
718,18,Dr. Prof.Asheesh Gupta,Dentist,24,"MDS, Certificate in implantology, MDS",₹ 200,₹ 200,Dr. Gupta's Dental & Braces Clinic,Rohini,"Painful Teething, Mouth Sores, Teeth Cleaning",11:00 AM,1:30 PM,Delhi,18
719,19,Dr. Apoorv Mittal,Dentist,29,"Bachelor of Dental Surgery, Diploma in Hospital Administration, Diploma in Pharmacy",₹ 100,₹ 100,Shivam Hospital,Rohini Sector 16,,12:00 PM,2:00 PM,Delhi,19
720,20,Dr. Ashutosh Jha,Dentist,17,"BDS, B.D.S,B.sc.Hons,P.G.C.I.D,P.G.C.A.D",₹ 100,₹ 100,Hms Dental Clinic & Implant Centre,Madhu Vihar,,1:00 PM,4:00 PM,Delhi,20
721,21,Dr. Bhupendra Singh Rawat,Dentist,18,BDS,₹ 400,,Health Factor Multi Speciality Clinic,Hari Nagar,,6:00 PM,7:00 PM,Delhi,21
722,22,Dr. Sony Mishra,Dentist,22,"MDS, BDS",₹ 650,₹ 300,Smilekraft Multispeciality Dental Clinics,Delhi,"Braces for Adults and Teens, Dental Care, Dental ImplantsNext ",9:30 AM,2:00 PM,Delhi,22
723,23,Dr. Divya Swarup,Dentist,14,"MDS - Orthodontics & Dentofacial Orthopaedics, BDS (Implantologist)",₹ 400,₹ 300,,,,5:00 PM,9:00 PM,Delhi,23
724,24,Dr. Gaurav Jain,Dentist,23,"MFDS RCPS (Glasgow), MDS - Oral & Maxillofacial Surgery, BDS",₹ 600,₹ 500,Supreme Smile,Mayur Vihar Phase 1,"Fillings, Root canal, Root Canal Treatment",10:00 AM,2:30 PM,Delhi,24
725,25,Dr. Mahinder Singh Yadav,Dentist,20,"BDS, MDS - Orthodontics",₹ 500,,Shri Balaji Dental & Orthodontic Centre,Dwarka,Jaw ReshapingNext ,9:30 AM,1:30 PM,Delhi,25
726,26,Dr. Mayank Ashok,Dentist,14,"Orthodontist  BDS, MDS - Orthodontics & Dentofacial Orthopaedics",₹ 300,,Olive Dental Clinic,C R Park,Dental FillingsNext ,7:00 AM,1:30 PM,Delhi,26
727,27,Dr. Varun Dahiya,Dentist,21,"BDS, MDS(Periodontology)",₹ 500,₹ 100,,,"Braces for Adults and Teens, Implant Tooth Fixing, Dental Implant FixingNext ",10:00 AM,6:00 PM,Delhi,27
728,28,Dr. Aseem Arora,Dentist,22,BDS,₹ 500,,Dr J M Arora Dental Clinic,Alaknanda,,5:30 PM,8:30 PM,Delhi,28
729,29,Dr. Mohit Sachdeva,Dentist,16,BDS & Masters in Oral lasers,₹ 200,₹ 200,Rajdhani Dental Care Clinic,Preet Vihar,,9:00 AM,7:00 PM,Delhi,29
730,30,Dr. T. Chandan,Dentist,28,"MDS, BDS",₹ 500,₹ 300,Planet Dental,Saket,"Painful Teething, Toothache, Stained TeethNext ",5:00 PM,8:30 PM,Delhi,30
731,31,Dr. Ankit Sharma,Dentist,14,BDS,₹ 500,₹ 300,The Dental Hub and Implant Centre,Vasant Kunj,"Stained Teeth, Painful Teething, Cavities",5:00 PM,9:00 PM,Delhi,31
732,32,Dr. Priti A Kumar,Dentist,28,BDS,₹ 400,₹ 300,Madhav Dental Clinic,Kalkaji,"Toothache, Stained Teeth, Broken TeethNext ",10:30 AM,2:00 PM,Delhi,32
733,33,Dr. Rishabh S Gupta,Dentist,13,"BDS, M.Sc - Master of Oral Implantology (MOI)",₹ 400,₹ 100,,,,9:00 AM,8:00 PM,Delhi,33
734,34,"Dr. Arun Kant, Mds",Dentist,13,"BDS, MDS Prosthodontics and Implantology",₹ 200,₹ 100,Naturopathy & Dental,Dwarka Sector 7,,,,Delhi,34
735,35,Dr. Adosh Lall,Dentist,30,"MDS , BDS",₹ 300,,Dr Lalls Dental Specialities,Pitampura,,5:30 PM,8:30 PM,Delhi,35
736,36,Dr. Atul Jain,Dentist,13,BDS,₹ 100,₹ 400,,,,10:00 AM,2:00 PM,Delhi,36
737,37,Dr. Varun Gera,Dentist,13,BDS,₹ 300,₹ 200,The Dental Hub and Implant Centre,Vasant Kunj,"Broken Teeth, Painful Teething, Swollen GumsNext ",10:00 AM,8:30 PM,Delhi,37
738,38,Dr. Geeta Sahani,Dentist,28,BDS,₹ 500,₹ 300,Dr.Sahani Clinic,Punjabi Bagh,Root canalNext ,6:00 PM,8:00 PM,Delhi,38
739,39,Dr. Neha Dixit,Dentist,15,MDS,₹ 200,,Kamla Dixit DENTAL Care Center,Delhi,,6:00 PM,8:30 PM,Delhi,39
740,40,Dr. Sumit Munjal,Dentist,26,PG in Laser Dentistry,₹ 400,,munjals superspecialty dental & orthodontic centre,Mehrauli,,9:30 AM,7:30 PM,Delhi,40
741,41,Dr. Vineet Kumar Singh,Dentist,14,BDS,₹ 200,₹ 200,Singh Dental & Smile Design Centre,Mahavir Enclave,"Root canal, Teeth Cleaning",9:30 AM,9:00 PM,Delhi,41
742,42,Dr. Puneet Dara,Dentist,22,BDS,,₹ 300,Dara's Dental Center,Lajpat Nagar,,10:30 AM,6:00 PM,Delhi,42
743,43,Dr. Nitin Rastogi,Dentist,19,BDS,₹ 250,,,,,9:30 AM,2:00 PM,Delhi,43
744,44,Dr. Hitesh Arora,Dentist,17,"M.D.S., BDS",₹ 300,₹ 300,DENTELLE Clinic,Lajpat Nagar,,10:00 AM,8:00 PM,Delhi,44
745,45,Dr. Gagan Khanna,Dentist,20,"MDS Prosthodontics, BDS",₹ 300,₹ 500,,,Wisdom Tooth RemovalNext ,5:00 PM,9:00 PM,Delhi,45
746,46,Dr. Atul Goel,Dentist,21,BDS,₹ 300,₹ 300,Goel Dental  Centre,Paschim Vihar,,9:30 AM,1:30 PM,Delhi,46
747,47,Dr. Vinod Khanna,Dentist,14,"BDS, MDS Prosthodontics",₹ 500,₹ 100,Complete Dental Care,Ramesh Nagar,Root canal,5:00 PM,9:00 PM,Delhi,47
748,48,Dr. Siddhartha Pujari,Dentist,22,"MDS Endodontist, BDS",₹ 700,,Smileoracles Multispeciality Dental Clinic,Greater Kailash 2,,10:00 AM,1:00 PM,Delhi,48
749,49,Dr. Neeraj Kapila,Dentist,29,"BDS, FICD",₹ 500,₹ 600,Carewell Dental Clinic,Mayur Vihar,,5:00 PM,8:00 PM,Delhi,49
750,50,Dr Sunakshi Singh,Dermatologist,15,"MD - Dermatology, MBBS",,,,,"Acne/Pimples, Pimples, Hair LossNext ",12:30 PM,6:30 PM,Delhi,50
751,51,Dr. Lipy Gupta,Dermatologist,19,"MD - Dermatology , Venereology & Leprosy, MBBS",,₹ 800,Green Park Family Medicine Clinic,Green Park,"Pimples, Hair Fall, Acne/PimplesNext ",4:00 PM,6:30 PM,Delhi,51
752,52,Dr. Suruchi Puri,Dermatologist,24,"MBBS, MD (Skin & V.D. MAMC) - Dermatology",,,,,"Pimples, Hair Loss, Hair FallNext ",11:00 AM,8:00 PM,Delhi,52
753,53,Dr. A.K.Chatterjee,Dermatologist,48,"MBBS, DVD",₹ 700,₹ 600,Chatterjee Skin Care Center,Yamuna Vihar,"Acne/Pimples, Skin Infections, Skin TreatmentNext ",6:30 PM,8:30 PM,Delhi,53
754,54,Dr. Sandeep Gupta The Dermatologist,Dermatologist,20,"MBBS, MD - Dermatology, observership Dermatosurgery IADVL",₹ 700,,₹ 1,800 onlineBalaji Skin Clinic,"Acne/Pimples, Pimples, Hair FallNext ",5:30 PM,8:00 PM,Delhi,54
755,55,Dr. Mudasir Rashid Khan,Dermatologist,30,"MBBS Bachelor of Medicine and Bachelor of Surgery, MD - Dermatology",₹ 700,₹ 600,Lush Skin & Hair Clinic,Jasola,,11:00 AM,7:00 PM,Delhi,55
756,56,Dr. Deepti Shrivastava,Dermatologist,34,"PG Dip Dermatology, Fellowship in Aesthetic Medicine, MBBS",,,,,"Greying Hair, Black Spots on Skin, PimplesNext ",4:00 PM,6:30 PM,Delhi,56
757,57,Dr. Sandesh Gupta,Dermatologist,29,"MBBS, Diploma in Venerology & Dermatology (DVD)",₹ 400,₹ 400,Skin N Laser Centre,Krishna Nagar,"Pimples, Acne/Pimples, Hair FallNext ",11:00 AM,2:30 PM,Delhi,57
758,58,Dr. Sanjeev Jain,Dermatologist,32,MD,₹ 600,,Dr Sanjeev Jain Skin Care Clinic,Daryaganj,,8:30 AM,2:00 PM,Delhi,58
759,59,Dr. Amit Seth,Dermatologist,29,"MD, MBBS",,,,,"Advanced Skin Care, Skin Care, Acne Scars TreatmentNext ",10:30 AM,7:00 PM,Delhi,59
760,60,Dr. Pankaj Chaturvedi,Dermatologist,19,"MD, MBBS",,,,,"Hair Loss, Hair Treatment, AllergyNext ",10:00 AM,8:00 PM,Delhi,60
761,61,Dr. Munish Paul,Dermatologist,30,"MD-Dermatology, MBBS",,,,,"Pimples Treatment, Pimples, Acne / Pimples TreatmentNext ",11:00 AM,6:00 PM,Delhi,61
762,62,Dr. Jyoti Sharma,Dermatologist,21,"MD - Dermatology, MBBS",,₹ 300,Vardaan Skin and Bone Clinic,Rohini,"Acne / Pimples Treatment, Pimples, Hair LossNext ",10:00 AM,2:30 PM,Delhi,62
763,63,Dr. A V Singh,Dermatologist,31,"MD, DVD, MBBS",₹ 600,₹ 300,SKIN CARE,Dwarka,"Hair Loss, Hair Fall, Hair TreatmentNext ",5:00 PM,7:00 PM,Delhi,63
764,64,Isaac - International Skin & Anti Ageing Centre,Dermatologist,24,ISAAC,,,,,"Acne/Pimples, Hair Loss, Black Spots on Skin",10:00 AM,7:00 PM,Delhi,64
765,65,Dr. Gaurav Garg,Dermatologist,18,"Fellow In Dermato - Surgery, Fellow In Hair Transplant Surgery, MD - Dermatology, MBBS",,₹ 800,Dermalife Clinic,Green Park,"Hair Loss, Baldness, Hair Growth",11:00 AM,12:30 PM,Delhi,65
766,66,Dr. Geetika Mittal Gupta,Dermatologist,19,"Post Graduate Diploma Practical Dermatology, MBBS",,,,,"Laser Hair Removal, Growing beard",10:00 AM,7:00 PM,Delhi,66
767,67,Dr. Rohit Batra,Dermatologist,25,"MD - Dermatology, MBBS",,,,,"Pimples, Pimples Treatment, Acne / Pimples TreatmentNext ",5:30 PM,8:00 PM,Delhi,67
768,68,Dr. Neeraj Kumar,Dermatologist,14,"MBBS, MD - Dermatology",₹ 800,₹ 800,Magical Morphers Pvt Ltd,Delhi,"Hair Loss, Hair Fall, Acne/Pimples",5:00 PM,8:00 PM,Delhi,68
769,69,Looks Forever Hair And Skin Aesthetic Clinic,Dermatologist,23,Dermatologist,₹ 200,₹ 299,,,"Hair Loss, Hair Loss, Hair Transplant",11:00 AM,6:00 PM,Delhi,69
770,70,Dr. Himanshu Gupta,Dermatologist,19,"Fellow of ACSI , Fellow of IADVL , MD - Dermatology, Venereology & Leprosy, MBBS",₹ 400,₹ 500,Skin Konnect Ghaziabad,Naya Ganj,"Hair Loss, Skin Whitening, PimplesNext ",7:00 PM,8:30 PM,Delhi,70
771,71,Dr. Manju Keshari,Dermatologist,30,"MBBS, MD - Dermatology , Venereology & Leprosy",₹ 800,,₹ 2,000 onlineKemps Skin Clinic,"Pimples, Pigmentation, Skin InfectionsNext ",4:00 PM,6:00 PM,Delhi,71
772,72,Dr. Jangid,Dermatologist,11,MD,,,,,"Pimples, Acne/Pimples, Hair GrowthNext ",10:30 AM,6:30 PM,Delhi,72
773,73,Dr. Dharamvir Singh,Dermatologist,17,"MD - Dermatology , Venereology & Leprosy, MBBS",,,,,"Hair Loss, Hair Fall, Acne/PimplesNext ",11:30 AM,5:30 PM,Delhi,73
774,74,Dr. Rajesh Aggarwal,Dermatologist,22,"MD - Dermatology, MBBS",₹ 800,₹ 700,Dr. Rajesh Aggarwal's Skin Hair Nail Laser Clinic,Rohini,"Hair Loss, Pimples Treatment, Hair FallNext ",6:00 PM,9:00 PM,Delhi,74
775,75,Dr. Varun Tyagi,Dermatologist,15,"MD - Dermatology , Venereology & Leprosy",₹ 800,₹ 500,Perfect Tyagi Hospital,Dilshad Garden,"Laser Hair Removal, Ear Lobe Repair, ColonoscopyNext ",6:00 PM,8:00 PM,Delhi,75
776,76,Dr. Kanu Verma,Dermatologist,22,"MBBS, MD - Dermatology",₹ 600,₹ 600,Aastha Medicare,Dwarka Sector 12A,"Acne/Pimples, Greying Hair, Acne ScarsNext ",11:00 AM,12:30 PM,Delhi,76
777,77,Dr. Latika Arya,Dermatologist,31,"MBBS, MD - Dermatology",,,,,"Pimples, Acne/Pimples, Hair LossNext ",3:00 PM,5:30 PM,Delhi,77
778,78,Dr. Nivedita Dadu,Dermatologist,21,"MBBS, Diploma In Dermatology And Venerology And Leprosy (DDVL), DNB (Dermatology), MNAMS",,,,,"Pimples, Acne/Pimples, Hair FallNext ",9:00 AM,6:00 PM,Delhi,78
779,79,Dr. Alka Gupta,Dermatologist,37,"MBBS, MD - Dermatology",₹ 500,,Gupta Skin Clinic,Janakpuri,"Allergy, Pimples TreatmentNext ",5:00 PM,8:30 PM,Delhi,79
780,80,Dr. S. K. Kashyap,Dermatologist,21,"MD - Dermatology, MBBS",₹ 600,₹ 300,Kashyap Skin Clinic,Dwarka,"Hair Growth, Ear Lobe Repair, Removal of CornsNext ",11:00 AM,1:30 PM,Delhi,80
781,81,Dr. Anuj Saigal,Dermatologist,16,"MD - Dermatology , Venereology & Leprosy, MBBS",,,,,"Hair Transplant, Acne Scars, Skin Care",10:30 AM,5:00 PM,Delhi,81
782,82,Dr. Sanjeev Gulati,Dermatologist,31,"MD, MBBS",,₹ 500,Rayz Skin & Aesthetic Clinic,Sukhdev Vihar,"Hair Treatment, Acne Scars, CryotherapyNext ",6:00 PM,8:30 PM,Delhi,82
783,83,Dr. Nitin S Walia,Dermatologist,38,"DNB (Dermatology), MD - Dermatology , Venereology & Leprosy, MBBS",,,,,"Pimples Treatment, Pimples, Acne / Pimples TreatmentNext ",11:00 AM,12:00 PM,Delhi,83
784,84,Dr. Rajeev Vij,Dermatologist,24,"MBBS, MD - Dermatology",₹ 800,₹ 800,Skin VD & Cosmetic Clinic,Delhi,Acne ScarsNext ,6:00 PM,8:30 PM,Delhi,84
785,85,Dr. Navneet Bansal,Dermatologist,28,"D.V.D, MBBS",₹ 500,₹ 500,Dermacare Wholistic Clinic,Dwarka,"Pimples, Hair Growth, Vitiligo",11:00 AM,1:00 PM,Delhi,85
786,86,Dr. Akhilesh Sharma,Dermatologist,14,"MBBS, DNB (Skin & VD)",₹ 300,₹ 400,Absolute Skin Hair & Laser Center,Najafgarh,,4:00 PM,5:00 PM,Delhi,86
787,87,Dr. Shivali Sethi,Dermatologist,20,"D.D.V.L, F.A.C.S.I, M.B.B.S",₹ 500,₹ 350,Laser Skin Hair Nail Clinic,Gujranwala Town,"Hair Growth, Hair Loss, Hair FallNext ",10:30 AM,1:30 PM,Delhi,87
788,88,Dr. Deepti Dhillon,Dermatologist,21,"MBBS, DDV, Aesthetic medicine",,₹ 500,Appleskin Clinic,Delhi,VitiligoNext ,12:00 PM,4:00 PM,Delhi,88
789,89,Dr. Puneet Aggarwal,Dermatologist,24,"MD - Dermatology, MBBS",₹ 400,₹ 700,Deepak Memorial Hospital & Medical Research Centre,Vikas Marg,,10:00 AM,11:00 AM,Delhi,89
790,90,Dr. Ramanjit Singh,Dermatologist,33,"M.B.B.S, M.D. (Dermatology, Venereology & Leprosy)",,,,,"Skin Care, Pimples, Acne / Pimples TreatmentNext ",2:00 PM,4:30 PM,Delhi,90
791,91,Dr. Pooja Aggarwal,Dermatologist,15,MD - Dermatology,,,,,,10:00 AM,2:00 PM,Delhi,91
792,92,Dr. Gunjan Agarwal,Dermatologist,14,MD - Dermatology,₹ 500,₹ 800,R.S Child and Skin Care Centre,Rohini,,6:00 PM,8:00 PM,Delhi,92
793,93,Dr. Tushar Opneja,Dermatologist,18,"MBBS Bachelor of Medicine and Bachelor of Surgery, Diploma In Dermatology And Venerology A...read more",₹ 600,₹ 600,Regenix Clinic,Mayur Vihar Phase 1,"Hair Growth, Dark Skin, Hair Fall",12:00 PM,7:30 PM,Delhi,93
794,94,Dr. Nirupama  Parwanda,Dermatologist,16,"Diploma in Practical Dermatology, MD - Dermatology , Venereology & Leprosy, MBBS",,₹ 700,Zolie Skin Clinic,Kailash Colony,"Acne/Pimples, Acne Scars, AllergyNext ",10:30 AM,7:00 PM,Delhi,94
795,95,Dr. Garima Singh,Dermatologist,14,"MBBS, MD - Dermatology",₹ 500,₹ 500,Apex Multispeciality Hospital And Skin Clinic,Chhatarpur,,11:00 AM,2:00 PM,Delhi,95
796,96,Dr. Shikhar Ganjoo,Dermatologist,11,"Fellowship in Pediatric Dermatology, MD - Dermatology , Venereology & Leprosy, DNB (Dermatology)",,,,,"Acne/Pimples, Hair Fall, Hair LossNext ",7:00 PM,9:00 PM,Delhi,96
797,97,Dr. Renu Madan,Dermatologist,26,"MD, MBBS",₹ 400,,₹ 1,000 onlineAyushman Hospital,"Pimples, Wart Removal, Pimples TreatmentNext ",11:00 AM,1:00 PM,Delhi,97
798,98,Dr. Nipun Jain,Dermatologist,22,MD - Dermatology,₹ 600,₹ 800,AURA SKIN COSMETOLOGY CLINIC,Dwarka,"Hair Loss, Skin Treatment, Facial AestheticsNext ",7:30 PM,9:00 PM,Delhi,98
