,Name,Specialization,Experience (in years),Education,Fee at clinic,Online Fee,Clinic Name,Area,Recently Consulted for,Available From,Available Till,City
324,Nirmal Health Care,Homeopathy,,,₹ 300,₹ 350,Nirmal Health Care,Shukrawar peth,,10:00 AM,05:00 PM,Pune
325,Dr. Mahesh Jadhav,Homeopathy,20,"BHMS, M.D.(Bio)",₹ 800,₹ 200,Rudraksha Advanced Homoeopathic Clinics,Pimple Gurav,,10:30 AM,01:30 PM,Pune
326,Dr. Malojiraje V.Tanpure,Homeopathy,18,MD - Homeopathy,,₹ 300,Tanpure Homoeopathic Centre,Hadapsar,,06:00 PM,08:00 PM,Pune
327,Dr. Shailesh Sancheti,Homeopathy,18,"MD - Homeopathy, BHMS",₹ 700,₹ 300,Dr.Shailesh Sancheti Advance Homeopathic Clinic,Purandar,,06:00 PM,08:30 PM,Pune
328,Dr. Geeta. N. Parwani,Homeopathy,26,"MD - Homeopathy, BHMS",₹ 800,₹ 300,Healing touch milti speciality clinic,Pune,Weight LossNext ,12:00 PM,09:00 PM,Pune
329,Life Force Homeopathy,Homeopathy,39,BHMS,,₹ 500,,,,10:00 AM,06:00 PM,Pune
330,Dr. Aditi Nihar Kalghatgi ( Gaud),Homeopathy,19,BHMS,₹ 500,,draditis homoeo clinic,Erandwane,"Migraine, Knee Pain, Pimples TreatmentNext ",04:00 PM,08:30 PM,Pune
331,Dr. Bhavna Gaikar,Homeopathy,16,BHMS,₹ 500,₹ 250,the heart clinicr,Sadashiv peth,,05:00 PM,09:00 AM,Pune
332,Dr. Harshita Gupta,Homeopathy,8,BHMS,₹ 500,₹ 550,arsn healthcare clinic,Pune,,06:00 PM,09:00 PM,Pune
333,Dr. Asmani Bhave,Homeopathy,8,Homeopath Cosmetologist..Nutritionist,₹ 300,₹ 200,Dr Asmani Bhave Homeopathic and Cosmotology Cilnic,Shivaji Nagar,,06:30 PM,08:30 PM,Pune
334,Dr. Sachin Thakur,Homeopathy,23,"MD-Homeopathy, BHMS",₹ 500,₹ 350,Dr Thakur's Homoeopathy,Karve Road,Weight Management,10:00 AM,02:00 PM,Pune
335,Dr. Neha S Vasishth,Homeopathy,19,"BHMS, Health Care Management",₹ 500,₹ 250,DH Homeopathic Health Centre,Kalyani Nagar,"Gaining Weight, Hair Loss, AcidityNext ",05:00 PM,08:00 PM,Pune
336,Dr. Namrata Anand,Homeopathy,24,"BHMS, PG In Clinical Nutrition & Dietetics, DNHE",₹ 300,₹ 250,Pulsetila Health Clinic,Pimple Saudagar,,11:00 AM,01:30 PM,Pune
337,Dr. Sarika Doshi,Homeopathy,22,"BHMS, PGNAHI",₹ 500,,HomeoCure™ Homeopathy Clinic,Sadashiv peth,"Vitiligo, VertigoNext ",11:30 AM,12:30 PM,Pune
338,Dr. Nidhi Pandya,Homeopathy,17,"BHMS, MD - Homeopathy, CGO",,,,,,10:00 AM,01:00 PM,Pune
339,Dr. Pravin Dhole,Homeopathy,38,DHMS (Diploma in Homeopathic Medicine and Surgery),,,,,,11:00 AM,04:30 PM,Pune
340,Dr. Vidyasagar Umalkar,Homeopathy,41,DHMS,,₹ 300,,,"Prevention of Blockage Post Angioplasty Stent Surgery, Slimming, Painful PeriodsNext ",10:30 AM,02:00 PM,Pune
341,Dr. Kavita Dhamale,Homeopathy,23,"MD -Homeopathy, BHMS, Certificate Course In Child Counseling & Parenting, P.G. Diploma in ...read more",₹ 600,₹ 300,Homoeopathic Health Care Centre,Bibwewadi,,11:00 AM,02:00 PM,Pune
342,Dr. Ambrish Panjabrao Uke,Homeopathy,14,"BHMS, MD - Homeopathy",₹ 500,₹ 300,The Sanjeevvani Classical Homoeopathy,Pune,,10:30 AM,02:00 PM,Pune
343,Dr. Pradeep C Sethiya,Homeopathy,39,"MD - Homeopathy , BHMS",,,,,,04:00 PM,07:00 PM,Pune
344,Dr. Rajshree Pokharna,Homeopathy,35,BHMS,₹ 500,₹ 300,Rohan Clinic,Kharadi,,07:00 AM,08:00 PM,Pune
345,Mrs. Ramya Bandreddi,Homeopathy,6,BHMS,₹ 150,₹ 100,Dr Ramya Homeopathy  Consultation,Dhanori,,09:00 AM,06:00 PM,Pune
346,Dr. Shital Somwanshi Bankar,Homeopathy,,,₹ 400,₹ 300,Dr. Shital's Homeopathy Clinic,Pune,,06:00 PM,09:00 PM,Pune
347,Dr. Sharda,Homeopathy,19,MD - Homeopathy,,,,,InsomniaNext ,05:00 PM,09:00 PM,Pune
348,Dr. Kalyani Badwaik,Homeopathy,13,"BHMS, M.D.",₹ 600,₹ 400,Vivekananda Sadhanalay Homeopathic Clinic,Wakad,"Hair Fall, Hair Loss, Numbness",11:15 AM,11:00 PM,Pune
349,Dr. Priya Gautam,Homeopathy,14,"BHMS, MD - Homeopathy",₹ 350,₹ 350,Cure Plus Care Clinic,Wagholi,,05:30 PM,08:30 PM,Pune
350,Dr. Vivek S,Psychologist,18,"Ph.D - Psychotherapy & Counselling, P.G. Diploma in Counseling & Guidance, P.G. Diploma in...read more",,₹ 300,Purl Wellness,Baner-Pashan Link Road,,10:00 AM,08:30 PM,Pune
351,Ms. Pallavi Patankar,Psychologist,20,"Master of Clinical Psychology, Post Graduate Diploma in Psychological Counselling",,₹ 900,Manovedh Psychological Counselling Center,Kalewadi,"Behaviour and Thought Problems, Psychotherapy, DepressionNext ",11:00 AM,12:30 PM,Pune
352,Dr. Archana Narwani,Psychologist,12,Masters In Clinical Psychology,,,,,"Depression, Adult Counselling, Sex Addiction Counselling",11:00 AM,08:00 PM,Pune
353,Mrs. Swati Sarkar,Psychologist,30,"PGDVGCC, MS Psychology, BS Psychology",,₹ 500,Life Enrichment Center,Pune,"Counselling and Stress Management, Anger Management, Parenting Issues and DoubtsNext ",11:00 AM,02:00 PM,Pune
354,Dr. Ruchi Rana,Psychologist,14,Ma Clinical Psychology,₹ 500,₹ 349,Moolani Clinic,MG Road,,04:30 PM,07:00 PM,Pune
355,Ms. Mansi Sattikar,Psychologist,19,"MA In Clinical Psychology, PGDCP , Certified NLP Practioner, CERTIFICATION IN BACH FLOWER ...read more",,₹ 500,Sai shraddha Multispeciality hospital,Lohegaon,"Depression, Stress Treatment, Mood Disorder Treatment",10:00 AM,06:00 PM,Pune
356,Dr. Patil S D,Psychologist,36,"M.A. Psychology, PHD",₹ 900,₹ 900,Hypnotherapy Clinic,Pimpri Chinchwad,"Counselling and Stress Management, Adult Counselling, Behaviour and Thought Problems",09:00 AM,09:00 PM,Pune
357,Dr. Sukanya Biswas,Psychologist,12,"Masters in Clinical Psychology & Certified Cognitive Behaviour Therapy Practioner, Certifi...read more",₹ 700,₹ 500,Ignited Minds,Pune,"Depression, Smoking, OCD",08:00 AM,01:00 PM,Pune
358,Ms. Sheetal Agrawal,Psychologist,17,"Post Graduate Diploma in Counselling, MA In Clinical Psychology",,₹ 300,Sheetal Agrawal,Dhanori,Stress Treatment,09:30 AM,08:30 PM,Pune
359,Ms. Chayya Palan,Psychologist,11,"Masters in Clinical Psycology, Post graduate diploma in Counselling Psychology",,,,,,02:00 PM,04:00 PM,Pune
360,Dr. Dipti Kapare,Psychologist,19,"BAMS, MSC In Counselling, Certificate of Pranic Psychotherapy Course, Diploma in Counselli...read more",,,,,,06:00 PM,08:30 PM,Pune
361,Dr. Varsha Choudhari,Psychologist,19,"BHMS, MA - Psychology",,,,,,09:00 AM,01:00 PM,Pune
362,Mr. Gopal Bhagat,Psychologist,11,"PG Psychology, PgD Clinical & Counseling Psychology",,,,,,08:00 AM,11:00 PM,Pune
363,Mrs. Swarna Lata,Psychologist,25,"Diploma in Relationship Counselling, Diploma in Positive Psychology, Certificate in Counse...read more",₹ 700,₹ 500,Dr. Rahul`s Dental Hospital & Poly Clinic,Pune,,09:45 AM,12:30 PM,Pune
364,Dr. Vineeta Kumar,Psychologist,24,"Ph. D - Psychology, M.Sc - Psychology",,₹ 600,Rise and shine,Pune,,06:00 PM,09:00 PM,Pune
365,Ms. Vibha Deshpande,Psychologist,22,M.Sc - Applied Psychology,,,,,,03:00 PM,08:00 PM,Pune
366,Ms. Karuna P Bhatia,Psychologist,16,"Masters in Psychotherapy and Counselling, Certified Clinical Hypnotherapist",,,,,,09:00 AM,08:30 PM,Pune
367,Mr. Amit Joshi,Psychologist,25,MA in Clinical Psychology,₹ 800,,₹ 1,000 onlineCounselling Clinic,,03:30 PM,08:00 PM,Pune
368,Dr. Sabir Hasan Farooqui,Psychologist,26,"M.Sc - Biotechnology , B.Sc Biochemistry, B.Sc (Microbiology), PhD",,,,,,05:00 PM,09:00 PM,Pune
369,Ms. Rohini Bhosale,Psychologist,11,Master in psychology,,₹ 800,Rohini clinic,Vishrantwadi,,09:00 AM,09:00 PM,Pune
370,Ms. Aishwarya Kalra,Psychologist,6,"M A Clinical Psychology, B.A. Psychology",,,,,,02:00 PM,08:00 PM,Pune
371,Dr. Dipti Sachin Panhalkar,Psychologist,20,MA,₹ 550,₹ 600,MIND SPA ( PSYCHOLOGY Counseling and Mind Coaching),Warje,,12:00 PM,03:00 PM,Pune
372,Dr. Bharati Rajguru,Psychologist,,,₹ 400,,Pathfinder Clinic,Magarpatta,,11:00 AM,01:00 PM,Pune
373,Ms. Tarini Mathrani,Psychologist,9,M.Sc - Psychology,₹ 500,,themptychair,Udaybaug,,,,Pune
374,Ms. Manasvii Kulkarni,Psychologist,5,M.A,₹ 500,₹ 200,Setu- Counselling Centre,Whitefield,,10:00 AM,07:00 PM,Pune
375,Ms. Surabhi Setiya,Psychologist,7,Msc,,₹ 200,Mindfulness be kind,Market yard,,10:30 AM,01:00 PM,Pune
376,Dr. Siddique Ahmed,Psychologist,,,,,,,,03:00 PM,06:00 AM,Pune
377,Ms. Vaishali Girme,Psychologist,14,"M.phil, in clinical psychology, Post graduate diploma in counseling and rehabilitation, M....read more",,,,,,11:00 AM,02:00 PM,Pune
378,Ms. Jaya Pujara,Psychologist,20,"Masters in Psychology - Clinical and Abnormal, Diploma in Clinical Hypnotherapy",,,,,,06:00 PM,08:30 PM,Pune
379,Dr. Aishwarya Jain,Psychologist,6,"M A Clinical Psychology, Diploma in Psychotherapy and Counseling",,₹ 500,Glisten Healthcare,Bund Garden Road,,,,Pune
380,Dr. Rajesh Alone,Psychologist,25,"MS - Counselling and Psychotherapy, MA in Clinical Psychology",,,,,,10:00 AM,06:00 PM,Pune
381,Mrs. Anagha Chhatre,Psychologist,31,Bsc MPM PGDCP,,,,,,10:30 AM,02:30 PM,Pune
382,Mr. Madhav Kolhatkar,Psychologist,,,,₹ 200,,,,,,Pune
383,Mr. Omkar Naik,Psychologist,8,"Masters in Clinical Psychology , BA Psychology",,₹ 800,Cinq in,Aundh,,,,Pune
384,Dr. Saurabh Bhatia,Psychologist,27,"MBBS, MS, FCR",₹ 999,₹ 99,Dr Saurabh Bhatia,NIBM,,09:00 AM,09:00 PM,Pune
385,Mrs. Debasmita Sinha,Psychologist,15,"Masters in Clinical Psychology, CBT - Cognitive Behavioral Therapy",,₹ 500,Seraniti,Pune,,11:30 AM,05:30 PM,Pune
386,Mr. Jitu Solanki,Psychologist,9,"MA clinical psychology, hypnotist",₹ 200,,,,Stress Treatment,10:00 AM,11:00 PM,Pune
387,Ms. Natasha Trivedi,Psychologist,21,MA,₹ 500,₹ 500,Prudent Internation Health Clinic,Kalyani Nagar,"Anger Management, Stress Treatment, Behaviour and Thought Problems",,,Pune
388,Dr. Prasanna Rabade,Psychologist,15,M.S.,₹ 500,,Disha Psychological Counselling Centre,Kothrud,,11:00 AM,08:00 PM,Pune
389,Dr. Shivnarayan Khandre,Psychologist,,,,,,,,04:30 PM,08:30 PM,Pune
390,Ms. Pooja Mohan Shinde,Psychologist,2,Masters in Psychology - Clinical and Abnormal,₹ 600,,CareNext Institute of Psychological Health,Bhugaon,,11:00 AM,07:00 PM,Pune
391,Dr. Rehan Safee,Psychologist,13,MD,₹ 200,,Kausar Baugh Clinic,Pune,Behaviour and Thought ProblemsNext ,07:00 PM,09:00 PM,Pune
392,Ms. Linaz Soonawalla,Psychologist,9,MS Psychology,,₹ 300,NANIHI Center,Mundhawa,,10:00 AM,06:00 PM,Pune
393,Dr. Monika Jain,Psychologist,21,"BA Psychology & Sociology, MA - Psychology, PhD - Counseling Psychology",,,,,,10:00 AM,08:00 PM,Pune
394,Ms. Pranoti Prashant Tilak,Psychologist,11,M A Clinical Psychology,,,,,,10:30 AM,07:30 PM,Pune
395,Ms. Anushree Dirangane,Psychologist,,,,,,,,08:00 AM,09:00 PM,Pune
396,Dr. Jyoti Vishwakarma,Psychologist,10,Post Graduation in Clinicl Psychology,₹ 300,₹ 200,,,,09:00 AM,03:00 PM,Pune
397,Mrs. Gayathri,Psychologist,12,"Masters in Social Work (Specialised in Family and Child Welfare), B.A. Sociology",₹ 500,₹ 300,Park Street,Pimple Saudagar/Wakad/Aundh/Baner/Wakad,,07:00 PM,09:00 PM,Pune
398,Dr. Usha Gokhale,Psychologist,26,"M A Clinical Psychology, , M. S. W.Usha Gokhale Counseling Clinic    , Pun",,,,,,,,Pune
399,Ms. Megha Shah,Psychologist,11,masters in clinical psychology,₹ 500,₹ 100,Megha Shah,Pune,,04:30 PM,06:30 PM,Pune
400,Dr. Sanjay Erande,Ayurveda,20,"Fellowship In Sexology, M-CSEPI, M.Ayu.D, Dipl.EMS, BAMS, Fellowship In Sexology",,,,,"Male Sexual Problems, Erectile Dysfunction, Small Penis SizeNext ",06:00 PM,09:00 PM,Pune
401,Dr. Rahul Waghole,Ayurveda,20,"Bachelor of Ayurveda, Medicine and Surgery (BAMS), Yog Ayurved Padvika, M.A.(Sanskrit)",₹ 300,₹ 250,Waghole Ayurved Clinic,Saswad road,,06:00 PM,08:30 PM,Pune
402,Rejuva Skin,Ayurveda,16,Diploma in Cosmatology,₹ 300,₹ 200,Rejuva Skin Clinic,Pune,"Skin Care, Skin Treatment, Allergy",09:30 AM,01:30 PM,Pune
403,Dr. Jiva Ayurveda,Ayurveda,26,BAMS,₹ 299,,,,"Acne Treatment, Hair Loss, Flu",10:00 AM,07:00 PM,Pune
404,Dr. Adesh Karwa,Ayurveda,21,"BAMS, MD - Ayurveda Medicine",₹ 500,₹ 200,Ayurveda Clinic,DP Road,,10:00 AM,02:00 PM,Pune
405,Dr. Gajanan Manamwar,Ayurveda,14,BAMS,₹ 500,₹ 350,Shree Vishwasanskruti Ayurved Chikitsalaya,Hinjewadi,"Staying Healthy, UTI, Increase height",05:00 PM,09:00 PM,Pune
406,Dr. Lunkad Vaibhav,Ayurveda,34,"MBBS, DIiploma in Yoga and Ayurveda, Diploma In Dermatology And Venerology And Leprosy (DD...read more",₹ 500,₹ 500,Aaiina Clinic,Shukrawar peth,"Sex Education, Male Sexual Problems, Male Sexual Problems TreatmentNext ",05:00 PM,08:30 PM,Pune
407,Dr. Jeevan Sampat Jadhav,Ayurveda,17,BAMS,₹ 200,₹ 300,,,"Gaining Weight, Skin Care, Knee Pain",10:30 AM,05:00 PM,Pune
408,Dr. Omkar Shahapurkar,Ayurveda,21,"BAMS, MD",₹ 300,,₹ 1,000 onlineSiddhi Clinic,"Sex Education, Acidity, Acne/PimplesNext ",05:00 PM,09:00 PM,Pune
409,Dr. Shekhar Benade,Ayurveda,24,"BAMS, MD - Ayurveda Medicine, Master in Sexual Medicine, Proficiency in Psycosexual Medici...read more",₹ 500,₹ 700,Dr Benade's E Sexologist Pune And Male Infertility Treatments,Balewadi,"Premature Ejaculation, Sugar, Small Penis Size",10:00 AM,09:00 PM,Pune
410,Dr. Anupam Dandgavhal,Ayurveda,17,"BAMS, PGFP, M. D. Medicine (ayu)",₹ 200,₹ 300,,,"Body Weakness, Leg Pain, Female Hair LossNext ",02:30 PM,08:30 PM,Pune
411,Dr. Ravindra Borade,Ayurveda,17,"BAMS, Certificate Course In Sex Therapy & Counselling, Yog Ayurved Padvika",₹ 200,₹ 400,Param Ayurved,Kasarwadi,,04:00 PM,08:30 PM,Pune
412,Dr. Syam Bhargavan,Ayurveda,24,"BAMS, MD - Ayurveda",₹ 500,₹ 300,Muppra Kerala Ayurvedic,Baner,,06:00 PM,07:30 PM,Pune
413,Dr. Sunita Chaudhari,Ayurveda,33,"BAMS, PhD - Ayurveda",₹ 300,₹ 350,Ayurmantra Ayurveda Center,Aundh,"Weight Loss, Asthma, Baldness",09:00 AM,01:00 PM,Pune
414,Dr. Lalta  Prasad,Ayurveda,55,"MS, Bachelor of Ayurveda, Medicine and Surgery (BAMS)",₹ 200,,Sushruta Clinic,sangvi,ComaNext ,07:00 PM,08:00 PM,Pune
415,Dr. Kedar  Ghatnekar,Ayurveda,16,"Bachelor of Ayurveda, Medicine and Surgery (BAMS)",₹ 200,₹ 200,Saptarshee Clinics,Shukrawar peth,,04:00 PM,08:00 PM,Pune
416,Dr. Jyoti Shirodkar,Ayurveda,32,"BAMS, MD - Ayurveda Pharmacology, Ph.D - Diabetes Prediction Thesis, BA (Sanskrit), MA (En...read more",₹ 800,₹ 300,Dr. Shirodkar's Health Solutions Pvt. Ltd.,NDA Road,,04:00 PM,07:00 PM,Pune
417,Dr. Shailesh Shamkant Phalle,Ayurveda,16,"Bachelor of Ayurveda, Medicine and Surgery (BAMS), MD - Medicine",₹ 250,₹ 100,Ayusanjivani Speciality Clinic And Panchakarma Center,Kharadi,,09:00 AM,12:00 PM,Pune
418,Dr. Samarth Kotasthane,Ayurveda,17,"Bachelor of Ayurveda, Medicine and Surgery (BAMS), MD - Ayurveda",₹ 500,₹ 300,Shri Vishwagandh Ayurved & Panchkarma Clinic,Bibwewadi,"Weight Loss, Body Weakness, Sex Education",09:30 AM,10:30 AM,Pune
419,Vardhayu Ayurved And Panchakarma,Ayurveda,9,MDS - Oral & Maxillofacial Surgery,₹ 300,₹ 100,,,"Panchakarma, Ayurvedic Massage",07:00 PM,09:00 PM,Pune
420,Dr. Kedar  Ghatnekar,Ayurveda,16,"Bachelor of Ayurveda, Medicine and Surgery (BAMS)",₹ 200,₹ 200,Saptarshee Clinics,Shukrawar peth,,04:00 PM,08:00 PM,Pune
421,Dr. Lalta  Prasad,Ayurveda,55,"MS, Bachelor of Ayurveda, Medicine and Surgery (BAMS)",₹ 200,,Sushruta Clinic,sangvi,ComaNext ,07:00 PM,08:00 PM,Pune
422,Dr. Geetanjali Thokal,Ayurveda,15,"MD, Bachelor of Ayurveda, Medicine & Surgery (BAMS)",₹ 300,₹ 300,Heal & Care Ayurveda Clinic,Pimple Saudagar,,09:30 AM,12:00 PM,Pune
423,Dr. Anand Vikram Kale,Ayurveda,15,"Bachelor of Ayurveda, Medicine and Surgery (BAMS), MD - Ayurveda, D.Y.A",₹ 200,₹ 300,Rasgandha Ayurvedic Clinic & Panchakarma Health Centre,Chinchwad,,09:30 AM,01:00 PM,Pune
424,Dr. Madhura Atul Bhide,Ayurveda,27,"Bachelor of Ayurveda, Medicine and Surgery (BAMS), MD - Ayurveda",₹ 750,₹ 200,Dr Madhura Bhide,Shivaji Nagar,"Gaining Weight, Trying to Conceive, DepressionNext ",10:00 AM,01:00 PM,Pune
425,Dr. Nikhil Pendse,Ayurveda,17,"BAMS, MD- Ayurved, Diploma in Vaidya Visharad",₹ 300,₹ 300,Vivaswan Ayurvedic Wellness Centre,Paud Road,,12:00 PM,02:00 PM,Pune
426,Dr. Avinash Deore,Ayurveda,20,"MD, BAMS",₹ 200,,Shree Sai Ayurvedic Panchakarma Clinic &Infertility Research Clinic,Pimpri,,05:00 PM,09:00 PM,Pune
427,Dr. Hemant Chavan,Ayurveda,17,"BAMS, Diploma In Yoya & Ayurved",₹ 200,₹ 250,Ayuspand Ayurvedic Clinic & Panchakarma Center,Pimple Saudagar,Hair Loss,05:30 PM,09:00 PM,Pune
428,Dr. Mayur Surana,Ayurveda,11,"MD, DYA, PGDCR",₹ 300,,,,"Increase height, Weight Loss, Hair Loss",07:00 PM,09:00 PM,Pune
429,Dr. K D,Ayurveda,15,"Bachelor of Ayurveda, Medicine and Surgery (BAMS), MD - Ayurveda",₹ 300,₹ 200,Maheshwar Clinic,Pune,"Gaining Weight, Hair Loss, Leg Pain",10:00 AM,05:00 PM,Pune
430,Dr. K D,Ayurveda,15,"Bachelor of Ayurveda, Medicine and Surgery (BAMS), MD - Ayurveda",₹ 300,₹ 200,Maheshwar Clinic,Pune,"Gaining Weight, Hair Loss, Leg Pain",10:00 AM,05:00 PM,Pune
431,Dr. Mayur V Shiralkar,Ayurveda,23,"Bachelor of Ayurveda, Medicine and Surgery (BAMS), MS - ENT",₹ 200,₹ 300,SHIRALKAR HOSPITAL,Chinchwad,,06:00 PM,09:30 PM,Pune
432,Dr. Avinash Deore,Ayurveda,20,"MD, BAMS",₹ 200,,Shree Sai Ayurvedic Panchakarma Clinic &Infertility Research Clinic,Pimpri,,05:00 PM,09:00 PM,Pune
433,Dr. Sunil Ugile,Ayurveda,29,"Bachelor of Ayurveda, Medicine and Surgery (BAMS)",₹ 700,,Pune Piles Care,Pimple Saudagar,,11:30 AM,02:00 PM,Pune
434,Dr. Pankaj Nahata,Ayurveda,14,BAMS,₹ 100,₹ 300,Shree Vishwamani Ayurvedic Clinic & Panchakarma Centre,Bibwewadi,"Premature Ejaculation, Weight Loss, Dark Circle",05:00 PM,09:00 PM,Pune
435,Dr. Savita Nemade,Ayurveda,14,"BAMS, MD (Kayachikitsa)",₹ 500,₹ 300,Vedika Multi-speciality Clinic And Panchkarma Ceter,Viman Nagar,,10:00 AM,04:00 PM,Pune
436,Dr. Vikas Chothe,Ayurveda,10,"MD - Ayurveda, FIIM, MD",₹ 200,,Vikas Chothe,Chinchwad,,09:00 AM,09:00 PM,Pune
437,Dr. Shreeram Agashe,Ayurveda,19,"Ph.D. (Scholar) Ayurveda, MD - Ayurveda, BAMS",₹ 200,,Agashe Clinic,Pune,,09:00 AM,01:00 PM,Pune
438,Dr. Niloy Kar,Ayurveda,25,"BAMS, MD - Alternate Medicine",₹ 300,₹ 300,Sanjeevani Ayurvediya Chikitsalaya & Panchkarma Kendra,Kondhwa Khurd,,10:00 AM,01:00 PM,Pune
439,Dr. Dipti Kapare,Ayurveda,19,"BAMS, MSC In Counselling, Certificate of Pranic Psychotherapy Course, Diploma in Counselli...read more",,,,,,06:00 PM,08:30 PM,Pune
440,Dr. Manisha Thakur,Ayurveda,19,"Bachelor of Ayurveda, Medicine and Surgery (BAMS)",₹ 300,₹ 500,Mauli clinic,Kharadi,,09:00 AM,02:00 PM,Pune
441,Dr. Pankaj Ingawale,Ayurveda,19,"Bachelor of Ayurveda, Medicine and Surgery (BAMS)",₹ 300,₹ 200,Shri Vishwasudha Ayurvedic Clinic And Panchakarma Center,Pune,,10:00 AM,01:00 PM,Pune
442,Dr. Pankaj Nahata,Ayurveda,14,BAMS,₹ 100,₹ 300,Shree Vishwamani Ayurvedic Clinic & Panchakarma Centre,Bibwewadi,"Premature Ejaculation, Weight Loss, Dark Circle",05:00 PM,09:00 PM,Pune
443,Dr. Dipti Kapare,Ayurveda,19,"BAMS, MSC In Counselling, Certificate of Pranic Psychotherapy Course, Diploma in Counselli...read more",,,,,,06:00 PM,08:30 PM,Pune
444,Dr. Vikas Chothe,Ayurveda,10,"MD - Ayurveda, FIIM, MD",₹ 200,,Vikas Chothe,Chinchwad,,09:00 AM,09:00 PM,Pune
445,Dr. Vaibhav Savale,Ayurveda,11,"BAMS, PG Diploma In Clinical Cosmetology (PGDCC)",₹ 300,₹ 99,Rejuvenate Hair & Skin Clinic,Aundh,,05:00 PM,09:00 PM,Pune
446,Dr. Atul Kumar Bedre,Ayurveda,33,"Bachelor of Ayurveda, Medicine and Surgery (BAMS)",₹ 300,₹ 300,Dr. Bedre's Panchakarma,Chandan Nagar,,10:00 AM,02:00 PM,Pune
447,Dr. Vrushali  Waghole,Ayurveda,16,"BAMS, MD - Ayurveda",₹ 200,₹ 200,Waghole Ayurved Clinic,Pune,,06:00 PM,08:00 PM,Pune
448,Dr. Priti Mangesh Deshmukh,Ayurveda,19,"BAMS, MD - Ayurveda Medicine",₹ 400,,Pranav Ayurveda Panchakarma Clinic,Pimpri Chinchwad,,07:00 PM,08:00 PM,Pune
449,Dr. Yogita M Chaudhari,Ayurveda,10,MD - Ayurveda Medicine,₹ 300,₹ 200,Bhagirathi Ayurveda Centre,Pune,,10:00 AM,01:00 PM,Pune
