,Name,Specialization,Experience (in years),Education,Fee at clinic,Online Fee,Clinic Name,Area,Recently Consulted for,Available From,Available Till,City
0,Dr. Amruta Kakade Tamhankar,Dentist,21,BDS,₹ 500,₹ 500,,,Teeth WhiteningNext ,04:00 PM,08:30 PM,Pune
1,Dr. Sourabh Sunil Sanghavi,Dentist,11,BDS,₹ 200,₹ 200,Dr. Sanghavi's Smile32 Dental Clinic- Pune,Sadashiv peth,,09:00 AM,11:30 AM,Pune
2,Dr. Pratiksha Agrawal,Dentist,17,BDS,₹ 200,₹ 300,Impressions Dental Care,Tingre Nagar,"Ceramic Crowns And Bridges Fixing, Crowns And Bridges, Ceramic Crowns and Bridges",11:00 AM,01:00 PM,Pune
3,Dr. Kushal Bhandari,Dentist,14,"Certified Implantologist, Advanced Aesthetics",₹ 300,₹ 150,Pearl Dental Care,Satara Road,"Teeth Cleaning, Dental Care, Implants",09:30 AM,01:30 PM,Pune
4,Dr. Swapnil Patil,Dentist,17,BDS,₹ 300,₹ 100,Cosmetic Dental Implant Center,Wakad,,10:00 AM,09:00 PM,Pune
5,Dr. Darshan Parikh,Dentist,20,"BDS, Basic Life Support (B.L.S)",,₹ 300,Vimal Dental Clinic,Camp,"Toothache, Root canal, Bad BreathNext ",09:00 AM,01:00 PM,Pune
6,Dr. Priyam Aditya,Dentist,18,"MDS Prosthodontics, BDS",₹ 200,₹ 400,Aditya's Dental Privilege,Baner,,05:00 PM,09:00 PM,Pune
7,Dr. Junaid Shah,Dentist,20,BDS,₹ 500,₹ 100,LIMRA Dental Clinic,Pune,Root canalNext ,10:00 AM,10:00 PM,Pune
8,Dr. Chinmay Gokhale,Dentist,17,"BDS, MDS - Oral & Maxillofacial Surgery",₹ 300,₹ 300,Gokhale Dental Clinic,Sinhagad,"Tooth Extraction, Wisdom Tooth Removal, Teeth CleaningNext ",09:00 AM,01:00 PM,Pune
9,Dr. Ratnika Agarwal,Dentist,13,"BDS, Certificate in Cosmetic Dentistry, Certified in Orthodontics, Certification in Prosth...read more",₹ 300,₹ 50,Dr Ratnika's - Smile Up Dental Clinic & Implant Center,Kharadi,"Teeth Cleaning (Scaling), Teeth Cleaning, Teeth Straightening",09:00 AM,09:30 PM,Pune
10,Dr. Sameer Bhandari,Dentist,28,BDS,₹ 200,,Bhandari Dental Clinic,Pune,,10:00 AM,06:00 PM,Pune
11,"Dr. Rahul Kathariya M.D.S, Ph.D.",Dentist,18,"BDS, MDS - Periodontics, Ph.D.",₹ 300,₹ 300,Dental Galaxy,Bajirao road,"Bleeding Gums Treatment, Bleeding Gums, Dentures",11:30 AM,04:00 PM,Pune
12,Dr. Rahul Lodaya,Dentist,19,MDS,₹ 300,,Smile Bay Dental Care,Rahatani,Ceramic CrownsNext ,07:00 AM,07:00 AM,Pune
13,Dr. Amit Meshram,Dentist,18,"BDS, MPH",₹ 200,,Dr.Amit's Dental Clinic,Pimpri,,10:00 AM,07:00 PM,Pune
14,Dr. Mandar Joglekar,Dentist,26,BDS,₹ 200,₹ 150,Joglekars' Dental Solutions,Pune,"Dental Extractions, ExtractionsNext ",06:00 PM,06:30 PM,Pune
15,Dr. Ashish Ingale,Dentist,13,BDS,₹ 300,,32pearls dental spa and implant center,Pashan,"Advanced Surgery In Implantology, Acrylic Partial Denture, ImplantologyNext ",12:00 PM,08:00 PM,Pune
16,Dr. Sangeetha Choudhary,Dentist,15,"BDS, D.pharm",₹ 100,₹ 50,Wellness dental and cosmetic clinic,Pune,,07:00 AM,11:00 PM,Pune
17,Dr. Puja Bansal,Dentist,25,"BDS, CDE Endo-Prostho, CDE - Cast Partial & Complete Dentures",₹ 300,₹ 999,Prudent International Health Clinic,Kalyani Nagar,"Stained Teeth, Cavities, Teeth CleaningNext ",10:00 AM,12:30 PM,Pune
18,Dr. Gitesh Kothari,Dentist,26,BDS,₹ 200,,Anand Dental Care,Viman Nagar,,01:00 PM,03:30 PM,Pune
19,Dr. Pooja Dubey,Dentist,17,"BDS, PGDEMS",₹ 300,,Omkar Dental Clinic,Wakad,"Teeth Cleaning, Tooth Extraction, Bleeding Gums",10:00 AM,01:00 PM,Pune
20,Dr. Milind Darda Mds,Dentist,25,"BDS (Implantologist), MDS - Orthodontics",₹ 100,₹ 100,32 Smiles,J M Road,,09:00 AM,08:30 PM,Pune
21,Dr. Bhushan Phalak,Dentist,17,BDS,₹ 200,,Dr Phalak's D'Sign Dental Clinic,Bavdhan,,06:00 PM,08:30 PM,Pune
22,Dr. Chetan Oswal,Dentist,17,BDS,₹ 100,₹ 100,Sanghvi Dental Care,Talegaon,Root canal,09:30 AM,01:30 PM,Pune
23,Dr. Jyuthica Laghate,Dentist,21,"BDS, M.S.in International Health, Dip.in Homoeopathy, Dip.in Holistic Pain Management",₹ 250,₹ 350,Orawell Dental Care,Pune,,05:30 PM,07:30 PM,Pune
24,Dr. Ritesh Kumar Singh,Dentist,15,BDS,₹ 300,₹ 100,COMPLETE DENTAL CARE AND IMPLANT CENTRE,Pimple Saudagar,,11:00 AM,02:00 PM,Pune
25,Dr. Aashish Mathesul Orthodontist,Dentist,22,MDS - Orthodontics,₹ 100,₹ 300,Invisalign Invisible Braces Orthodontic Dental Implant Clinic,Kalyani Nagar,"Root canal, Teeth Cleaning, Wisdom TeethNext ",05:30 PM,08:30 PM,Pune
26,Dr. Shobha Hande,Dentist,27,BDSDr. Hand,,,,,,05:00 PM,08:30 PM,Pune
27,Dr. Meenakshi Shinde,Dentist,14,"DEMS, BDS",₹ 200,₹ 300,Meenakshi's Dental Clinic,Mundhwa Road,,05:00 PM,08:30 PM,Pune
28,Dr. Avinash Bamane,Dentist,16,BDS,₹ 500,₹ 500,AR 32 Signature Smiles - Branch 3 - Kharadi,Kharadi,,09:00 AM,09:00 PM,Pune
29,Dr. Bhawana Singh,Dentist,14,MDS - Oral & Maxillofacial Surgery,₹ 300,₹ 200,Global Dental Care,Nagar Road,"Dental Care, Implant Tooth Fixing, Root Canal Treatment (RCT)Next ",10:00 AM,01:00 PM,Pune
30,Dr. Sneha Divekar,Dentist,17,"International Certification in Aesthetic Dentistry, BDS",₹ 100,₹ 150,Dental Fitness - Complete Care Dental Clinic,Karve Nagar,,05:00 PM,08:00 PM,Pune
31,Dr. Shweta Bobhate,Dentist,,,₹ 0,,Dr. Gentle Dental Clinic,Bhukum,,09:30 AM,02:00 PM,Pune
32,Dr. Vasu Patil,Dentist,16,"MDS - Orthodontics, BDS",₹ 150,,,,,10:30 AM,08:30 PM,Pune
33,Dr. Gauri Pasricha,Dentist,11,BDS,₹ 300,₹ 150,,,,10:00 AM,08:00 PM,Pune
34,Dr. Amit Gokhale,Dentist,28,BDS,₹ 500,,Dr Amit Gokhale's Dental Clinic,Karve Road,,02:00 PM,09:00 PM,Pune
35,Dr. Kunal Janrao,Dentist,13,"BDS, MDS - Periodontics",₹ 100,₹ 300,TOOTH + GUMS Multispeciality Dental Clinic and Implant Centre,Aundh,,09:00 AM,09:00 PM,Pune
36,Dr. Ashish Gupta,Dentist,,,₹ 200,₹ 300,Acme Dental Lounge,DP Road,,10:30 AM,08:30 PM,Pune
37,Dr. Abhinav Talekar,Dentist,15,MDS,₹ 300,,Talekar Children's Dental Care,Camp,Root canalNext ,10:00 AM,02:00 PM,Pune
38,Dr. Niraj Shelke,Dentist,16,"Post Graduate Diploma in Healthcare Management (P.G.D.H.M), BDS",₹ 200,,A Dentist,Wakad,,09:30 AM,08:30 PM,Pune
39,"Dr. Jains Dental Care, Unit-2",Dentist,23,MDS - PeriodonticsDr Jai,,,,,,,,Pune
40,Dr. Prakhya  Gaur,Dentist,14,"BDS, Certified Implantologist, ABCD End",₹ 150,₹ 100,Dr.Prakhya,Pune,,06:00 PM,09:00 PM,Pune
41,Dr. Ashvini Phadnis,Dentist,17,"BDS, MDS - Paedodontics And Preventive Dentistry",₹ 300,₹ 100,AV Children Dental Clinic,DP Road,,11:00 AM,01:00 PM,Pune
42,Dr. Saurabh Birla,Dentist,18,"BDS, MDS - Orthodontics",₹ 200,,Birla Dental Clinic & Orthodontic Centre,Hadapsar,Root canalNext ,04:00 PM,08:30 PM,Pune
43,Dr. Vidya Pandit,Dentist,25,"Post Graduate Diploma in Holistic Healthcare, BDS",₹ 500,₹ 300,Dr Pandit's Clinic for Dental Excellence and Implant Centre,Baner,,05:00 PM,09:00 PM,Pune
44,Dr. Tejashree Chandakkar,Dentist,19,BDS,₹ 200,₹ 200,SMILE MULTISPECIALITY DENTAL CLINIC AND IMPLANT CENTRE,Yerwada,"Invisalign, Straightening Teeth (Invisalign)Next ",04:30 PM,07:30 PM,Pune
45,Dr. Soniya Tinna,Dentist,20,BDS,₹ 300,,Kartik Dental Clinic,Pimple Saudagar,,10:00 AM,02:00 PM,Pune
46,Dr. Jyotirmayee Dalai,Dentist,10,"MDS - Pediatric Dentistry, BDS, Fellow in Orthodontic World Institute",₹ 500,₹ 100,Dr. Dalai's Pediatric Dental Center,Pimpri Chinchwad,,05:00 PM,09:00 PM,Pune
47,Dr. Sm Shaikh,Dentist,14,"MDS - Oral & Maxillofacial Surgery, BDS (Implantologist)",₹ 200,₹ 200,NovaCure Dental Clinic,Hinjewadi,,10:00 AM,10:00 PM,Pune
48,Dr. Deepak Dhapekar,Dentist,22,BDS,₹ 200,₹ 200,Dhapekar's Dental Care & Implant Center,Pune,,05:00 PM,08:30 PM,Pune
49,Dr. Shailesh Dongre,Dentist,12,M.D.S.,₹ 200,,Caredent Multispeciality Dental Clinic,Thergaon,,11:30 AM,08:00 PM,Pune
50,Dr. Pradeep Kumari,Dermatologist,22,"MBBS, MD - Dermatology, F.C.P.S.(Dermatology, Venereology & Leprosy), Diploma in Venerolog...read more",₹ 700,₹ 700,Skin & Surgery International & Asia Institute of Hair Transplant,Viman Nagar,"Hair Transplant, Pimples, Pimples TreatmentNext ",10:30 AM,07:30 PM,Pune
51,Dr. Vijay Nagdev,Dermatologist,16,"MD - General Medicine, Diploma in Dermatology, Diploma in Medical Cosmetology",₹ 700,₹ 400,The Skin Doctors,Masulkar colony,"Acne Scars, Acne Scars Treatment, Stem Cell TherapyNext ",10:00 AM,06:00 PM,Pune
52,Dr. K.R Chandvania,Dermatologist,42,MD - Dermatology,₹ 900,₹ 900,Skin Square by Pallavi Laser Centre (Pimpri),Pimpri,"Melasma, Laser Hair Removal, Acne ScarsNext ",06:00 PM,08:00 PM,Pune
53,Dr. Hetal Jobanputra,Dermatologist,24,"F.C.P.S (Dermatology), MBBS Bachelor of Medicine and Bachelor of Surgery, DDV",₹ 600,₹ 500,Radiant Skin & Hair Clinic,Baner,,06:30 PM,08:30 PM,Pune
54,Dr. Dhananjay Chavan,Dermatologist,38,"MBBS, MD - Dermatology, DDV",,,,,"Pimples, Pimples Treatment, Acne/Pimples",11:00 AM,03:00 PM,Pune
55,Dr. Sanjana Nair,Dermatologist,17,"MBBS, Diploma In Dermatology And Venerology And Leprosy (DDVL), Fellowship in medical cosmetology",₹ 300,₹ 350,Ashwathy Skin  And Laser Clinic,Khadki,"Pimples, Pimples, Acne ScarsNext ",10:30 AM,12:30 PM,Pune
56,Dr. Mahendra Nagargoje,Dermatologist,22,"MBBS, MD - Dermatology",₹ 500,,Dr. Nirmal Pethe Clinic,Pimpri,,01:00 PM,02:00 PM,Pune
57,Dr. Arshi Rahul,Dermatologist,13,"Diploma In Skin Aesthetics, BHMS, Certificate Course in Skin & Vinereal Disease",₹ 500,₹ 350,The Daily Aesthetics,Kalyani Nagar,"Oily Skin, Hair Transplant, WhiteningNext ",10:00 AM,06:00 PM,Pune
58,Dr. Rohan Anand,Dermatologist,13,"MBBS, Diploma In Dermatology And Venerology And Leprosy (DDVL)",₹ 500,₹ 300,Skin World Clinic,Koregaon Park,,11:00 AM,08:00 PM,Pune
59,Kaya Skin Clinic,Dermatologist,16,Dermatology Backed Expert Skin & Hair Care Solution,₹ 500,,,,"Acne Scars, Pimples Treatment, Acne/Pimples",,,Pune
60,Dr. Shruti Jadhav-devershi,Dermatologist,14,"MBBS, Diploma In Dermatology And Venerology And Leprosy (DDVL)",₹ 600,₹ 999,Solskin Professional Dermacare,Kharadi,"Acne/Pimples, Pimples, Pimples Treatment",06:00 PM,08:00 PM,Pune
61,Dr. Nandini Teli,Dermatologist,15,"MBBS, MD - Dermatology, Fellowship In Anti Aging & Aesthetic Medicine (Germany)",₹ 700,₹ 300,Alpha Superspeciality Hospital,Wakad,,12:00 PM,01:00 PM,Pune
62,Dr. A Elangovan ..,Dermatologist,32,"MBBS, Diploma in Dermatology",₹ 150,,Skin Care Clinic,Sadashiv peth,"Warts, Pimples Treatment, Acne ScarsNext ",10:00 AM,01:30 PM,Pune
63,Dr. Rahul R Patil,Dermatologist,24,"MBBS Bachelor of Medicine and Bachelor of Surgery, Diploma In Dermatology And Venerology A...read more",₹ 500,₹ 600,SKINESSE Advanced Skin & Hair Clinic,Kharadi,,05:00 PM,08:00 PM,Pune
64,Dr. Amey Kelkar,Dermatologist,19,"MD - Dermatology , Venereology & Leprosy, MBBS Bachelor of Medicine and Bachelor of Surgery",₹ 600,,Derma Solutions - Skin Cosmetology & Laser Centre,Paud Road,Pimples TreatmentNext ,05:00 PM,08:00 PM,Pune
65,Dr. Tannu Vidyanand,Dermatologist,44,M D dermat,₹ 500,₹ 750,Dr Tannu Skin Clinic,Ganesh Road,,05:00 PM,09:00 PM,Pune
66,Dr. Rashmi Gujalwar,Dermatologist,18,"MBBS, Diploma In Dermatology And Venerology And Leprosy (DDVL)",₹ 600,₹ 500,Skin Cliinic 360,Pimple Saudagar,,05:45 PM,08:45 PM,Pune
67,Dr. Narendra  Patwardhan,Dermatologist,47,"MBBS, DDV, MD - Skin, VD & Leprosy",₹ 800,,Shreeyash Hospital,Deccan Gymkhana,"Acne Treatment, Dandruff, DermatitisNext ",05:00 PM,07:30 PM,Pune
68,Oliva Skin & Hair Clinic,Dermatologist,19,"MD - Dermatology, Trichologist",₹ 600,,,,"Scar Treatment, Pigmentation, Ear Lobe Repair",10:00 AM,08:00 PM,Pune
69,Dr. Rohini P Gaikwad,Dermatologist,31,"MBBS, MD - Dermatology , Venereology & Leprosy",₹ 400,₹ 300,Aashay the Skin,Hair & Laser Clinic,"Acne/Pimples, Hair Loss, BaldnessNext ",10:00 AM,01:00 PM,Pune
70,Skinovate Laser & Cosmetic Surgery,Dermatologist,17,Diploma in Trichology - Cosmetology,₹ 600,₹ 300,Skinovate Laser & Cosmetic Surgery,Pimple Saudagar,,10:00 AM,08:00 PM,Pune
71,Dr. Pradyumna Vaidya,Dermatologist,22,"DNB (Dermatology), DBD",₹ 500,,Skin & Laser Clinic,Sadashiv peth,,10:30 AM,01:00 PM,Pune
72,Dr. Tushar Kshirsagar,Dermatologist,19,"MBBS, DNB (Dermatology)",₹ 700,,Nuleaf Skin & Hair Clinic,Satara Road,"Nail Surgery, Dermabrasion, Acne Scars",05:30 PM,07:30 PM,Pune
73,Dr. Ravi Kothari,Dermatologist,18,"MD - Dermatology, MBBS",₹ 400,,Sparsh Clinic,Aundh,"Hair Growth, Hair Loss, Hair TreatmentNext ",10:00 AM,09:00 PM,Pune
74,Dr. Ashwini Ingle Salunke,Dermatologist,13,"Diploma in Dermatology, Venerology and Leprosy, MBBS",₹ 400,₹ 500,Derma Touch Skin Laser Hair Clinic,Kharadi,"Skin Health, Pimples TreatmentNext ",05:30 PM,08:30 PM,Pune
75,Vlcc Wellness,Dermatologist,,,,,,,,07:00 AM,08:00 PM,Pune
76,Dr. Someshwar Take,Dermatologist,21,"MBBS, DDV",₹ 500,₹ 300,Dr.Take Skin,Dental & Cosmetology clinic,,09:30 AM,01:30 PM,Pune
77,Dr. Anil P. Trimbake,Dermatologist,40,"MD - Dermatology, Venereology & Leprosy, MBBS Bachelor of Medicine and Bachelor of Surgery",₹ 300,,,,,11:00 AM,07:00 PM,Pune
78,Dr. L K Desai,Dermatologist,29,"MD - Dermatology, MBBS-Venereology and Leprosy",₹ 700,₹ 100,Dr Desai Derma Care,Rasta peth,,12:00 PM,03:00 PM,Pune
79,Dr. Vanishree S.V,Dermatologist,15,"MBBS, Diploma In Dermatology And Venerology And Leprosy (DDVL)",₹ 699,₹ 600,SKINARQ,Nigdi,,12:00 PM,08:00 PM,Pune
80,Richfeel,Dermatologist,17,Trichologist,₹ 100,₹ 300,,,"Pimples, Acne Treatment, Hair TransplantNext ",10:00 AM,08:00 PM,Pune
81,Dr. Sudhakar Grandhi,Dermatologist,36,MBBS,₹ 500,,Dr.Sudhakar Grandhi Dermatology Clinic,Aundh,AllergyNext ,06:00 PM,09:00 PM,Pune
82,Dr. Poorva Shah,Dermatologist,17,"MD -Dermatology , Venereology & Leprosy, MBBS",₹ 500,₹ 500,Derma Centre Camp,Pune,,02:00 PM,08:00 PM,Pune
83,Dr. Nitin Jain,Dermatologist,29,"MBBS, Diploma in Venerology & Dermatology (DVD), DDV, MD - Dermatology , Venereology & Leprosy",₹ 500,,Skin & Surgery International & Asia Institute of Hair Transplant,Viman Nagar,"Skin Whitening, Pimples, Black Spots on SkinNext ",10:00 AM,04:00 PM,Pune
84,Transplant Hair Md Pvt Ltd,Dermatologist,30,"Best Dermatologist Clinic, Closed On Tuesday Only",₹ 500,₹ 500,Transplant Hair MD Pvt Ltd - Sasoon Road,Pune,,10:00 AM,08:00 PM,Pune
85,Dr. Sonal Chavan,Dermatologist,18,"MBBS, MD - Dermatology",₹ 400,₹ 200,Skinhance Clinic,Rahatani,"Pimples, Removal of Corns, Pimples TreatmentNext ",11:00 AM,01:00 PM,Pune
86,Dr. Mohan Darbastwar,Dermatologist,22,"MBBS Bachelor of Medicine and Bachelor of Surgery, Diploma In Dermatology And Venerology A...read more",₹ 500,₹ 700,The Skin Hair Laser & Cosmetology Clinic,Koregaon Park,,11:00 AM,02:00 PM,Pune
87,Dr. Pooja Tilwani,Dermatologist,20,"MBBS, MD - Dermatology, Diploma In Dermatology And Venerology And Leprosy (DDVL)",₹ 400,₹ 700,The Skin Doctors,Pimpri,skin doctorNext ,03:00 PM,06:00 PM,Pune
88,Skinlab By Dr. Jamuna Pai,Dermatologist,31,MBBS,₹ 500,₹ 350,,,,10:00 AM,06:30 PM,Pune
89,Dr. Varsha Bodke,Dermatologist,29,"MBBS, DVD DNB, DVD",₹ 600,₹ 300,Sparsh skin clinic,Pune,,06:00 PM,08:00 PM,Pune
90,Dr. Sheetal Kulkarni Kothekar,Dermatologist,22,"MBBS, DDV",₹ 600,₹ 400,Glow Skin,Hair And Laser Clinic,Black Spots on Skin,11:00 AM,02:00 PM,Pune
91,Dr. Ashutosh Shende,Dermatologist,17,"MBBS, MD",₹ 400,₹ 500,Root Care Dental,Skin & Hair Clinic,,11:00 AM,08:00 PM,Pune
92,Dr. Kiran Chotaliya,Dermatologist,14,"MD - Dermatology , Venereology & Leprosy",₹ 500,,Urban Skin and Hair Clinic,Pimple Gurav,Hair LossNext ,04:00 PM,09:00 PM,Pune
93,Dr. Poonam Naphade,Dermatologist,22,"MBBS, Diploma in Dermatology & Venerology",₹ 450,,Shashwat hospital,Aundh,"Laser Hair Removal, Hair Treatment, Hair Treatment",05:00 PM,07:00 PM,Pune
94,Dr. Tanuja Tamhankar,Dermatologist,17,"MBBS, Diploma In Dermatology And Venerology And Leprosy (DDVL), Certified in Hair Transplant",₹ 400,,Novo Grace Skin Clinic,Kothrud,,10:00 AM,02:00 PM,Pune
95,Dr. Sunil Tolat,Dermatologist,30,MD - Dermatology,₹ 500,,Jehangir Hospital,Sangamvadi,,02:00 PM,04:00 PM,Pune
96,Dr. Vaishalee Kirane,Dermatologist,26,DNB (Dermatology),₹ 600,,Dr Vaishalee Kirane's Skin & Hair Clinic,Shivaji Nagar,,05:30 PM,07:30 PM,Pune
97,Dr. Abhigyan Mukherjee,Dermatologist,11,"MBBS Bachelor of Medicine and Bachelor of Surgery, Diploma In Dermatology And Venerology A...read more",₹ 500,,Dr Mukherjee Skin Hair & Laser Clinic,Kalyani Nagar,,10:00 AM,01:30 PM,Pune
98,Dr. Meeta Mantri,Dermatologist,15,"MD - Dermatology, MBBS, DNB (Dermatology)",₹ 600,,Dermaplus Skin Clinic,Aundh,,04:00 PM,04:00 PM,Pune
99,Dr. Vaishali Jagtap,Dermatologist,28,Diploma in Venerology & Dermatology (DVD),₹ 500,,Dr.Vaishali Jagtap Skin and Cosmetic Clinic,Hadapsar,,09:00 AM,04:00 PM,Pune
100,Dr. Priyanka Joshi,Dietitian/Nutritionist,5,Ph.D - Food Science and Nutrition,₹ 450,₹ 300,360 Degree Nutrition,Pune,"Weight Loss, Gaining Weight, Weight LossNext ",10:30 AM,01:30 PM,Pune
101,Dt. Kavita Agarwal,Dietitian/Nutritionist,15,M.Sc - Dietitic,₹ 600,₹ 350,Consultation,Pune,"Weight Loss, Gaining Weight, Weight LossNext ",10:00 AM,07:00 PM,Pune
102,Dt. Mrunal Deshpande,Dietitian/Nutritionist,30,"Masters in Dietetics and Food Service Management, Masters in psychology , Post Graduation ...read more",₹ 500,₹ 850,Mrunal's Diet & Life Style Management Clinic,Wakad,Weight Loss,05:00 PM,05:30 PM,Pune
103,Dt. Neha Pundir,Dietitian/Nutritionist,10,M.Sc - Dietitic,,₹ 500,TRUPT By Neha Pundir,Dhanori-Lohegaon,,05:00 PM,08:30 PM,Pune
104,Dr. Shilpa Ramdin (Nadem),Dietitian/Nutritionist,19,"BHMS, M.Sc - Clinical Nutrition, Certificate In Sports Nutrition, DNHE, cirtified batch fl...read more",₹ 700,₹ 500,Sarthak diet and homoeopathic clinic,Nana peth,,02:30 PM,08:00 PM,Pune
105,Dr. Rekha Sachdev Pohani,Dietitian/Nutritionist,20,"Ph. D - Gastro & Human Nutrition Unit, BSc - Home Science, MSc - Dietitic",₹ 400,₹ 250,Diet Clinic,NIBM,"Weight Loss, Weight Loss, Gaining Weight",08:00 AM,08:00 PM,Pune
106,Dt. Mayura Mahajani,Dietitian/Nutritionist,22,"Registered Dietitian , MSc(DFSM), Certified Diabetes Educator, Trained Yoga Teacher & Therapist",,₹ 399,Aaditya CLINIC,Pune,,,,Pune
107,Dr. Tripti Khanna,Dietitian/Nutritionist,17,Master In Food Science & Nutrition,₹ 800,₹ 500,Sirona Healing Center,NIBM Road,,05:00 PM,07:00 PM,Pune
108,Dt. Komal Mehta,Dietitian/Nutritionist,19,diploma  in dietitics,,₹ 300,Shree Hospital,Nagar Road,"Weight Loss, Gaining Weight, Weight Loss",09:00 AM,09:00 PM,Pune
109,Dt. Archana Rairikar,Dietitian/Nutritionist,32,"IGNOU, B.Sc - Nutrition, Post Diploma In Dietetics, Post Graducate Certificate In Diabetes...read more",,₹ 350,Dr Bhaskar Harshe Clinic,Narayan peth,,03:00 PM,05:00 PM,Pune
110,Dt. Shwetha Bhatia,Dietitian/Nutritionist,25,"B.Sc. In Food Science & Quality Control, Post Graduate Diploma In Dietetics",,,,,,10:00 AM,08:00 PM,Pune
111,Dt. Rd Bilkish Raje,Dietitian/Nutritionist,20,M.Sc Dietetics -Outstanding Grad,₹ 500,,Ecovalley Nutrition Centre,Wagholi,"Weight Loss, Diabetic Diet Counseling, Weight Loss TreatmentNext ",10:00 AM,05:00 PM,Pune
112,Dt. Shreesha Gijare,Dietitian/Nutritionist,19,"Bachelor of Science, Nutrition & Food Technology, Maste",₹ 500,₹ 300,Shree Venkateshwara Nutrition Clinic,Ganesh Nagar,,09:00 AM,06:00 PM,Pune
113,Dr. Rupal Jasani,Dietitian/Nutritionist,16,Bsc - Food & Nutrition,₹ 400,₹ 300,Rupal's Diet Clinic,Pune,,05:30 PM,08:30 PM,Pune
114,Dt. Aditi Kulkarni,Dietitian/Nutritionist,14,post graduate diploma in advanced nutrition,₹ 450,₹ 150,One click diet service,Pune,"Weight Loss, Weight ManagementNext ",11:00 AM,07:00 PM,Pune
115,Dt. Preeti Singh,Dietitian/Nutritionist,13,"MSc - Nutritional Sciences, B.H.Sc. (Food & Nutrition)",₹ 500,₹ 500,Preeti's Diet Clinic,Pune,,10:00 AM,12:00 PM,Pune
116,Dt. Mrs. Anagha Samir Jadhav,Dietitian/Nutritionist,22,M.Sc - Dietitic,₹ 700,,Anaghasworld... Shape up your world,Wakad,,11:30 AM,01:30 PM,Pune
117,Dt. Manju Sharma,Dietitian/Nutritionist,11,M.Sc - Dietitic,₹ 500,₹ 500,The Food Clinique- Health,Wellness and Fitness clinic,,09:45 AM,12:15 PM,Pune
118,Dr. Tulika Bakshi Sinha,Dietitian/Nutritionist,11,"Bachelor In Clinical Nutrition and Dieteics, Master in Nutrition and Dietetics",,₹ 400,TotalNutrition@TulikaS,Chinchwad,"Weight Loss, Gaining Weight, Weight Loss Diet CounselingNext ",06:00 PM,08:30 PM,Pune
119,Dr. Rohini Patil,Dietitian/Nutritionist,9,MBBS Bachelor of Medicine and Bachelor of Surgery,,₹ 250,Nutracy Lifestyle by Dr.Rohini Patil,Koregaon Park,,10:30 AM,06:30 PM,Pune
120,Dr. Ruta Ashwin,Dietitian/Nutritionist,18,"MBBS, MBA (Healthcare), CFN, MSc DFSM",₹ 600,₹ 300,Ghole Road,Pune,,09:30 AM,07:00 PM,Pune
121,Dt. Sneha Majumder,Dietitian/Nutritionist,11,"M.Sc in Applied Nutrition, B.Sc. - Dietitic",,₹ 850,,,,,,Pune
122,Dr. Deepika Gupta,Dietitian/Nutritionist,18,"Ph. D - Nutrition, UGC NET, Junior Research Felloship in Food and Nutrition, Masters in Nu...read more",₹ 500,,Eat2Nourishh,Pune,,05:30 PM,08:00 PM,Pune
123,Health-total By Anjali Mukerjee,Dietitian/Nutritionist,,,₹ 100,,,,,09:00 AM,05:00 PM,Pune
124,Dr. Dhananjay Patil,Dietitian/Nutritionist,19,"Bachelor of Ayurveda, Medicine and Surgery (BAMS), PG Diploma in Emergency Medicine, pg di...read more",,₹ 300,,,,,,Pune
125,Dr. Vidya Shinde-rokade,Dietitian/Nutritionist,21,"MBBS Bachelor of Medicine and Bachelor of Surgery, Nutrition Certification, Msc dietetics ...read more",₹ 500,₹ 600,Priime Nephrocare Nutrition & Wellness,Hadapsar,,05:00 PM,09:00 PM,Pune
126,Dr. Ambika Nair,Dietitian/Nutritionist,29,M.Sc - Clinical Nutrition,,,,,,06:00 PM,09:00 PM,Pune
127,Dt. Pallavi Menon,Dietitian/Nutritionist,10,"PG Diploma in Clinical Nutrition, M.Tech Biotechnology",₹ 500,₹ 200,Yogi Tree Wellness,Baner-Pashan Link Road,,11:00 AM,07:30 PM,Pune
128,Dr. Aparna Pitre,Dietitian/Nutritionist,16,"BHMS, Diploma in Diet and Nutrition, Diploma in Skin Aesthetics, Cosmetology and Trichology",₹ 500,,Aparna Pitre,Kandivali,,04:00 PM,08:00 PM,Pune
129,Dt. Prachi Rege,Dietitian/Nutritionist,22,Master in Foo,,,,,Weight Loss,10:15 AM,08:30 PM,Pune
130,Dt. Jyoti Kr,Dietitian/Nutritionist,15,"Masters in Food Sc. & Nutrition, Bachelor in Home Science",,₹ 300,Right Diet Transformation Clinic,Pimple Saudagar,,02:00 PM,04:00 PM,Pune
131,Dt. Gitanjali Borse,Dietitian/Nutritionist,23,BSc - Dietitic,₹ 500,₹ 300,Pain ex clinic,Pune,"Nutrition Assessment, Aromatherapy",06:00 PM,08:00 PM,Pune
132,Dt. Sonali Bhanushali,Dietitian/Nutritionist,13,Post Graduate Diploma in applied nutrition n dietetics,₹ 500,,Bhanushali Clinic,Hadapsar,,09:00 AM,01:30 PM,Pune
133,Dt. Supriti Dixit,Dietitian/Nutritionist,20,Master-  Dietetics with Distinction,,,,,,,,Pune
134,Dt. Sanjay Kumar Mishra,Dietitian/Nutritionist,,,₹ 600,,Aditya Birla Memorial Hospital,Pune,,10:00 AM,05:00 PM,Pune
135,Dr. Shahenaz Shaikh,Dietitian/Nutritionist,13,MSc - Dietitic,₹ 500,,Express Clinics,Hadapsar,,04:00 PM,06:00 PM,Pune
136,Ms. Vishnu  Priya,Dietitian/Nutritionist,,,₹ 500,₹ 200,Tatva Diet Clinic,Lohegaon,,09:00 AM,05:00 PM,Pune
137,Dr. Priti Deshmukh,Dietitian/Nutritionist,,,,,,,,08:30 AM,11:00 PM,Pune
138,Shweta Chikhale,Dietitian/Nutritionist,,,₹ 600,,Apollo Spectra hospital,Pune,,08:30 AM,12:30 PM,Pune
139,Dr. Snesha Rakesh Aamalepatil,Dietitian/Nutritionist,16,"BSc-Food and Applied Nutrition, PG Diploma In Diabetes Education, Diploma in Sports Nutrit...read more",,,,,,09:00 AM,08:00 PM,Pune
140,Dt. Ss,Dietitian/Nutritionist,,,₹ 300,₹ 50,Nutrazyss,Pimple Saudagar,,09:00 AM,09:00 PM,Pune
141,Health-total By Anjali Mukherjee,Dietitian/Nutritionist,,,₹ 100,,,,,09:00 AM,05:00 PM,Pune
142,Dr. Swapnaja Kirunge,Dietitian/Nutritionist,14,MSc (Dietetics) BHMS,,,,,,08:30 PM,09:30 PM,Pune
143,Dt. Shalini Garg,Dietitian/Nutritionist,19,"BSc - Food and Nutrition, MSc - Food and Applied Nutrition",₹ 600,,Maxcare Hospital,Pune,,12:00 PM,12:30 PM,Pune
144,Dt. Avanti Damle,Dietitian/Nutritionist,21,p.g sports nutrition,,,,,,10:00 AM,02:00 PM,Pune
145,Dt. Riddhi Gandhi,Dietitian/Nutritionist,15,"Masters in Nutritional Therapy, S M Patel College of Home Science, Vallabh Vidyanagar",,₹ 400,dt.Riddhi Gandhi,Pune,,11:00 AM,05:00 PM,Pune
146,Dr. Rohini Shende,Dietitian/Nutritionist,,,,,,,,10:30 AM,06:30 PM,Pune
147,Ms. Mitali Ambekar,Dietitian/Nutritionist,15,"PGD  in  Sports Nutrition and Dietitics, International Olympic Committee - IOC sports nutrition",,,,,,09:00 AM,08:30 PM,Pune
148,Dr. Purti,Dietitian/Nutritionist,7,B.Sc. - Dietitic,,,,,,,,Pune
149,Dt. Bhumika Batra,Dietitian/Nutritionist,,,₹ 500,,Bhumika Batra,Pune,,05:00 PM,05:30 PM,Pune
150,Dr. Shivram Bhonagiri,General+Physician,41,"MBBS, MD - Internal Medicine",₹ 600,,Aster Hospital,Aundh,,11:30 AM,01:30 PM,Pune
151,Dr. Arunesh Dutt Upadhyay,General+Physician,38,"MBBS, MD - Aerospace Medicine, Eular Certification in Rheumatology",₹ 750,₹ 300,Dr. Upadhyay's Clinic,Tingre Nagar,"Masturbation Addiction, Stomach Pain, Headaches",10:00 AM,02:00 PM,Pune
152,Dr. Amar Raykantiwar,General+Physician,17,"D ( Diabetology), AFIH, DNB (F.MEDICINE), MBBS",₹ 300,₹ 300,Atarva Diabetes Care Centre,Sinhagad Road,"Gastric Problem, VaccinationNext ",06:00 PM,09:00 PM,Pune
153,Dr. Rahul Sanap (Dermatologist),General+Physician,14,"MBBS, DDV",₹ 500,₹ 500,PRIME SKIN DOCTORS,Pune,"Small Penis Size, Sex Education, Masturbation Addiction",10:00 AM,09:00 PM,Pune
154,Dr. Abhay B Mane,General+Physician,21,"MD, DFID",₹ 500,₹ 600,Diabelife (Diabetes Speciality Clinic),Wakad,,06:00 PM,10:00 PM,Pune
155,Dr. Abhay A Mali,General+Physician,19,"MBBS, Diploma in Diabetology",₹ 700,₹ 250,Wellness Speciality Clinic,Pimple Saudagar,DiabetesNext ,01:00 PM,02:00 PM,Pune
156,Dr. Abhinav Mohindra,General+Physician,6,"MBBS, DNB (General Medicine)",₹ 150,₹ 400,Ruby Hall Clinic,Sangamvadi,,09:00 AM,09:00 AM,Pune
157,Dr. K G Agrawal,General+Physician,52,"MBBS Bachelor of Medicine and Bachelor of Surgery, MD - Medicine",₹ 400,,Asha Medi Clinic,Pimpoli,,06:00 PM,08:30 PM,Pune
158,Dr. Ankush Gupta,General+Physician,14,"MBBS, MD, Fellowship in Diabetes, Diploma in emergency medicine",₹ 400,₹ 400,One Life Clinic,Sinhagad,DiabetesNext ,04:00 PM,07:00 PM,Pune
