,Unnamed: 0,Name,Specialization,Experience (in years),Education,Fee at clinic,Online Fee,Clinic Name,Area,Recently Consulted for,Available From,Available Till,City
442,442,Usma Ayurvedic Clinic,Ayurveda,41.0,"Bachelor of Ayurveda, Medicine and Surgery (BAMS)",₹ 500,₹ 300,Usma Ayurvedic Clinic,Laxmi Nagar,,09:00 AM,08:00 PM,Delhi
443,443,Dr. Vaidic Chikitsa,Ayurveda,47.0,"Bachelor of Ayurveda, Medicine and Surgery (BAMS)",₹ 300,₹ 200,Vaidic Chikitsa,Delhi,"Sex Education, Weight Loss, Hair LossNext ",10:00 AM,06:00 PM,Delhi
444,444,Dr. Lovekush Singh,Ayurveda,10.0,"B. Ph (Ayu.), Clinical research and pharmacovigilance, Fellowship in Clinical Research, MB...read more",,,,,,09:30 AM,01:30 PM,Delhi
445,445,Dr. Chanchal Sharma,Ayurveda,13.0,"Bachelor of Ayurveda, Medicine and Surgery (BAMS), DGO, MD - AM, D-Certificate Course In P...read more",₹ 500,,₹ 3,500 onlineAasha Ayurveda,,10:00 AM,06:00 PM,Delhi
446,446,Dr. Ramesh Rai,Ayurveda,53.0,Graduate of Ayurvedic Medicine and Surgery (GAMS),₹ 500,₹ 300,,,"Balance Exercises, Kshar Sutra, Skin Treatment",12:00 PM,06:00 PM,Delhi
447,447,Dr. Meeta Sharma,Ayurveda,15.0,"M.Sc- Psychology, Masters In Clinical Psychology, M.Sc Counselling Psychology",,,,,,01:45 PM,07:00 PM,Delhi
448,448,Dr. Preeti Chhabra,Ayurveda,32.0,BAMS,,,,,,04:00 PM,06:00 PM,Delhi
449,449,Dr. Navayushya Panchakarma Centre Kalkaji,Ayurveda,14.0,"Bachelor of Ayurveda, Medicine and Surgery (BAMS), C.R.A.V",₹ 300,₹ 300,Navayushya Panchakarma Centre,Kalkaji,,11:00 AM,07:00 PM,Delhi
