,Unnamed: 0,Name,Specialization,Experience (in years),Education,Fee at clinic,Online Fee,Clinic Name,Area,Recently Consulted for,Available From,Available Till,City
151,151,Dr. Prakhar Singh,General+Physician,10.0,"MBBS, Basic Life Support (B.L.S), Advanced Cardiac Life Support, Fellow Of Academy Of Gene...read more",₹ 500,₹ 300,Sama hospital,Siri Fort,"Masturbation Addiction, Stomach Pain, Body Weakness",09:30 AM,10:30 AM,Delhi
152,152,Dr. Rajiva Gupta,General+Physician,44.0,"MBBS, MD - Internal Medicine, Post Graduate Program in Diabetology",,,,,"Masturbation Addiction, Stomach Pain, HeadachesNext ",04:00 PM,06:00 PM,Delhi
153,153,Dr. Hanish Gupta,General+Physician,21.0,"MBBS, DNB (General Medicine)",₹ 700,₹ 500,LifeAID Clinic,Mayur Vihar Phase 1,"Diabetes, Diabetes, Thyroid Disorders",07:30 AM,09:00 AM,Delhi
154,154,Dr. Amarpreet Singh Riar,General+Physician,19.0,"MBBS, PG Diploma In Emergency Trauma Care, Fellowship in Diabetes",,₹ 600,Aman Medical Clinic,Dwarka,"Allergy, Penis Pain, Cold CoughNext ",10:00 AM,02:00 PM,Delhi
155,155,Dr. Ajit  K Thakur,General+Physician,25.0,"MD - General Medicine, MBBS, IDCCM, IFCCM Critical Care",₹ 500,₹ 700,Al Shifa Hospital,Okhla,,05:30 PM,07:00 PM,Delhi
156,156,Dr. Ashish Khattar,General+Physician,24.0,"MBBS, MD - General Medicine, PG Diploma Diabetology, Post Graduate Diploma in Clinical End...read more",₹ 700,₹ 800,,,,06:00 PM,08:30 PM,Delhi
157,157,Dr. Vijay  Kansal,General+Physician,53.0,MBBS,₹ 600,₹ 300,Kalyan Poly Clinic,Pitampura,,04:00 PM,08:00 PM,Delhi
158,158,Dr. Utsav Sahu,General+Physician,9.0,MD - Medicine,,,,,Bladder InfectionsNext ,04:00 PM,08:00 PM,Delhi
159,159,Dr. Nikhil Aggarwal,General+Physician,9.0,"MBBS, MD - Anatomy",₹ 600,₹ 600,Medical care,Gujranwala Town,,04:30 PM,11:00 PM,Delhi
160,160,Dr. Neelam Nath,General+Physician,49.0,"Diploma in Obstetrics & Gynaecology, MBBS",₹ 200,₹ 300,Suneera Charitable Center,New Delhi,"Pregnancy, AbortionNext ",04:00 PM,07:00 PM,Delhi
161,161,Dr. Pratik Banerjee,General+Physician,35.0,MBBS,,,,,Neck PainNext ,08:30 AM,01:30 PM,Delhi
162,162,Dr. Rakesh Sharma,General+Physician,36.0,"DDF, FCCP, MD , MBBS",₹ 700,,₹ 1,000 onlineDr Rakesh Sharma’s Clinic,"Diabetes, Dizziness, ImmunizationsNext ",01:00 PM,06:00 PM,Delhi
163,163,Dr. Ritez Kumar,General+Physician,18.0,"MBBS, MD - Internal Medicine",₹ 600,,GLOBAL WELLNESS CENTRE,Dabri,"Headaches, Chest Pain, TuberculosisNext ",06:00 PM,09:00 PM,Delhi
164,164,Dr. Hariom Ahuja,General+Physician,45.0,"MD - Internal Medicine, MBBS",,₹ 400,Ahuja Clinic,Saket,,05:00 PM,06:30 PM,Delhi
165,165,Dr. Ramneek Varma,General+Physician,48.0,"MD-Internal Medicine , MBBS",,₹ 300,Sukhmani Hospital,Safdarjung Enclave,"Staying Healthy, Body Weakness, Alcoholic Liver DiseaseNext ",05:00 PM,06:00 PM,Delhi
166,166,Dr. Vipul Mohan,General+Physician,17.0,"MBBS, MD - General Medicine, Diploma In Cardiology",,,,,"Diabetes, Diabetes ManagementNext ",04:00 PM,08:00 PM,Delhi
167,167,Dr. Mohd. Sajid Khan,General+Physician,17.0,"MD, MBBS",₹ 200,₹ 200,Alshifa Hospital,Okhla,"Neck Pain, Stomach Pain, HeadachesNext ",03:00 PM,05:00 PM,Delhi
168,168,Dr. Rajesh Kumar Meena,General+Physician,19.0,"MD - Consultant Physician, Senior Resident-Emergency Medicine",,₹ 800,Moolchand Medcity,Lajpat Nagar,,11:00 AM,03:00 PM,Delhi
169,169,Dr. Suresh Mittal,General+Physician,40.0,"MD, MBBS",,,,,,04:00 PM,05:00 PM,Delhi
170,170,Dr. Satish Kumar Bhardwaj,General+Physician,33.0,Fellowship of College of General Practice (FCGP),,,,,,06:30 PM,08:00 PM,Delhi
171,171,Dr. Pankaj Kumar,General+Physician,19.0,"MBBS, DNB FAMILY MEDICINE",₹ 700,₹ 650,Diet Plus Minus,Delhi,,10:00 AM,02:00 PM,Delhi
172,172,Dr. Manish Gambhir,General+Physician,29.0,BAMS,₹ 200,₹ 700,Pushp Clinic,New Delhi,AllergyNext ,10:00 AM,01:30 PM,Delhi
173,173,Dr. Sanjeev Gupta,General+Physician,24.0,"MBBS, MD - Medicine, POST GRADUATE CLINICAL COURSE IN DIABETES MANAGEMENT",₹ 500,₹ 500,Dr. Sanjeev Clinc,Vaibhav Khand,"Chickenpox Treatment  , Diabetes, Neck Pain",09:00 AM,12:00 PM,Delhi
174,174,Dr. Sanchayan Roy,General+Physician,26.0,"DNB (Medicine), MBBS",,,,,"Headaches, Stomach Pain, SweatingNext ",09:00 AM,11:30 AM,Delhi
175,175,Dr. Manisha Roy,General+Physician,18.0,MBBS,₹ 500,₹ 300,Dr. Manisha,Delhi,"Erection Problems, Epilepsy, Neck PainNext ",10:00 AM,07:30 PM,Delhi
176,176,Dr. Aakash Kumar,General+Physician,7.0,"Bachelor of Ayurveda, Medicine and Surgery (BAMS), CMS & ED, MD, ACCM, ACDM",₹ 300,₹ 300,,,,12:00 PM,05:00 PM,Delhi
177,177,Dr. Ashok Grover,General+Physician,45.0,"MBBS, Diploma in Tuberculosis and Chest Diseases (DTCD), MD - General Medicine",,,,,"Gaining Weight, Hyperthyroidism, Underactive ThyroidNext ",10:00 AM,12:00 PM,Delhi
178,178,Dr. Arun  Jain,General+Physician,36.0,MBBS,₹ 500,₹ 500,Dr. Arun Jain's Clinic,Rohini,,09:00 AM,01:30 PM,Delhi
179,179,Dr. Bharat Bhushan Bharti,General+Physician,29.0,MD Physician,₹ 500,,Dr Bharti Clinic,Gulabi Bagh,,06:00 PM,09:00 PM,Delhi
180,180,Dr. Manoj Kumar Jha,General+Physician,29.0,"MBBS, MBA (Healthcare)",₹ 500,₹ 500,Dr Jha Online Consultation,Delhi,"Gastric Problem, Chikungunya, Neck Pain",09:00 AM,11:00 PM,Delhi
181,181,Dr. Nishi Nath Jha,General+Physician,39.0,"MBBS, MD - Medicine",₹ 500,₹ 900,Good Health Clinic,Shastri Nagar,,10:00 AM,02:00 PM,Delhi
182,182,Dr. Amit Singhal,General+Physician,18.0,"M.B.B.S., M.D.",₹ 450,₹ 200,Singhal Clinic,New Delhi,,10:00 AM,01:00 PM,Delhi
183,183,Dr. Garima,General+Physician,3.0,MNAMS (Membership of the National Academy) (Ophthalmology),₹ 300,,Private Practitioner,Sarita Vihar,"Allergy, Allergy TreatmentNext ",07:00 AM,04:30 PM,Delhi
184,184,Dr. Pulkit K.Varshney,General+Physician,12.0,"MBBS Bachelor of Medicine and Bachelor of Surgery, Postgraduate Diploma Clinical Cardiolog...read more",₹ 500,₹ 500,Dr.Pulkits Family  Clinic And Diabetes Centre,Subhash Nagar,,10:00 AM,02:00 PM,Delhi
185,185,Dr. Dheeraj Khatri,General+Physician,18.0,MD,₹ 250,₹ 250,DD khatri family clinic,Shalimar Bagh,"Thyroid Problems Treatment, Allergy Treatment, AllergyNext ",06:00 PM,08:30 PM,Delhi
186,186,Dr. Vikram Jeet Singh,General+Physician,28.0,,,,,,,02:00 PM,05:00 PM,Delhi
187,187,Dr. Suman Nigam,General+Physician,41.0,MBBS,₹ 800,₹ 300,Dr. Suman Clinic,Vasant Kunj,,06:00 PM,08:00 PM,Delhi
188,188,Dr. Rachna Kucheria,General+Physician,31.0,"MBBS, MD - Medicine, MD - USC, California",,,,,,10:00 AM,03:00 PM,Delhi
189,189,Dr. A.P. Bhatia,General+Physician,35.0,"MD - Internal Medicine, MBBS",₹ 500,₹ 500,Dr. A.P. Bhatia Clinic,Krishna Nagar,,06:30 PM,07:30 PM,Delhi
190,190,Dr. Atul Kakar,General+Physician,35.0,"Fellowship in  Rheumatology, MNAMS, DNB (Internal Medicine), MBBS",,,,,"Allergy Treatment, AllergyNext ",04:00 PM,06:00 PM,Delhi
191,191,Dr. Yogesh Sehrawat,General+Physician,17.0,MD - General Medicine,,₹ 400,Siddharth Multispeciality Hospital,Bawana,Tuberculosis,,,Delhi
192,192,Dr. Sabyasachi Das,General+Physician,27.0,MBBS,₹ 300,,₹ 1,000 onlineDr Sabyasachi Das Clinic ( Samalka ),"Small Penis Size, HIV AIDS, Jaundice",04:00 PM,09:00 PM,Delhi
193,193,Dr. A.K. Kaushik,General+Physician,55.0,"MRCP, MBBS",₹ 800,₹ 600,Res. Cum Clinic,Janakpuri,,08:00 PM,09:00 PM,Delhi
194,194,Dr. Jagmohan Singh,General+Physician,49.0,MBBS,₹ 350,₹ 300,Dr. Jagmohan Singh Clinic,Kalkaji,RabiesNext ,10:00 AM,01:00 PM,Delhi
195,195,Dr. Ajay Arora,General+Physician,42.0,"Fellowship of College of General Practice (FCGP), MBBS",₹ 450,,Doctor Ajay Arora's Clinic And Diagnostix Path. Centre,New Delhi,,10:00 AM,01:00 PM,Delhi
196,196,Dr. A.K. Shukla,General+Physician,34.0,MD - Internal Medicine,₹ 850,₹ 500,,,"Diabetes, AsthmaNext ",07:30 PM,09:30 PM,Delhi
197,197,Dr. Rps Makkar,General+Physician,24.0,MD,₹ 600,₹ 600,,,Viral Fever Treatment,07:00 PM,09:00 PM,Delhi
198,198,Dr. Manish Jain,General+Physician,6.0,MBBS,,₹ 170,MediSeed,Delhi,,02:00 PM,08:00 PM,Delhi
199,199,Dr. S K Tyagi,General+Physician,42.0,"MBBS, MD - Medicine, SR(Cardiology), PGDHA",,₹ 300,Tyagi Nursing Home,Tilak nagar,,10:00 AM,02:00 PM,Delhi
200,200,Dr Naresh Agarwal,Orthopedist,17.0,,,,,,,05:00 PM,08:00 PM,Delhi
201,201,Dr Abhishek Bansal,Orthopedist,19.0,,,,,,,05:00 PM,08:00 PM,Delhi
202,202,Dr Kamal Bachani Bachani,Orthopedist,34.0,,,,,,"Knee Pain Treatment, Knee Pain, Finger Pain",05:00 PM,08:00 PM,Delhi
203,203,Dr. Hitin,Orthopedist,,,,,,,ACL Reconstruction,05:00 PM,08:00 PM,Delhi
204,204,Dr. Jitender Pal Singh,Orthopedist,25.0,MBBS,₹ 700,₹ 400,Dr J P Singh Bone And Joint Clinic,Punjabi Bagh,"Leg Pain, Foot Pain, Joint Pain",10:00 AM,07:00 PM,Delhi
205,205,Dr. Sujit Narayan,Orthopedist,20.0,,,,,,,05:00 PM,08:00 PM,Delhi
206,206,Dr. Saurabh Rawall,Orthopedist,19.0,"MBBS,  MS - Orthopaedics , FNB - Spine Surgery, Fellow in Spine Surgery,  Fellowship In Pa...read more",,₹ 500,Institutes Of Spine,Indraprastha Apollo Hospital,"Disk Slip, Shoulder SLAP (Tear) Lesions, Slip DiscNext ",12:00 PM,02:00 PM,Delhi
207,207,Dr. Sunny Chopra Orthopaedics Gold Medalist,Orthopedist,14.0,"MS - Orthopaedics, MNAMS (Membership of the National Academy) (General Surgery) , DNB (Ort...read more",₹ 500,₹ 400,Dr. Chopras Spine Joint Solutions India,Moti Nagar,,05:30 PM,08:30 PM,Delhi
208,208,Dr. Rakesh Kumar,Orthopedist,24.0,"MS - Orthopaedics, MBBS",₹ 500,₹ 500,Anuraksha Specialised Orthopaedic Clinic,Paschim Vihar,"Knee Pain, Shoulder Pain, Hand PainNext ",06:30 PM,08:00 PM,Delhi
209,209,Dr. Deepak Kumar Arora,Orthopedist,18.0,"MBBS, MS - Orthopaedics",₹ 500,₹ 300,Esskay Orthopaedic Centre,Krishna Nagar,"Knee Pain, Back Pain, Lower Back PainNext ",05:00 PM,08:00 PM,Delhi
210,210,Dr. Pankaj Gupta,Orthopedist,30.0,"M Ch. Ortho, MS - Orthopaedics, MBBS",₹ 600,₹ 500,Skin And Bones Clinic,Delhi,"Shoulder Pain, Hand Pain, Joint PainNext ",06:30 PM,09:00 PM,Delhi
211,211,Dr. Shekhar Srivastav,Orthopedist,30.0,"MBBS, MS - Orthopaedics, AO Fellowship",,₹ 800,Sant Parmanand Hospital,Civil Lines,"Ankle Pain Treatment, Joint PainNext ",02:00 PM,04:00 PM,Delhi
212,212,Dr. Sudhir Seth,Orthopedist,43.0,"MCh, DNB (Orthopedics), MS - Orthopaedics, MBBS",₹ 900,₹ 300,Dr. Sudhir Seth's Orthopoint,Chittaranjan Park,"Spine Injuries, Back Pain, Heel Pain",12:00 PM,03:00 PM,Delhi
213,213,Dr. Ashwani Maichand,Orthopedist,32.0,"Fellowship in Joint Replacement , M.Ch , MS - Orthopaedics, MBBS",,,,,"Knee replacement Treatment, Osteoarthritis, Knee PainNext ",05:00 PM,08:00 PM,Delhi
214,214,Dr. Neelabh,Orthopedist,34.0,"DNB (Orthopedics), Diploma in Orthopedics, MBBS",₹ 800,,₹ 1,200 onlineClinic Intermed,,06:00 PM,08:00 PM,Delhi
215,215,Dr. Vishal Nigam,Orthopedist,26.0,,,₹ 300,,,,09:00 AM,05:00 PM,Delhi
216,216,Dr. Gurinder Bedi,Orthopedist,36.0,"CCST(Internal Medicine), FRCS (Orth Surg), FRCS, MS - Orthopaedics, DNB Orthopedics, MBBS",,,,,"Back Pain, Foot Pain, Bone FractureNext ",05:00 PM,07:00 PM,Delhi
217,217,Dr. Subhash Shalya,Orthopedist,43.0,"MBBS, MS - Orthopaedics, MS - General Surgery",,,,,Orthopedic SurgeryNext ,10:00 AM,01:00 PM,Delhi
218,218,Dr. Deepak Thakur,Orthopedist,23.0,"M.CH. (Ortho), MS - Orthopaedics, MBBS",,₹ 700,Delhi Orthopedic Clinic,Karol Bagh,"Knee Pain, Shoulder Pain, Rheumatoid ArthritisNext ",06:00 PM,09:00 PM,Delhi
219,219,Dr. Suraj Prakash,Orthopedist,34.0,"M.Ch - Orthopaedics, Fellowship in Arthroscopy & Sports Medicine, MS - Orthopaedics, MBBS",₹ 900,₹ 300,Bone & Joint Clinic,Saket,"Back Pain, Foot Pain, Knee PainNext ",11:00 AM,01:30 PM,Delhi
220,220,Dr. Kunal Aneja,Orthopedist,11.0,"M.B.B.S., MS - Orthopaedics, DNB (Orthopedics), Diploma in Orthopaedics, Fellowships in Jo...read more",₹ 800,₹ 300,Naveda Healthcare Centre,New Delhi,Arthroscopy,10:30 AM,12:30 PM,Delhi
221,221,Dr. Gurdeep Singh Uppal,Orthopedist,48.0,"MBBS, Diploma In Orthopaedics, DNB (Orthopedics), MBA (HCA)",₹ 500,₹ 600,Ortho Care Clinic,Dwarka Sector 6,,05:00 PM,08:00 PM,Delhi
222,222,Dr. Suresh  Arora,Orthopedist,38.0,MS,₹ 400,,Surya Orthoedic & Trauma Centre,Vasant Kunj,"Joint Pain, Back PainNext ",06:00 PM,08:00 PM,Delhi
223,223,Dr. Abhishek Kumar Mishra,Orthopedist,25.0,"MS - Orthopaedics, MCH, Membership of the Royal College of Surgeons (MRCS), MBBS Bachelor ...read more",,,,,"Back Pain, Fracture Treatment, Lower Back PainNext ",06:00 PM,08:00 PM,Delhi
224,224,Dr. Prabhat Agarwal,Orthopedist,20.0,"MS - Orthopaedics, MBBS",₹ 400,₹ 300,Garg Hospital,Karkardooma,"Knee Pain Treatment, Knee Pain, Musculoskeletal DisordersNext ",05:00 PM,07:00 PM,Delhi
225,225,Dr. N C Gupta,Orthopedist,58.0,"MBBS, MS - Orthopaedics",₹ 500,₹ 500,Saroj Clinic,Roop Nagar,"Knee Pain Treatment, Knee Pain, Spinal SurgeryNext ",03:00 PM,08:45 AM,Delhi
226,226,Dr. Sunil Tuli,Orthopedist,40.0,"M. Ch. (Ortho), MS - Orthopaedics, Diploma In Orthopaedics (D. Ortho), MBBS",,,,,Orthopedic SurgeryNext ,05:30 PM,07:30 PM,Delhi
227,227,Apollo Spectra Hospitals,Orthopedist,,,,,,,,09:00 AM,09:00 PM,Delhi
228,228,Dr. Ashis Acharya,Orthopedist,22.0,"Fellowship, MS - Orthopaedics, MBBS",,₹ 350,Sir Ganga Ram Hospital,Rajender Nagar,"Knee Pain, Knee Pain, Joint PainNext ",06:00 PM,08:00 PM,Delhi
229,229,Dr. Atul Mishra,Orthopedist,28.0,"Fellowship In Joint Replacement, MS - Orthopaedics, MBBS",,₹ 700,Arthroplasty & Sports Injury Centre,Vikas Marg,,06:00 PM,09:00 PM,Delhi
230,230,Dr. Mandeep Singh,Orthopedist,22.0,"DNB (Orthopedics), M Ch. Ortho, Diploma In Orthopaedics (D. Ortho)",₹ 800,₹ 400,DELHI ORTHO & SPINE CLINIC,Rajouri Garden,,11:00 AM,01:00 PM,Delhi
231,231,Dr. Tarush Rustagi,Orthopedist,20.0,"MBBS, MS - Orthopaedics, DNB (Orthopedics), Adult and pediatric Spine Fellowship, Complex ...read more",,₹ 500,Indian Spinal Injuries Centre,Vasant Kunj,,09:00 AM,04:00 PM,Delhi
232,232,Dr. Chandeep Singh,Orthopedist,26.0,"MS - Orthopaedics, MBBS",,₹ 800,,,"Joint Pain Treatment, Joint Pain, Ankle Injury TreatmentNext ",06:30 PM,08:00 PM,Delhi
233,233,Dr. Gaurav Khera,Orthopedist,21.0,"MBBS, Diploma In Orthopaedics (D. Ortho), DNB - Orthopedics, Mch, MCH",₹ 700,₹ 300,Dr. Khera's Wellness Clinic,Inderpuri,"Knee Pain, Leg Pain, Joint PainNext ",06:00 PM,09:00 PM,Delhi
234,234,Dr. Rajesh Bhalla,Orthopedist,21.0,"M Ch. Ortho, MS - Orthopaedics, MBBS",₹ 600,₹ 300,Delhi Heart And Lung Institute,Delhi,,10:00 AM,11:00 AM,Delhi
235,235,Dr. Atul Kumar Garg,Orthopedist,24.0,"MBBS, MS - Orthopaedics, Fellowship In Arthroscopy & Arthroplasty, Advanced Life trauma Su...read more",₹ 400,₹ 700,Dr. Atul Kumar Garg's Clinic,Rohini,,07:00 PM,09:00 PM,Delhi
236,236,Dr. Siddharth Gupta,Orthopedist,9.0,"MBBS Bachelor of Medicine and Bachelor of Surgery, MS - Orthopaedics, DNB (Orthopedics)",₹ 800,₹ 300,Nulife Hospital & Maternity Center,Delhi,,05:30 PM,07:00 PM,Delhi
237,237,Dr. Abhimanyu Singh,Orthopedist,22.0,"MBBS, M. S. Orthopedics, M.ch. Orthopaedics, MD - Sports Medicine",₹ 300,₹ 300,Avni Healthcare,Delhi,"Hip Pain Treatment, Ankle Pain Treatment, Hip PainNext ",06:00 PM,06:30 PM,Delhi
238,238,Dr. S. Mahanta,Orthopedist,27.0,"MBBS, MS - Orthopaedics, DNB - Orthopedics, Fellowship Joint Replacement Surgery",₹ 600,₹ 700,The Bone Clinic,Dwarka Sector 6,,10:00 AM,01:00 PM,Delhi
239,239,Dr. Joginder Kumar,Orthopedist,25.0,"Msc( Sports Medicine ), M. Ch. (Ortho), MNAMS, DNB (Orthopedics), MBBS, Dip SEM",₹ 500,₹ 400,,,,,,Delhi
240,240,Dr. Sumit Garg,Orthopedist,18.0,"DNB (Orthopedics), Diploma In Orthopaedics (D. Ortho), MBBS",₹ 600,₹ 300,Jagmohan Bone & Joint Clinic,Pitampura,,06:15 PM,08:00 PM,Delhi
241,241,Dr. S.S Sanyal,Orthopedist,48.0,"MS - Orthopaedics, Diploma In Orthopaedics (D. Ortho), MBBS",,,,,"Back Pain, Knee Pain, Joint PainNext ",06:00 PM,08:30 PM,Delhi
242,242,Dr. Vimal Kumar Dakour,Orthopedist,20.0,,₹ 500,₹ 350,Motherhood Clinic,Lajpat Nagar,,08:00 AM,08:00 PM,Delhi
243,243,Dr. Arun Jain,Orthopedist,40.0,"MS - Orthopaedics, Diploma in Tuberculosis and Chest Diseases (DTCD), MBBS",₹ 500,₹ 500,Dr ARUN JAIN,Rohini,,11:00 AM,02:00 PM,Delhi
244,244,Dr. Pardeep Bageja,Orthopedist,28.0,"DNB - Orthopaedics, MBBS",,,,,"Joint Replacement, Joint PainNext ",06:00 PM,08:00 PM,Delhi
245,245,Dr. Anuj Jain,Orthopedist,17.0,"MBBS, MS - Orthopaedics, DNB  - Orthopaedics",₹ 800,₹ 500,,,,02:00 PM,04:00 PM,Delhi
246,246,Dr. Akhilesh Rathi,Orthopedist,20.0,"MCh Ortho, DNB Ortho, MS Ortho, MBBS",₹ 700,,Rathi Orthopaedic & Spine Clinic,Dwarka,"Ankle Pain Treatment, Joint Dislocation, Orthopedic SurgeryNext ",06:30 PM,08:30 PM,Delhi
247,247,Dr. Deepak Batra,Orthopedist,32.0,"MBBS, MS - Orthopaedics",₹ 400,,₹ 1,000 onlinePatel Hospital,,11:00 AM,02:00 PM,Delhi
248,248,Dr. Ashu Consul,Orthopedist,25.0,"MBBS, MS - Orthopaedics, M.Ch - Orthopaedics, MRCS-Ortho",₹ 600,,The Neo Orthopedic  Clinic,Dwarka,,06:00 PM,09:00 PM,Delhi
249,249,Dr. Amit Shridhar,Orthopedist,24.0,"MBBS, D (ORTHO), DNB (Orthopedics), MCH (Orthopedic), Spine Fellowship DePUY, Medtronics S...read more",₹ 700,,The Spine care Clinic,Pitampura,"Ankle Pain Treatment, Knee Pain, Back PainNext ",06:00 PM,08:00 PM,Delhi
250,250,Dr. Ridhi Narang,Gynaecologist,12.0,"M.B.B.S, MS - Obstetrics and Gynaecology, FMAS.Laparoscopy, Royal College of Obstetricians...read more",,₹ 450,The Clinics- By Surgeons House,Delhi,,09:00 AM,07:00 PM,Delhi
251,251,Dr. Garima Sachdeva,Gynaecologist,,,₹ 500,₹ 350,Pristyn care,Tagore Garden,,10:00 AM,08:00 PM,Delhi
252,252,Dr. Ketaki,Gynaecologist,,,₹ 500,,Pristyn Care Clinic,South Delhi,,05:00 PM,08:00 PM,Delhi
253,253,Dr. Rati Rabra,Gynaecologist,14.0,"MBBS, DGO",₹ 500,,Pristyn Care Clinic,West Delhi,,05:00 PM,08:00 PM,Delhi
254,254,Dr. Nipun Sharma,Gynaecologist,21.0,"MBBS, MS - Obstetrics and Gynaecology",₹ 600,,Kalpavriksh Super Speciality Center,Dwarka Sector 13,,11:00 AM,01:00 PM,Delhi
255,255,Dr. Reena,Gynaecologist,,,₹ 500,₹ 500,Pristyn Care Clinic,Delhi,,05:00 PM,08:00 PM,Delhi
256,256,Dr B,Gynaecologist,,,₹ 500,,Pristyn Care Clinic,Delhi,,05:00 PM,08:00 PM,Delhi
257,257,Dr. Seema Saxena,Gynaecologist,39.0,"MBBS, MS - Obs & Gynae (Gold Medalist)",,,,,,06:00 PM,08:00 PM,Delhi
258,258,Dr. Demo,Gynaecologist,,,₹ 200,₹ 100,Abc Clinic,Khanpur,,09:00 AM,05:00 PM,Delhi
259,259,Dr. Mannan,Gynaecologist,,,,,,,,10:00 AM,05:00 PM,Delhi
260,260,Dr. Shuchi Lakhanpal Kalia,Gynaecologist,,,₹ 500,,Pristyn Care Clinic,Noida,,05:00 PM,08:00 PM,Delhi
261,261,Dr. Arushi Aggarwal,Gynaecologist,15.0,"MBBS, MS - Obstetrics & Gynaecology",₹ 700,,Shubham Hospital,Kalkaji,,02:00 PM,07:30 PM,Delhi
262,262,Dr. Manika Khanna,Gynaecologist,28.0,"MBBS , MD - Obstetrics & Gynaecology, Diploma in advanced gynaecological endoscopy",,₹ 500,Gaudium IVF & Gynac Solution,Janakpuri,Trying to ConceiveNext ,11:00 AM,02:00 PM,Delhi
263,263,Dr. Rakhi Gupta,Gynaecologist,32.0,"FICOG, FICMCH, FIMSA, MD - Obstetrtics & Gynaecology, MBBS",,₹ 800,MI Heart & Women's Health Care Clinic and Diagnostic Centre,Sarita Vihar,"No Periods, Irregular Periods, Painful PeriodsNext ",05:00 PM,08:00 PM,Delhi
264,264,Dr. Yashica Gudesar,Gynaecologist,25.0,"MBBS, DNB - Obstetrics and Gynecology, DGO",₹ 700,₹ 500,Mother & Child Care Clinic,Dwarka,"Pregnancy, Polycystic Ovary Syndrome, Pregnancy QueryNext ",10:00 AM,12:00 PM,Delhi
265,265,Dr. Anju Ahuja,Gynaecologist,41.0,"DGO, MBBS",₹ 800,₹ 600,Ahuja Clinic,Saket,"Delay Periods, No Periods, PregnancyNext ",09:00 AM,11:00 AM,Delhi
266,266,Dr. Seema Sharma,Gynaecologist,32.0,"MBBS, DGO, MD - Obstetrics & Gynaecology, MRCOG",,₹ 500,Srishti Health Care Centre,Rajouri Garden,"No Periods, Irregular Periods, Avoid PregnancyNext ",05:30 PM,07:30 PM,Delhi
267,267,Dr. Jyotsna Gupta,Gynaecologist,23.0,"DNB (Obstetrics and Gynecology), PGDHHM, MBBS, FICMCH, MNAMS (Obstetrics and Gynecology)",₹ 700,₹ 700,Dr. Jyotsna's Clinic (Resi cum Clinic) Delhi,Delhi,Uterine BleedingNext ,07:30 PM,08:30 PM,Delhi
268,268,Dr. Pooja Choudhary,Gynaecologist,23.0,"MD - Obstetrtics & Gynaecology, MBBS",₹ 900,₹ 900,Gynae and ENT Clinic,Safdarjung Enclave,"No Periods, Irregular Periods, Trying to ConceiveNext ",05:00 PM,07:30 PM,Delhi
269,269,Dr. Shabnam,Gynaecologist,20.0,"DNB (Obstetrics and Gynecology) Tr, MBBS, Laparoscopy Training from AIIMS, PCOS Course don...read more",,,,,,11:00 AM,01:00 PM,Delhi
270,270,Dr. Aaditi Acharya,Gynaecologist,18.0,"MBBS, DGO",₹ 600,₹ 600,Wellness Clinic Apollo 24I7,Laxmi Nagar,"Termination Of Pregnancy, Abortion, No PeriodsNext ",05:30 PM,08:00 PM,Delhi
271,271,Dr. Vijay Lakshmi Rawat,Gynaecologist,29.0,"MBBS, MD - Obstetrtics & Gynaecology",,,,,"No Periods, Polycystic Ovary Syndrome, Trying to ConceiveNext ",01:00 PM,02:00 PM,Delhi
272,272,Dr. Seema Sehgal,Gynaecologist,36.0,"Art - Advance Course Infertility, MS - Obstetrics and Gynaecology, MBBS",,₹ 300,Dr Seema Sehgal's Clinic,Delhi,"Irregular Periods, No Periods, InfertilityNext ",06:30 PM,08:30 PM,Delhi
273,273,Dr. Aradhana Kalra Dawar,Gynaecologist,21.0,"MBBS, MS - Obstetrics and Gynaecology, DNB - Obstetrics & Gynecology, Post Graduate Diplom...read more",₹ 500,₹ 200,,,"Fertility, Fertilization, In Vitro Fertilization (IVF) Treatment",11:00 AM,03:00 PM,Delhi
274,274,Dr. Shakuntla Kumar,Gynaecologist,41.0,"Diploma In Endoscopic Surgery, DGO, MBBS",₹ 800,₹ 700,Nulife Hospital,Hakikat Nagar,"Caesarean Section, Pregnancy, SurrogacyNext ",10:00 AM,01:00 PM,Delhi
275,275,Dr. Prerna Gupta,Gynaecologist,20.0,"MBBS, MD - Obstetrtics & Gynaecology, MRCOG , Fellowship In ART",,₹ 400,Dr Prerna Gupta MD AIIMS clinic,Hauz Khas,,08:00 AM,04:00 PM,Delhi
276,276,Dr. Pratibha Gupta,Gynaecologist,24.0,"MBBS, MS - Obstetrics & Gynaecology",₹ 500,₹ 700,Healing Hands,Janakpuri,"Pregnancy, Delivery",11:00 AM,01:00 PM,Delhi
277,277,Dr. Nimmi Rastogi,Gynaecologist,29.0,"DGO, MBBS, Advanced Infertility",,₹ 500,Sarthak Medical Centre,Delhi,"Abortion, Pregnancy Query, Avoid Pregnancy",03:00 PM,05:00 PM,Delhi
278,278,Dr. Rita Bakshi,Gynaecologist,41.0,"MBBS, DGO, MD, Fellowship in Gynae Oncology",,,,,"Trying to Conceive, In Vitro Fertilization (IVF) Treatment, Infertility TreatmentNext ",09:00 AM,06:00 PM,Delhi
279,279,Dr. Sutopa Banerjee,Gynaecologist,27.0,"DNB (Obstetrics and Gynecology), DGO , MBBS",,,,,"Delivery, Gynae Problems, Laparoscopic Surgery (Obs  Gyn)Next ",05:00 PM,08:00 PM,Delhi
280,280,Dr. Chhavi,Gynaecologist,19.0,"MBBS, MS - Obstetrics and Gynaecology, DNB (Obstetrics and Gynecology)",₹ 300,₹ 500,Avni Healthcare,Rohini,"Gynae Problems, Delivery, FertilityNext ",06:00 PM,08:00 PM,Delhi
281,281,Dr. Vandana Gupta,Gynaecologist,39.0,"MS - Obstetrics and Gynaecology, MBBS",₹ 500,₹ 300,Archana Medical Centre,Mayur Vihar Phase 2,"Pregnancy, Polycystic Ovary SyndromeNext ",09:00 AM,01:30 PM,Delhi
282,282,Dr. Indira Das,Gynaecologist,39.0,"MBBS, DNB (Obstetrics and Gynecology), MD - Obstetrtics & Gynaecology",₹ 400,,₹ 3,000 onlineDr Indira's Clinic,"No Periods, Pregnancy, Irregular PeriodsNext ",08:00 PM,09:00 PM,Delhi
283,283,Dr. Vaishali Sharma M D ( A.I.I.M.S),Gynaecologist,18.0,"MD - Obstetrtics & Gynaecology, MBBS, Diploma In Specialised Advanced Gynaecological Endoscopy",,,,,"No Periods, Abortion, Avoid PregnancyNext ",09:00 AM,06:00 PM,Delhi
284,284,Dr. Sheetal Sachdeva,Gynaecologist,23.0,"DNB (Obstetrics & Gynecology), DGO, MBBS",₹ 800,₹ 800,Nest Gynae & Ortho Speciality Clinic,Delhi,"Delivery, Antenatal CareNext ",09:30 AM,10:30 AM,Delhi
285,285,Dr. Jyoti Chugh,Gynaecologist,39.0,"MD - Obstetrtics & Gynaecology, MBBS, DNB (Obstetrics and Gynecology)",₹ 800,,₹ 1,000 onlineSatyam Medical Centre,Gynae ProblemsNext ,10:00 AM,02:30 PM,Delhi
286,286,Dr. Shikha Jain,Gynaecologist,20.0,"FNB Reproductive Medicine, MD -Obstretics & Gynaecology, MBBS, Fellow ship of Indian Colle...read more",₹ 800,₹ 900,DREAMZ IVF,Pitampura,"Pregnancy Problems, Intra-Uterine Insemination (Iui), PregnancyNext ",09:00 AM,01:00 PM,Delhi
287,287,Dr. Gayatri  Bala,Gynaecologist,29.0,"MBBS, DGO, DNB - Obstetrics and Gynecology",,₹ 500,Ayoni Cure De Jouvence,Model Town,"No Periods, Irregular Periods, Pregnancy QueryNext ",09:00 AM,01:00 PM,Delhi
288,288,Dr. Supriya Kumari,Gynaecologist,20.0,"MBBS, DGO, DNB (Obstetrics and Gynecology)",₹ 300,₹ 300,Adarsh Hospital,Rohini,,11:00 AM,02:00 PM,Delhi
289,289,Dr. Usha. M. Kumar,Gynaecologist,35.0,"Diploma in Advance Endoscopy, Royal College of Obstetricians and Gynaecologists (MRCOG), MS, MBBS",,₹ 300,Saket City Hospital,Saket,"Sex Education, Pregnancy Query, AbortionNext ",09:00 AM,11:00 AM,Delhi
290,290,Dr. Ranjana Sharma,Gynaecologist,48.0,"FRCOG (LONDON) (Fellow of Royal College of Obstetricians and Gynaecologists), Royal Colleg...read more",,,,,"Pregnancy, Chromosomal Abnormality Screening, Pregnancy ProblemsNext ",12:00 PM,02:00 PM,Delhi
291,291,Dr. Aastha Gupta,Gynaecologist,14.0,"Advanced Infertility, Advanced Infertility, Diploma in Obstetrics & Gynaecology, MBBS",₹ 900,₹ 400,Delhi IVF & Fertility Center,Bengali Market,"Abortion, Pregnancy Query, InfertilityNext ",09:00 AM,06:00 PM,Delhi
292,292,Dr. Manju Aggarwal,Gynaecologist,32.0,"MBBS , DGO , FIMAS",₹ 800,₹ 500,Arihant Clinic,Delhi,"Sex Education, No Periods, Trying to ConceiveNext ",01:00 PM,04:00 PM,Delhi
293,293,Dr. Deepa Dureja,Gynaecologist,36.0,"MS - Obstetrics and Gynaecology, MBBS",₹ 700,₹ 600,Pulse Medical Centre,Greater Kailash,,12:00 PM,07:00 PM,Delhi
294,294,Dr. Priyata Lal,Gynaecologist,28.0,"FICOG, FICS, MS - Obstetrics and Gynaecology, DNB (Obstetrics and Gynecology), MBBS",₹ 600,,Shreeya Gynae Clinic,Delhi,"Gynae Problems, Termination Of Pregnancy, PregnancyNext ",06:00 PM,08:00 PM,Delhi
295,295,Dr. Shilpi Sachdev,Gynaecologist,25.0,"MBBS, DNB - Obstetrics & Gynecology, Diploma in Laparoscopy, Fellowship in Minimal Access Surgery",₹ 700,₹ 300,Dr. Shilpi Sachdev Clinic,Delhi,,11:00 AM,01:00 PM,Delhi
